House,Stone,350 sq.m.,2,5,2,Old Renovation,1000 sq.m.,Ararat › Nor Kharberd,"150,000 ֏ monthly",AMD,The mansion has a swimming pool in the yard. It is furnishedTranslated from Armenian,Dec-15-2022_21-43,Available,1 spot,7,Yes,No,Not included,2 months,,,https://list.am/en/item/18432695
House,Stone,60 sq.m.,1,3,1,Euro Renovation,230 sq.m.,Ararat › Nor Kharberd,"$46,000 monthly",USD,"Own house for sale in Nor Kharberd, has gas, permanent water. A cash system is installed.Translated from Armenian",Dec-15-2022_21-43,Partial Furniture,Not available,8+,Yes,Yes,Included,Without prepayment,,,https://list.am/en/item/18715565
House,Monolith,250 sq.m.,2,4,1,Euro Renovation,2500 sq.m.,"Միկոյան փողոց 22, Բերքանուշ","800,000 ֏ monthly",AMD,"I am renting a luxuriously renovated residential house in the village of Bercanush, Ararat region, at Mikoyan 33. Only 23 km from Yerevan, 20 minutes' drive. The house is equipped with high-quality property and equipment, has a ventilation system. It has a beautiful and well-kept garden with ornamental trees, a swimming pool and well-designed pavilions for outdoor entertainment.Translated from Armenian",Dec-15-2022_21-43,Available,1 spot,6,Yes,No,Not included,By Agreement,,,https://list.am/en/item/18344141
House,Stone,1700 sq.m.,3,8+,2,Major Renovation,1300 sq.m.,"Էլինա Մանասյան փողոց, Բուրաստան",$590 monthly,USD,"Сдается собственный дом в Арташате, село Бурастан, для одной iили двух семей 2 этажа, 3ий мансардный этаж, кухня, автостоянка машины, для двух грузовых машин есть автостоянка, гараж, площадь дома 500кв. М, 25 км от Еревана",Dec-15-2022_21-43,Available,1 spot,8+,Yes,No,Not included,1 month,,,https://list.am/en/item/18495144
House,Stone,131 sq.m.,1,4,2,Designer Renovation,2000 sq.m.,Ararat › Vosketap,"300,000 ֏ monthly",AMD,"For details, call the above phone number...Translated from Armenian",Dec-15-2022_21-43,Available,3 or more spots,6,Yes,Negotiable,Not included,2 months,"Television, internet, air conditioner, swimming pool, fireplace, barbecue oven, alarm system","Fridge, coffee maker, washing machine, water Heater, iron, hair dryer",https://list.am/en/item/18662322
House,Stone,220 sq.m.,2,8+,2,Euro Renovation,,"Ժ/Ն Թաղամաս 25, Այնթափ","380,000 ֏ monthly",AMD,"Single floor rental is also possible, entrances are separate.Translated from Armenian",Dec-15-2022_21-43,Available,3 or more spots,7,Yes,Negotiable,Not included,2 months,"Television, internet, air conditioner, barbecue oven, gazebo, alarm system","Fridge, stove, coffee maker, washing machine, water Heater, iron, hair dryer",https://list.am/en/item/18697385
House,Stone,110 sq.m.,1,4,1,Designer Renovation,240 sq.m.,Ararat › Masis,"$1,000 monthly",USD,"Прямо дома парк, физ городок, магазины",Dec-15-2022_21-43,,3 or more spots,2,Yes,Yes,Not included,1 month,,,https://list.am/en/item/18458087
House,Stone,200 sq.m.,1,4,1,Cosmetic Renovation,200 sq.m.,"5-րդ փողոց, Այնթապ","200,000 ֏ monthly",AMD,A sunny house furnished with all its facilities is urgently for rentTranslated from Armenian,Dec-15-2022_21-43,Available,Not available,6,Yes,No,Not included,1 month,,,https://list.am/en/item/18502069
House,Stone,1000 sq.m.,2,7,3+,Euro Renovation,600 sq.m.,"Բաղրամյան փողոց 12, Աբովյան","280,000 ֏ monthly",AMD,Own house for rent...Translated from Armenian,Dec-15-2022_21-43,Available,3 or more spots,8+,Yes,Yes,Not included,1 month,"Television, internet, fireplace, barbecue oven, gazebo","Fridge, stove, coffee maker, washing machine, water Heater, iron, hair dryer",https://list.am/en/item/18410173
House,Stone,200 sq.m.,2,7,3+,Partial Renovation,600 sq.m.,"6-րդ փողոց, Այնթափ","$2,000 monthly",USD,"Wonderful garden, swimming poolTranslated from Armenian",Dec-15-2022_21-43,Available,3 or more spots,8+,Yes,Yes,Included,By Agreement,"Television, internet, swimming pool, barbecue oven, gazebo","Fridge, microwave, coffee maker, dishwasher, washing machine, iron, hair dryer",https://list.am/en/item/18549010
House,Stone,270 sq.m.,2,8+,1,Euro Renovation,400 sq.m.,Ararat › Masis,"150,000 ֏ monthly",AMD,Дом с участкрм 300м два этажа сдается только первый этаж все условия для комфортного проживания возможна прдажа дома,Dec-15-2022_21-43,Not available,2 spots,8+,Yes,No,Not included,2 weeks,,,https://list.am/en/item/18396142
House,Stone,80 sq.m.,1,1,1,Partial Renovation,,Ararat › Mkhchyan,"200,000 ֏ monthly",AMD,"The house is not furnished, we will furnish it if desiredTranslated from Armenian",Dec-15-2022_21-43,By agreement,2 spots,4,Yes,No,Not included,1 month,,,https://list.am/en/item/18405525
House,Stone,120 sq.m.,1,4,1,Major Renovation,,"8-րդ փողոց, Այնթապ","300,000 ֏ monthly",AMD,"KOD-62203Այնթափում, վարձով է տրվում 4 սենյականոց տուն:^ Նոր վերանորոգված է^ Բոլոր հարմարություններն առկա են^ Արևկող, լուսավոր և շատ հարմարավետ բնակարան է^ Ընդարձակ և շատ հարմարավետ տուն է երկարաժամկետ բնակվելու համար",Dec-15-2022_21-43,Available,1 spot,5,Yes,No,Not included,1 month,,,https://list.am/en/item/18410281
House,Panels,1000 sq.m.,2,4,1,Euro Renovation,1000 sq.m.,"12-րդ փողոց, Այնթապ","250,000 ֏ monthly",AMD,"A two-story, 4-room private house is for rent, without an intermediary.Translated from Armenian",Dec-15-2022_21-43,Not available,Not available,3,Yes,Yes,Included,By Agreement,,,https://list.am/en/item/18483384
House,Panels,67 sq.m.,1,2,2,Euro Renovation,100 sq.m.,"Erevanyan street 33, Masis","150,000 ֏ monthly",AMD,"Квартира2 комнат отличний састаяние, 1 ераж, дома фсе ест. Здаётся 3-4 месяц",Dec-15-2022_21-43,Available,Not available,2,No,No,By Agreement,By Agreement,"Television, internet","Fridge, stove, microwave, coffee maker, washing machine, iron, hair dryer",https://list.am/en/item/18421129
House,Stone,157 sq.m.,1,4,2,Major Renovation,350 sq.m.,"Արարատյան փողոցի 3-րդ փակուղի, Նորաբաց","300,000 ֏ monthly",AMD,"A 4-room private house is for rent in Norabtsi.Fully renovated, if desired, together with furniture and household appliances.The house has all utilities and other amenities. It has a spacious yard, large and small pavilions, outdoor bathroom, outdoor kitchen, barbecue.The mansion is located 13 km from the center.Translated from Armenian",Dec-15-2022_21-43,By agreement,2 spots,8+,No,Yes,Not included,3 months,"Television, internet, air conditioner, barbecue oven, gazebo",,https://list.am/en/item/18644720
House,Stone,120 sq.m.,2,4,1,No Renovation,,Ararat › Hayanist,"100,000 ֏ monthly",AMD,"There are 4 rooms on the 2nd floor of the house, it has gas. The area of the 2nd floor is 120 square meters. M. The windows have been changed, and Euro windows have been installedTranslated from Armenian",Dec-15-2022_21-43,Not available,Not available,7,Yes,Negotiable,Not included,1 month,,,https://list.am/en/item/18647118
House,Stone,180 sq.m.,1,5,1,Cosmetic Renovation,50 sq.m.,Ararat › Azatashen,"150,000 ֏ monthly",AMD,"180m2 house for rent in Azatashen, 10 minutes from Yerevan. The house is in normal condition, gas, electricity, hot and cold water, heating, garage. Deposit:Translated from Armenian",Dec-15-2022_21-43,Available,1 spot,3,Yes,No,By Agreement,1 month,,,https://list.am/en/item/18468671
House,Stone,90 sq.m.,1,2,1,Designer Renovation,300 sq.m.,"26-th Line, Nor Kharberd","200,000 ֏ monthly",AMD,"Վարձակալությամբ է տրվում նոր, կահավորված, կոկիկ սեփական տուն, 17 րոպե տրանսպորտով մինչեւ հրապարակ։2 տակ քարով շարած արտակարգ վիճակում է տունը։Կահույքով եւ տեխնիկայով, ։Ամեն անհրաժեշտ պայմաններով:Բաքսի, կենտրոնական կոյուղի, ետնաբակով, վայ-ֆայ, կահուք, սպասք, ամեն ինչ բարձրորակ, մեծամասամբ իտալական եւ ռուսական։Երկաթյա դուռ, պարսպապատ:Հանգիստ փողոց, լավ հարեվաններ։Հենց տան մոտից տրանսպորտ դեպի մետրո 57-Գործարանային, Նժդեհ, Մալաթիա, Չերեմուշկա մինչեւ Դավիթաշեմ։ 55- մինչեւ 2 մասիվ, 5 րոպե ոտքով իջնեք ներքեւ, 33- դեպի Ռոսսիա, կենտրոն, Մաշտոց, Կոմիտասով մինչեւ Դավթաշեն, եւ շատ այլ համարներ հասնում են մինչեւ Ե/գ կայարան։Сдается новый, красивый, уютный дом 2-х летней индивидуальной постройки, с двухслойными каменными стенами, в идеальном состоянии, с мебелью и техникой.17 минут на машине от пл. Республики.Со всеми необходимыми условиями.Отопление, центральная канализация,Wi-fi, мебель, посуда, все качественное, в основном итальянское. Железная дверь, ворота, передний и задний двор, тихая улица, хорошие соседи. Транспорт рядом с домом 57 номер-до метро Заводская, Нжде, Малатия, Черемушка, Давиташен. 55 номер- до 2 масив. Спуститься пешком 5 минут, 33 номер в центр, Россия, Маштоц, Баграмяна, Комитас, Давташен и многие другие маршрутки доезжают дож/д вокзала.Все удобства необходимые для проживания есть.",Dec-15-2022_21-43,,1 spot,2,No,No,Not included,By Agreement,,,https://list.am/en/item/18544907
Country House,Stone,110 sq.m.,2,4,1,Cosmetic Renovation,2500 sq.m.,Ararat › Shahumyan,"$2,000 monthly",USD,"It is perfect. If it is uncomfortable, you can change everything.Translated from Armenian",Dec-15-2022_21-43,Not available,3 or more spots,7,Yes,Yes,By Agreement,By Agreement,,,https://list.am/en/item/18513430
House,Stone,150 sq.m.,1,5,1,Major Renovation,1200 sq.m.,"Улица Р. Хачикяна, Ванашен","450,000 ֏ monthly",AMD,"Сдается собственный дом с большим фруктовым садом, сроком от 1-ого до 6-и месяцев.Дом полностью отремонтирован. Мебель, бытовая техника, посуда и система отопления (baxi duo tec + котёл + антифриз) новые. Имеется качественная и быстрая связь Wi-Fi. Рядом с домом есть аптека и большой продуктовый магазин.Дом находится в 35 минутах езды от ближайшей станции метро Горцаранаин в Ереванe. До станции можно доехать также на маршрутных автобусах.Վեդի, Վանաշեն։Vedi, Vanashen.",Dec-15-2022_21-43,Available,2 spots,8+,Yes,Yes,Not included,1 month,"Television, internet, air conditioner, barbecue oven, gazebo","Fridge, stove, coffee maker, washing machine, water Heater, iron, hair dryer",https://list.am/en/item/18507206
House,Stone,118 sq.m.,1,4,1,Old Renovation,127 sq.m.,"7-րդ փողոց 15, Երևան","200,000 ֏ monthly",AMD,"The house has 4 rooms. It has a small but comfortable yard. There are 3 fruit trees in the yard. The house has old repairs but is in normal condition. There are euro windows, there is a TV, a washing machine. The house is fully furnished.Translated from Armenian",Dec-15-2022_21-43,Available,1 spot,7,Yes,Yes,Not included,2 months,"Television, air conditioner","Fridge, stove, washing machine, water Heater",https://list.am/en/item/18702805
Country House,Stone,1500 sq.m.,1,2,2,Designer Renovation,,Ararat › Artashat,"35,000 ֏ daily",AMD,"Green country house area with swimming pool for rentThere is a sieve,summer kitchenPool 12/4/2Spacious yard,summer pavilion for 25--30 peopleOvernight stay at the house is not provided.The price is negotiable depending on the week, days and number of persons40,000 Saturdays and SundaysCheck in (entrance) – 10:00Check out - 22:00Code 0013Translated from Armenian",Dec-15-2022_21-43,Available,2 spots,8+,Yes,Yes,Not included,By Agreement,,,https://list.am/en/item/17833482
House,Bricks,120 sq.m.,2,5,1,Partial Renovation,510 sq.m.,Ararat › Abovyan,"200,000 ֏ monthly",AMD,"Сдаю в аренду дом. Удобный, большой, красивый, 5 комнат. Для более подробной нформации - звоните!Дом 120 кв/мЗемялной участок 510кв/м",Dec-15-2022_21-43,,,5,Yes,Yes,Not included,1 month,,,https://list.am/en/item/18549898
House,Stone,40 sq.m.,1,2,1,Major Renovation,30 sq.m.,Ararat › Geghanist,"150,000 ֏ monthly",AMD,"A two-room newly built uninhabited house for rent, furniture and appliances. It is located on the main road. There is a supermarket in the area.Pharmacy. There are two similar houses, each with 3 rooms.Translated from Armenian",Dec-15-2022_21-43,Available,2 spots,4,Yes,Yes,Not included,By Agreement,"Television, internet, air conditioner","Fridge, washing machine, water Heater",https://list.am/en/item/18534082
Country House,Monolith,150 sq.m.,2,4,1,Euro Renovation,500 sq.m.,"Օգոստոսի 23, Արտաշատ","200,000 ֏ monthly",AMD,"Сдается в аренду большой частный дом со всеми коммуникациями в городе Арташат. Он имеет 2 спальни, большую столовую, кухню, ванную комнату, большой открытый балкон. Есть все коммуникации, имущество, техника, кондиционер, индивидуальная система отопления.Վարձով է տրվում մեծ, կոմունալ բոլոր հարմարություններով հագեցած սեփական առանձնատուն Արտաշատ քաղաքում, Մրգավան, Erevan City հարևանությամբ։ Ունի 2 ննջասենյակ, մեծ ճաշասենյակ, խոհանոց, սանհանգույց, մեծ բաց պատշգամբ։ Առկա է կոմունալ բոլոր հարմարությունները, գույք, տեխնիկա, օդորակիչ, անհատական ջեռուցման Բաքսի համակարգ։",Dec-15-2022_21-43,Available,2 spots,6,Yes,Yes,Not included,By Agreement,"Television, internet, air conditioner, barbecue oven, gazebo, alarm system","Fridge, stove, microwave, washing machine, water Heater, iron",https://list.am/en/item/18510678
House,Stone,70 sq.m.,1,3,1,Major Renovation,,Ararat › Khachpar,"150,000 ֏ monthly",AMD,"The apartment is completely renovated. It has hot and cold water. It includes a kitchen, a living room, a bedroom, a bathroom.Translated from Armenian",Dec-15-2022_21-43,Not available,Not available,8+,Negotiable,No,Not included,1 month,,,https://list.am/en/item/18695678
Country House,Stone,150 sq.m.,1,4,2,Designer Renovation,700 sq.m.,"Արամի փողոց 3, Ղուկասավան","$1,500 monthly",USD,"Վարձով է տրվում նորակառույց տուն Երևանից 2կմ հեռավորության վրա։Գտնվում է իդեալական վիճակում։Հնարավոր է նաև վարձակալել որպեսԳրասենյակ։Բոլոր հարմարություններով ապահովված է։Ավտոկայանատեղի, երկու մուտք, բաց պատշգամբ,ջուր, գազ, հոսանք, ինտերնետ։Գինը պայմանագրային։Վարձով տուն․վարձակալությունՏունը նաև վաճառվում էСдается новопостроенный дом в 2 км от Еревана.Он в идеальном состоянии.Так же возможна аренда какОфис, полностью оборудован, парковка, два входа, открытый балкон.Вода, газ, свет, интернет.Цена договорная.Дом в аренду: АрендаВозможна продажа.Translated from Armenian",Dec-15-2022_21-43,Available,3 or more spots,3,Yes,No,Not included,By Agreement,,,https://list.am/en/item/18403619
House,Stone,100 sq.m.,1,3,1,Major Renovation,1700 sq.m.,Ararat › Marmarashen,"200,000 ֏ monthly",AMD,Сдается 1-этажный частный дом (также посуточно) со всеми удобствами. Находится в 12 км от Еревана.,Dec-15-2022_21-43,Available,2 spots,4,Yes,No,Not included,By Agreement,"Television, internet, air conditioner, barbecue oven","Fridge, stove, washing machine, water Heater, iron, hair dryer",https://list.am/en/item/18624299
House,Stone,1000 sq.m.,2,4,1,Partial Renovation,700 sq.m.,Ararat › Verin Artashat,"160,000 ֏ monthly",AMD,"A two-story residential house for rent in Verin Artashat. The house is located on the central street, next to the Ararat supermarket. The living area of the house is 260 square meters. M. E. There are also 2 refrigerators intended for fruit: A small and a large refrigerator. The house can be used both for activities, it has a wide front, and for agriculture - a greenhouse. On one side of the house, the road leads to c. Artashat, on the other hand, G. Aygestan, cDvin. The roads on both sides are paved. Call us if you have any questions, we will be happy to answerTranslated from Armenian",Dec-15-2022_21-43,Available,Not available,6,Yes,Yes,Not included,By Agreement,,,https://list.am/en/item/18416836
House,Stone,40 sq.m.,2,2,1,Euro Renovation,400 sq.m.,"Dprocakanner alley, Masis","100,000 ֏ monthly",AMD,"The tenth floor of a two-story building is for rent. For details, call and visit the office.Translated from Armenian",Dec-15-2022_21-43,Not available,1 spot,2,No,No,Not included,2 months,,,https://list.am/en/item/18549698
House,Stone,105 sq.m.,1,5,1,Major Renovation,800 sq.m.,"Մ. Հերիքյան, Դաշտավան","180,000 ֏ monthly",AMD,"A private house for rent very close to Yerevan, with all utilities, constant hot and cold water. One bedroom out of 5 rooms is for rent, long-term, the owners also live in the house.Translated from Armenian",Dec-15-2022_21-43,,,1,No,No,By Agreement,2 months,,,https://list.am/en/item/18545030
House,Stone,190 sq.m.,1,3,1,Major Renovation,1000 sq.m.,"Artashat Highway, Yerevan","280,000 ֏ monthly",AMD,"The living area is 190 square meters. It has a heating system. 5 bedrooms, 2 bathrooms. Available long term only.Translated from Armenian",Dec-15-2022_21-43,,2 spots,6,Yes,Yes,Not included,2 months,,,https://list.am/en/item/16982967
House,Stone,50 sq.m.,2,1,1,Major Renovation,10 sq.m.,Ararat › Ghukasavan,"120,000 ֏ monthly",AMD,1 room for rent. House near Yerevan.Capital renovatedOn the ground floor is the garageThere is a security systemCall with viber or whatsapp number.Translated from Armenian,Dec-15-2022_21-43,Not available,1 spot,2,Negotiable,No,Not included,1 month,Alarm system,,https://list.am/en/item/18610185
House,Stone,80 sq.m.,1,5,1,Partial Renovation,100 sq.m.,Ararat › Artashat,"130,000 ֏ monthly",AMD,The house is located in the city of Artashat. I rent it without a gardenTranslated from Armenian,Dec-15-2022_21-43,,,6,Yes,No,Not included,2 months,,,https://list.am/en/item/18485336
House,Stone,75 sq.m.,1,3,1,Designer Renovation,1000 sq.m.,"12-րդ փողոց 2, Նոր Խարբերդ","15,000 ֏ monthly",AMD,"Բնակարանը գտնվում է Կենտրոնից 10կմ հեռավորության վրա: Մաքուր անկողին, մաքուր սպասք ջեռուցվում է օդորակիչով: Հագեցաց կոմունալ բոլոր հարմարություններով:Квартира расположена в 10 км от центра. Чистая постель, чистая посуда, отопление с кондиционером. Удовлетворены всеми коммунальными услугами.",Dec-15-2022_21-43,,,4,Yes,Yes,Included,By Agreement,,,https://list.am/en/item/18519699
House,Stone,100 sq.m.,2,4,1,Old Renovation,,Ararat › Masis,"100,000 ֏ monthly",AMD,"The house is for rent, call for detailsTranslated from Armenian",Dec-15-2022_21-43,Available,1 spot,4,Yes,No,By Agreement,By Agreement,Television,Fridge,https://list.am/en/item/18672876
Country House,Stone,700 sq.m.,1,2,1,Cosmetic Renovation,600 sq.m.,Ararat › Geghanist,"$57,000 monthly",USD,"It has 1 bedroom, 1 kitchen, 1 living room. There is also a warehouse on the land. It is provided with constant watering and drinking water, electricity. The land is fenced. It is installed with iron doors. The land is full of fruit bushes and fruit trees.Translated from Armenian",Dec-15-2022_21-43,Available,2 spots,3,Yes,Yes,Not included,By Agreement,,Fridge,https://list.am/en/item/18484714
House,Stone,100 sq.m.,2,4,1,Cosmetic Renovation,2000 sq.m.,"Օղակաձև փողոց 3, Արարատ","70,000 ֏ monthly",AMD,"The house is cosmetically renovated, equipped with all utilities and a bathroom. Call for details.Translated from Armenian",Dec-15-2022_21-43,,,,,,,,,,https://list.am/en/item/18321906
House,Stone,440 sq.m.,2,8+,1,Euro Renovation,1471 sq.m.,Ararat › Arevshat,"300,000 ֏ monthly",AMD,"A 2-storey private house is for rent in Arevshat village of Ararat region.The total area of the land is 1471 sq/mThe total area of the house is 440.6 sq/mFront part: 15mCeiling height: 3.5mConsist of,from 2 lobbiesfrom 2 living roomsfrom 5 bedroomsfrom the officefrom the kitchenfrom the bathroomfrom a spacious terrace with a beautiful view of the garden and Mount AraratThe house is in a clean condition, it is furnished. The floor is covered with parquet and tiles. All communications are available. It is fenced, has a spacious yard and a garden with fruit trees. There is outdoor parking for 7-8 cars.Kind Regards #AsatryanConsulting teamThe best for you!Best for you!Best for you!The best for you!The best for you!Most suitable for you!Code 18407132Translated from Armenian",Dec-15-2022_21-43,Available,3 or more spots,8+,Yes,Yes,Not included,1 month,,,https://list.am/en/item/18407132
House,Stone,140 sq.m.,1,2,1,Euro Renovation,400 sq.m.,"Kentronakan Street 7/1, Khachpar village","150,000 ֏ monthly",AMD,"A private house is for rent in Khachpar village, 12 km from the center of Yerevan. The house is renovated in Euro, all facilities are available. Permanent high-speed Internet. The house is located directly on the main street.Translated from Armenian",Dec-15-2022_21-43,Available,Not available,2,Yes,Yes,Not included,Without prepayment,"Television, internet, barbecue oven",,https://list.am/en/item/18665350
House,Stone,80 sq.m.,1,1,2,Partial Renovation,800 sq.m.,Ararat › Zorak,"50,000 ֏ monthly",AMD,"Сдается комната в собственном доме 25кв. М представителям женского пола (одинокая женщина, студенты), для совмесного проживанияВ доме есть все удобства, постоянная горячая, холодная вода, газ. Большой18мкрытый балкон Безлимитный интернет wf.Для более подробной информации звонить",Dec-15-2022_21-43,,,,,,,,,,https://list.am/en/item/17823011
House,Stone,450 sq.m.,2,6,3+,Major Renovation,2000 sq.m.,Ararat › Masis,"80,000 ֏ daily",AMD,"A recreation area with a swimming pool is for daily rent (only the yard area), it is fenced and equipped with all the necessary conditions for recreation.For 30 people.* Swimming pool* Outdoor pavilion for up to 30 peoplefor* Booth for coffee* 1 refrigerator* Furniture made in design style (tables, chairs, etc.)* Mangal (bottles)* Tone* Dishes* Gas stove* Source* Pendulum* Flower garden*Fruit treesThe house is rented from 10:00 to 23:00The house is not provided with overnight stay!The house is only rented to families.Call for family events only.It is also given to take the bride out of the house for wedding ceremoniesWe also offer additional services for your event:*DJ:*Photo and video shooting*Buffet*FormationTranslated from Armenian",Dec-15-2022_21-43,Available,3 or more spots,8+,Yes,No,Not included,By Agreement,,,https://list.am/en/item/18261157
House,Stone,120 sq.m.,1,4,1,Major Renovation,,"Հերիքյան փողոց 23, Դաշտավան","155,000 ֏ monthly",AMD,"Close to the city, on a central streetTranslated from Armenian",Dec-15-2022_21-43,Available,1 spot,4,Yes,Negotiable,Not included,2 months,"Television, swimming pool, barbecue oven","Dishwasher, water Heater",https://list.am/en/item/18656052
House,Stone,180 sq.m.,1,5,2,Partial Renovation,400 sq.m.,Ararat › Hovtashat,"120,000 ֏ monthly",AMD,The house is gasified. 17 km from YerevanTranslated from Armenian,Dec-15-2022_21-43,,,1,Yes,Yes,Not included,2 months,,,https://list.am/en/item/18530663
