House,Stone,120 sq.m.,2,4,1,Old Renovation,2000 sq.m.,Ararat › Mkhchyan,"65,000 ֏ monthly",AMD,"The house is old and renovated, for details call the indicated phone numberTranslated from Armenian",Dec-15-2022_21-43,Available,2 spots,4,Yes,Yes,Not included,By Agreement,"Television, internet, air conditioner","Fridge, stove, microwave",https://list.am/en/item/18650256
House,Stone,180 sq.m.,2,5,1,Major Renovation,1000 sq.m.,"8th Street 4, Geghanist village","170,000 ֏ monthly",AMD,"A house built under two stones. Araj floor, 2 bedrooms, kitchen, bathroom.On the second floor there is 1 bedroom for 2 people, a balcony. Large foyer, ////phone for detailsTranslated from Armenian",Dec-15-2022_21-43,By agreement,1 spot,5,Yes,Yes,Not included,1 month,,,https://list.am/en/item/18530185
House,Stone,120 sq.m.,1,4,1,Cosmetic Renovation,,"Ереванская улица, Масис","200,000 ֏ monthly",AMD,"Сдается дом в г. Масис.️15 минут до Еревана️дом находится на центральной улице (при въезде в Масис)️все необходимое для проживания имеется (стиральная машина, холодильник, пылесос, утюг, wi-fi)️супермаркет, остановка в шаговой доступности",Dec-15-2022_21-43,Available,Not available,5,Yes,Yes,Not included,By Agreement,"Television, internet","Fridge, stove, washing machine, iron",https://list.am/en/item/18593976
House,Stone,220 sq.m.,1,6,1,Major Renovation,,"20-я улица 31, Айнтап","250,000 ֏ monthly",AMD,"A 6-room apartment on the 2nd floor of a 2-story building is for rent. The apartment is completely renovated with the best high-quality construction materials, there is constant hot and cold water, Baxi heating system. The house is lit from 4 sides by natural light, has 3 bedrooms, 1 living room, 1 bathroom, 1 kitchen, 1 hallway and hallway. There is a large garage with electric gates on the first floor and a large storage area under the stairs on the first floor. There is a grocery store on the first floor of the building, where you will find all the basic necessities. There is a balcony overlooking the street from the living room on the second floor.The location of the house is very favorable. Located just 100 meters from the main street of the community and the bus stop. For details, call the indicated phone number.Translated from Armenian",Dec-15-2022_21-43,,,,,,,,,,https://list.am/en/item/18419834
House,Stone,120 sq.m.,2,5,2,Old Renovation,400 sq.m.,"Սամվել Հակոբյան փողոց, Արտաշատ","120,000 ֏ monthly",AMD,Own house for rent. It is provided with hot and cold water. There is 400 meters of land and nests for animals.Translated from Armenian,Dec-15-2022_21-43,By agreement,3 or more spots,4,Yes,Yes,Not included,1 month,,,https://list.am/en/item/18478505
House,Stone,50 sq.m.,1,2,1,Cosmetic Renovation,,Ararat › Geghanist,"160,000 ֏ monthly",AMD,"2-room private houses for rent, each with an area of 50 square meters. Newly renovated, close to the bus stop, there is a supermarket, kindergarten, school nearby. We will provide some property. Those who wish can call the indicated phone number.Translated from Armenian",Dec-15-2022_21-43,,,4,Yes,Yes,Not included,By Agreement,,,https://list.am/en/item/18500729
House,Wooden,50 sq.m.,2,3,1,Major Renovation,1000 sq.m.,Ararat › Lanjazat,"540,000 ֏ monthly",AMD,"A beautiful wooden house for rent in Lanjazat community, in the area of the lake, with a beautiful view and all amenities.Translated from Armenian",Dec-15-2022_21-43,Available,Not available,5,Yes,Yes,Not included,By Agreement,,,https://list.am/en/item/18563621
House,Stone,100 sq.m.,2,4,1,Partial Renovation,2500 sq.m.,Ararat › Sisavan,"50,000 ֏ monthly",AMD,"Private house partially renovated. There is gas, hot and cold water.Translated from Armenian",Dec-15-2022_21-43,,,,,,,,,,https://list.am/en/item/18407748
House,Stone,75 sq.m.,1,2,1,Major Renovation,,"6-րդ փողոց 1, Նոր Խարբերդ","200,000 ֏ monthly",AMD,"First floor, separate entrance, hot and cold water, gas, stove, plot of land, pantry. Furniture, equipmentTranslated from Armenian",Dec-15-2022_21-43,Available,Not available,3,Yes,No,Not included,By Agreement,,,https://list.am/en/item/18489021
House,Stone,90 sq.m.,1,3,1,Major Renovation,300 sq.m.,"26-th Line, Nor Kharberd","2,000,000 ֏ monthly",AMD,"A house is urgently for rent in New KharberdThe house is equipped with everything - furniture - appliances - internet, heating, internet, garden.For other details, call the indicated telephone numbersTranslated from Armenian",Dec-15-2022_21-43,Available,3 or more spots,2,Yes,Yes,Not included,By Agreement,"Television, internet, air conditioner, barbecue oven","Fridge, stove, microwave, coffee maker, dishwasher, washing machine, water Heater, iron, hair dryer",https://list.am/en/item/18561059
House,Stone,100 sq.m.,2,4,1,Partial Renovation,1000 sq.m.,Ararat › Hayanist,"120,000 ֏ monthly",AMD,A house for rent in Hayanist. There is gas and water.Translated from Armenian,Dec-15-2022_21-43,Available,1 spot,7,Yes,Negotiable,Not included,1 month,,,https://list.am/en/item/18591808
House,Stone,42 sq.m.,1,2,1,Euro Renovation,42 sq.m.,Ararat › Geghanist,"200,000 ֏ monthly",AMD,"UrgentOwn house for rent in Geghanist, has electricity, gas, water, air conditioner, newly renovated.Translated from Armenian",Dec-15-2022_21-43,Available,Not available,7,Yes,Yes,Not included,By Agreement,"Television, internet, air conditioner","Fridge, washing machine, water Heater",https://list.am/en/item/18544603
Country House,Stone,80 sq.m.,1,3,1,Old Renovation,400 sq.m.,"Արցախի պողոտա 73/4, Երևան","100,000 ֏ monthly",AMD,There are appliances and furnitureTranslated from Armenian,Dec-15-2022_21-43,Available,1 spot,5,Yes,Yes,Not included,2 months,,,https://list.am/en/item/18566380
House,Stone,62 sq.m.,1,2,1,Cosmetic Renovation,480 sq.m.,"22-րդ փողոց, Նոր Խարբերդ","200,000 ֏ monthly",AMD,"Call for questions, vin is not mandatoryThe correct address is Nor Kharberd 22 street 4 houseTranslated from Armenian",Dec-15-2022_21-43,,Not available,2,Yes,Yes,Not included,By Agreement,,,https://list.am/en/item/18582326
House,Stone,140 sq.m.,1,4,1,Partial Renovation,1000 sq.m.,"Улица Саркиса Касьяна, Веди","140,000 ֏ monthly",AMD,"Сдается собственный дом в городе Веди, расположенный в центральной части. Площадь дома 140 квадратных метров. 2 спальни, гостиная и большая столовая.Сдается на длительный срокИнтернет + WiFiУдобный двор с отдельным местом для парковки.От Плошади Республики – 50км.Վարձով է տրվում սեփական տուն Վեդի քաղաքում, գտնվում է կենտրոնական մասում։ Տան մակերեսը 140 քմ։ 2 ննջասենյակ, հյուրասենյակ և մեծ ճաշասենյակ։Ունի պտղատու այգի։ Հողատարածքի ընդհանուր մակերեսը 1000 քմ։ ։ Առանձին տարածք նախատեսված է որպես ավտոկայանատեղիՏրվում է երկարաժամկետ։Վարձակալության դեպքում տունը կհամալրվի անհրաժեշտ պարագաներով։Հեռավորությունը Հանրապետության Հրապակարից 50կմ է",Dec-15-2022_21-43,Available,1 spot,6,Yes,No,Not included,1 month,,,https://list.am/en/item/18458335
House,Stone,300 sq.m.,2,4,1,Old Renovation,1600 sq.m.,"Улица Егише Чаренца 16, Каначут","300,000 ֏ monthly",AMD,"The house is partially renovated, those who want can repair it themselves, the money will come out of the rentTranslated from Armenian",Dec-15-2022_21-43,,,8+,Yes,Yes,Not included,1 month,,,https://list.am/en/item/18388999
House,Stone,90 sq.m.,1,3,1,Euro Renovation,300 sq.m.,"Araratyan street, Masis","100,000 ֏ monthly",AMD,Сдаетсьа дом. В центре Масиса. Всеми комуналними услугоми. Газ нету.,Dec-15-2022_21-43,,,5,Yes,Yes,Not included,2 months,,,https://list.am/en/item/18483743
House,Stone,120 sq.m.,1,5,1,Old Renovation,400 sq.m.,"Улица Акселя Бакунца 5, Арташат","100,000 ֏ monthly",AMD,"Сдаётся одноэтажный (5 комнатный) дом в Арташате площадь дома - 120 кв. М.В доме 4 спальных мест, 1 гаражное место, налажены коммуникации, раздельная ванная комната.Туалет уличный. Помогу с проведением интернета. Газовая плита на кухне.На территории есть огород, в котором есть виноградная, абрикосовые деревья, разнообразные плодовитые деревья.Проживание с детьми и питомцами поощряется. Предпочтительно русскоговорящим семьям.При долгосрочной аренде возможна перепланировка интерьера и дома по согласованию.Стоимость только в долгосрочную аренду от 6 месяцев: 100 000 драмов в месяц.Коммунальные платежи отдельно. Оплата за 3 месяца вперед. Писать лучше в вотсап.",Dec-15-2022_21-43,,,6,Yes,Yes,Not included,3 months,,,https://list.am/en/item/18542358
House,Stone,100 sq.m.,2,3,1,Euro Renovation,400 sq.m.,Ararat › Masis,"150,000 ֏ monthly",AMD,"Сдается 1 этаж 2 х этажного дома в г. Масис, 100 кв. Огород, двор.Все уловия.",Dec-15-2022_21-43,,,4,Yes,Yes,Not included,1 month,,,https://list.am/en/item/18510696
House,Stone,50 sq.m.,2,2,1,Major Renovation,60 sq.m.,"Atoyan Street, Yerevan","150,000 ֏ monthly",AMD,"A two-story stone house is for rent in Nor Kharberd. The private house is completely renovated, not yet inhabited, air conditioner is installed, it is rented empty, only kitchen furniture is installed.Translated from Armenian",Dec-15-2022_21-43,,,5,Yes,No,Not included,By Agreement,,,https://list.am/en/item/18125660
House,Stone,60 sq.m.,1,1,1,Major Renovation,1 sq.m.,"Ogostosi 23, Artashat","200,000 ֏ monthly",AMD,"Apartment for rent in Artashat, fully renovated, call for detailsTranslated from Armenian",Dec-15-2022_21-43,,,8+,Yes,No,Included,By Agreement,,,https://list.am/en/item/18482036
House,Stone,330 sq.m.,2,5,3+,Major Renovation,5000 sq.m.,Ararat › Norabats,"$2,500 monthly",USD,"A 2-story private house is for rent ($2500) or for sale in Norabats. Number of rooms: 5. The house is modernly renovated. The entrance door is iron, the windows are euro, the floor is presgranite and parquet. 3 bathrooms, modern tiled, e. Wires and pipes - new. It has a parking space for 4 cars, a heating system, constant water and gas. Solar panels are installed, electricity is free. It is sold together with furniture and appliances. There is a swimming pool in the yard. There is 4000 sq. M. Next to the mansion. Fruit garden: Located in the center of the community, 10 km from the center of Yerevan.Translated from Armenian",Dec-15-2022_21-43,,,7,Yes,No,Not included,By Agreement,,,https://list.am/en/item/18464563
House,Stone,280 sq.m.,2,6,2,Designer Renovation,1000 sq.m.,Ararat › Geghanist,"$2,000 monthly",USD,"A newly built beautiful private house is for rent in Geghaniste community, 6.5 km from Yerevan. Provided with all utilities:Individual heating system and internet.The house is rented with all the furniture and appliances. It has a summer kitchen, a garage, a beautiful large garden and a garden.Only potential applicants should apply.Translated from Armenian",Dec-15-2022_21-43,,,5,Yes,No,Not included,By Agreement,,,https://list.am/en/item/18464424
