Hotel,"10,000 sq.m.",Gegharkunik › Sevan,"$70,000",USD,"Տրվում է վարցակալության երկարաժամկետ կառավարման նորակառույց, շքեղ շինություն Դրախտիկում, էկո տարածք, ամենատաք ափը, Կապուտակ Սևան համալիրի հարևանությամբ) Դեսպանատան, ՏՏ Ընկերությունների, ռեստորանի և այլ, ունի բոլոր հարմարոթյունները հանգիստը վայելելու համար, սկուտեռներ, կվադռոցիկլներ, կատեռ, կա լողավազան սաունա և այլի հարմարություններ ։ Сдаётся в для управления долгосрочной аренды, элитное здание в село Драхтик, Эко район, самое теплое побережье, рядом с комплексом Капутак Севан) посольств, IТ-компаний, ресторанов и др. , есть все удобства для проживания и. Т. Д, скутеры, квадроциклы, катер, есть бассейн, сауна и другие удобства. An elite building for rent in Drakhtik, eco-district, the warmest coast, next to the Kaputak Sevan complex for rent under long-term lease management) suitable for hotels, embassies, IT companies, restaurants, etc. There is a swimming pool, sauna and other amenities.",Dec-15-2022_21-29,Available,Not available,First Line,Separate from the Street,Direct Lease,1 year,2 months,Not included,,https://list.am/en/item/18385421
Functioning Business,50 sq.m.,Gegharkunik › Sevan,"200,000 ֏",AMD,"The apartment is located on the Sevan highway, 5 km away from Sevan, at Yerevan-Sevan highway 71/1, the apartment has been used as a grocery store for 3 years. CALL FORTranslated from Armenian",Dec-15-2022_21-29,Available,Available,First Line,Common from the Street,Direct Lease,1 year,Without prepayment,By Agreement,,https://list.am/en/item/18511984
Automotive Service,70 sq.m.,"Երևանյան խճուղի 3, Սևան","100,000 ֏",AMD,"It is newly built, equipped with all facilities, the area is located at the gas station, Moshni! There is movementTranslated from Armenian",Dec-15-2022_21-29,By agreement,Not available,First Line,Common from the Street,Direct Lease,6 months,Without prepayment,Included,,https://list.am/en/item/18082590
Industrial and Manufacturing,24 sq.m.,"Մյասնիկյան փողոց 16, Մարտունի","60,000 ֏",AMD,"In the center of Martuni, a commercial area of 24 square meters is for rent. It used to be a sewing workshop.Translated from Armenian",Dec-15-2022_21-29,,,,,,,,,,https://list.am/en/item/18417200
Hotel,2300 sq.m.,"1-я улица, Чкаловка",$50,USD,"Сдается в аренду полностью гостиничный комплекс, либо возможна процентная ставка от ДОХОДА МОИ НАБЕРЁМ РАБОЧИЙ СОСТАВ, В ГОСТИНИЦЕ 3 ЭТАЖА, 16 номеров, 4 зала, холЫ, склады, много комнат для других нужд, кухня, БАССЕЙНЫ, БИЛЬЯРД. Стоит в очень красивом месте у ОЗЕРА севан в селе чкаловка, все вопросы обсуждаются на месте. Цена ДОГОВОРНАЯ! . Красивый вид на озеро севан. Все вопросы обсуждать лучше на месте! Гостиница находится на трассе СЕВАН - гавар. (СЕЛО ЧКАЛОВКА В СЕВАНЕ! ) прям у берега ОЗЕРА! ОЧЕНЬ БОЛЬШОЙ НАПЛЫВ ТУРИСТОВ В ДАННОЙ МЕСТНОСТИ!",Dec-15-2022_21-29,,,,,,,,,,https://list.am/en/item/18417226
Industrial and Manufacturing,850 sq.m.,"Azatutyan Street 4th Deadlock, Gavar","$130,000",USD,Магазин ЭлектроникиТерритория полностью подлежит ремонтированию12 комнатОдно общее помещение - входная,Dec-15-2022_21-29,,,,,,,,,,https://list.am/en/item/18504133
Everything Else,50 sq.m.,"Улица Ереванян 72/1, Мартуни","200,000 ֏",AMD,Сдаëтся коммерческое помещение!Все вопросы по телефону!,Dec-15-2022_21-29,,,,,,,,,,https://list.am/en/item/18458642
