Type,Land Area,Address,Price,Currency,Description,Datetime,Service Lines,Links
Agricultural,"45,000 sq.m.",Armavir › Armavir,"$45,000",USD,"Արմավիրի մարզի Տալվորիկ գյուղի տարածքում վաճառվում է 13 տարեկան բերքատու այգի 4.5 հա, մոտ 1650 հատ ծառ (սալորենիների տեսականի, դեղձենի, ծիրանենի, գիլաս և նուշ)Нажмите здесь, чтоб",Nov-25-2022_00-56,,https://list.am/en/item/15674546
For Residential Development,780 sq.m.,"2nd Street 9, Musaler","$23,000",USD,"Urgent sale of a plot of land near the house in Musalee, a residential neighborhood near the school next to the central roadTranslated from Armenian",Nov-25-2022_00-56,,https://list.am/en/item/18019402
Agricultural,"30,000 sq.m.","Armavir Highway, Nor Kesaria","12,000,000 ֏",AMD,Call a vineyard standing rose typeTranslated from Armenian,Nov-25-2022_00-56,,https://list.am/en/item/17764727
Agricultural,2100 sq.m.,Armavir › Janfida,"$10,000",USD,"An orchard with 55 8-year-old cherries is for sale in the village of Janfida. Roads pass on both sides of the land, directIrrigation water, drinking water and electricity pass by the land. The price will be negotiated.Translated from Armenian",Nov-25-2022_00-56,,https://list.am/en/item/17168830
For General Purpose,1200 sq.m.,Armavir › Parakar,"$55,000",USD,M5 highway2nd line,Nov-25-2022_00-56,,https://list.am/en/item/12125261
For Residential Development,1000 sq.m.,Armavir › Echmiadzin,"$3,800",USD,"Վաճառվում է 1000 քմ տնամերձ հողատարածք Արմավիրի մարզի Շահումյան գյուղում, Էջմիածնից 3կմ հեռավորության վրա։Tnamerdz Shahumyan Ejmiatsin",Nov-25-2022_00-56,,https://list.am/en/item/15923790
Agricultural,5600 sq.m.,Armavir › Norakert,"$17,000",USD,"4000 m, apricot orchardThe rest is arable landThe whole land is fencedHas irrigation waterIt is 200 meters away from the residential areaTranslated from Armenian",Nov-25-2022_00-56,,https://list.am/en/item/17637161
For Residential Development,480 sq.m.,Armavir › Echmiadzin,"1,600,000 ₽",RUB,"City of Etchmiadzin, Aram Manukyan 1-district, number 255, fence, old building, land 480 sq. M. 16 × 30 adjacent land plot. Price is negotiable...Translated from Armenian",Nov-25-2022_00-56,,https://list.am/en/item/15664593
Agricultural,"200,000 sq.m.","Էջմիածին փողոց 1, Պտղունք","$210,000",USD,Large plot of land with fruit trees for sale. The land has all necessary communications.Translated from Armenian,Nov-25-2022_00-56,,https://list.am/en/item/18189658
Agricultural,"100,000 sq.m.",Armavir › Merdzavan,"$230,000",USD,"Կոդ՝ B-21959Վաճառվում է գյուղատնտեսական նշանակության հողատարածք Մերձավանում։ Բոլոր կոմունալ հարմարությունները մոտակայքում են։Գործակալության միջնորդավճարը կազմում է 2 %: Ցուցադրությունների համար կնքվում է ցուցադրման պայմանագիր։ Խնդրում ենք Ձեզ մոտ ունենալ անձը հաստատող փաստաթուղթ։An agricultural meaning plot for sale in Мerdzavan. All communications are nearby.The commission of the Real Estate Agency is 2%. For showing the real estate, a contract is signed. Please have a passport, ID or driving-license with You.",Nov-25-2022_00-56,,https://list.am/en/item/17577828
For Residential Development,880 sq.m.,Armavir › Merdzavan,"$20,000",USD,"Կոդ-BB510 Վաճառվում է 880քմ տնամերձ հողատարածքԱրմավիր, Մերձավանկոմունիկացիաները հասանելի ենTranslated from Armenian",Nov-25-2022_00-56,,https://list.am/en/item/16457100
For Residential Development,1200 sq.m.,Armavir › Ptghunk,"$19,000",USD,"Land in Ptghunk village, Armavir region.Land type NEARBY.1200 m. Q. There are no problems with paperwork. For details, call the mentioned phone numbers. Negotiable.Translated from Armenian",Nov-25-2022_00-56,,https://list.am/en/item/17455009
For General Purpose,9000 sq.m.,Armavir › Echmiadzin,"$25,000",USD,"Land is for sale in Ptghunk village of Etchmiadzin, the area has the possibility of water. It is possible to sell adjacent areas. For details, call the mentioned phone numbers. Negotiable.Translated from Armenian",Nov-25-2022_00-56,,https://list.am/en/item/15325004
For Residential Development,1000 sq.m.,Armavir › Dasht,"$8,000",USD,"Շտապ վաճառվում է հողատարածք Էջմիածնի շրջանի Դաշտ գյուղում։ Ընդանուր չափսերը 1000ք. Մ ճանապարհին շատ մոտ։ Մոտակայքում կան բոլոր կոմունիկացիաները ։ Հարմար դիրք, երկկողմանի, կանալին մոտ։Կանխիկ գումարի դեպքում գումարը սակարկելի է, նաև փոխանակում մեքենայի հետ հավելավճարով կամ համարժեք։Տնամերձ, շինությունների համար, տուն սարքելու համար, փոխանակում գումարը մաս մաս փակովի, կանխավճարով.Срочно продается земля для строительства дома. Место супер, коммуникации рядом, все близко, два подъезда, земля богатая, плодородная! , Долго не использовалась, рядом с с центральным каналом!Продажа, обмен, оплата по частям или предложите свой вариант.Срочно и за наличные хорошо уступим в цене, обмен рассмотрим ваш вариант.",Nov-25-2022_00-56,,https://list.am/en/item/16867130
For Residential Development,"12,000 sq.m.",Armavir › Myasnikyan,"$12,000",USD,"Bring slippery ground, the basement is ready.Translated from Armenian",Nov-25-2022_00-56,,https://list.am/en/item/17817702
,1300 sq.m.,Armavir › Armavir,"$2,000",USD,Զարթոնք (Ղամշլու) գյուղում հողամաս սեփականաշնորհում 1300 m'2,Nov-25-2022_00-56,,https://list.am/en/item/15750874
Agricultural,7800 sq.m.,Armavir › Aygek,"$23,000",USD,"Suitable for greenhouses, the gas line is adjacent to the groundTranslated from Armenian",Nov-25-2022_00-56,,https://list.am/en/item/17708993
Agricultural,8100 sq.m.,Armavir › Gai,"$15,000",USD,"Arable land for sale (privatization) near the road leading to Metsamor in Gay village. The road leading to the land is paved, there is electricity nearby.Translated from Armenian",Nov-25-2022_00-56,,https://list.am/en/item/17699775
For Residential Development,1000 sq.m.,Armavir › Musaler,"$17,000",USD,"A plot of land near the house on the first line is for sale. About 7 km from Yerevan. There are all necessary documents and facilities (gas, water, electricity) for building a house. For questions and reasonable suggestions, call the indicated number or Viber, WhatsApp.Translated from Armenian",Nov-25-2022_00-56,,https://list.am/en/item/17864354
Agricultural,"20,000 sq.m.",Armavir › Armavir,"$80,000",USD,A 4-year-old productive raisin orchard is for sale in the village of Nalbandian. Exchange with Fur is possible. For more information call.Translated from Armenian,Nov-25-2022_00-56,,https://list.am/en/item/18346792
For General Purpose,900 sq.m.,"Erevanyan street, Armavir","$12,000",USD,The land is for rentTranslated from Armenian,Nov-25-2022_00-56,,https://list.am/en/item/18257487
For Residential Development,500 sq.m.,Armavir › Merdzavan,"$15,000",USD,A plot of land in Merdzavan village is for saleTranslated from Armenian,Nov-25-2022_00-56,,https://list.am/en/item/18346483
For Residential Development,5500 sq.m.,Armavir › Geghakert,"$230,000",USD,"The land is located in the picturesque community of Armavir region, it is completely fenced, there is a swimming pool. There are trees, there is a stone building, two rooms. It is suitable for any activity. There is a swimming pool with a capacity of 40 tons. Greenhouse 1300 sq. M.Translated from Armenian",Nov-25-2022_00-56,,https://list.am/en/item/16608342
Agricultural,"13,000 sq.m.",Armavir › Aygek,"$110,000",USD,"The orchard is located near the houses in Aygek village. The road leading to the land is asphalted. There are 24 rows of grapes in the garden, it gives 10-15 tons a year. Harvest, about 20 apricot trees, 20 peach trees, 36 walnut trees and 20 apple trees. Sq. It is alfalfa.It is 8 km away from Yerevan.There is drinking water, electricity, gas nearby.Translated from Armenian",Nov-25-2022_00-56,,https://list.am/en/item/14589101
Agricultural,7600 sq.m.,Armavir › Aygek,"$35,000",USD,Land for sale in Aygek village. The area is 7600 sq / m. Adjacent to the central road. There is permanent irrigation water.Translated from Armenian,Nov-25-2022_00-56,,https://list.am/en/item/16794615
Agricultural,3100 sq.m.,Armavir › Arevik,"814,658 ֏",AMD,"The property is in the RACP auction.Arevik village, Armavir marz. Plot of land, 3100 square meters, uncultivated.You can also purchase the presented property through lending by the Bank, with the current lending terms and rates.Translated from Armenian",Nov-25-2022_00-56,,https://list.am/en/item/18346293
Agricultural,6000 sq.m.,Armavir › Margara,"$70,000",USD,"The area is located on the Echmiadzin-Margara road, near the highway, near the cement concrete factory near the cemetery, there used to be a production greenhouse areaTranslated from Armenian",Nov-25-2022_00-56,,https://list.am/en/item/17706341
For Residential Development,810 sq.m.,"3-րդ փողոց 22, Այգեկ","$17,000",USD,"The land is located 7 km away from Yerevan, it is very convenient for building a house, the light and water are on the street, there are residential houses.Translated from Armenian",Nov-25-2022_00-56,,https://list.am/en/item/17976424
For Residential Development,800 sq.m.,"3-րդ փողոց 18, Այգեկ","$17,000",USD,"The land is located at a distance of 7 km from Yerevan, it is very convenient to build a house, the light and the water is the resistance of the land, in front and there are residential houses in the back.Translated from Armenian",Nov-25-2022_00-56,,https://list.am/en/item/17976423
For Residential Development,1600 sq.m.,Armavir › Haykashen,"$4,500",USD,"URGENT land is on fire URGENTLY.The land is located in Haykashen village of Armavir region, it is privatized, it is close to home.An exchange is also possible.Price is negotiableTranslated from Armenian",Nov-25-2022_00-56,,https://list.am/en/item/17356232
Agricultural,3850 sq.m.,Armavir › Aygek,"$18,000",USD,"Կոդ` B-22841Վաճառվում է գյուղատնտեսական նշանակության հողատարածք Այգեկ գյուղում: Ունի ոռոգման ջուր։ Մնացած կոմունալ հարմարությունները մոտակայքում են։Գործակալության միջնորդավճարը կազմում է 2 %: Ցուցադրությունների համար կնքվում է ցուցադրման պայմանագիր։ Խնդրում ենք Ձեզ մոտ ունենալ անձը հաստատող փաստաթուղթ։An agricultural meaning plot for sale in Aygek Village. The plot has irrigation water․ The other communications are nearby.The commission of the Real Estate Agency is 2%. For showing the real estate, a contract is signed. Please have a passport, ID or driving-license with You.",Nov-25-2022_00-56,,https://list.am/en/item/14711504
For Residential Development,700 sq.m.,"Kentronakan 4th street, Tairov","$36,000",USD,"The plot is located on Tairov Werfel Street, next to Cargo, an asphalt road to the plot. There is light, water and gas in the neighborhood. Width: 15 meters, length: 48 meters.Translated from Armenian",Nov-25-2022_00-56,,https://list.am/en/item/17810688
For Public Buildings,200 sq.m.,Armavir › Echmiadzin,"$20,000",USD,"A plot of public land is for sale at 5/1 Yerchan Highway (Manushyan St.), on the right side of the road from Etchmiadzin to Yerchan, near the statue of Aram AsatryanThe area is 200 square metersPrice is negotiableTranslated from Armenian",Nov-25-2022_00-56,,https://list.am/en/item/17919891
Agricultural,"10,000 sq.m.",Armavir › Zartonk,"$72,000",USD,Vineyards for sale in Zvartnots. There is also a building on the premises. Partial sale of the land is possible. For more information call:Code 77633Translated from Armenian,Nov-25-2022_00-56,,https://list.am/en/item/18169730
Agricultural,4000 sq.m.,"Իսահակ Գասպարյանի փողոց 34, Երևան","$53,000",USD,The second land on the way to the airport is right behind JellyfishTranslated from Armenian,Nov-25-2022_00-56,,https://list.am/en/item/17489238
For General Purpose,"15,000 sq.m.",Armavir › Echmiadzin,"15,000,000 ֏",AMD,"There is a spring near the plot to create a suitable farm. For details, call the mentioned number.Translated from Armenian",Nov-25-2022_00-56,,https://list.am/en/item/16064607
For Residential Development,800 sq.m.,"Գորկու փողոց 1, Արմավիր","2,000,000 ֏",AMD,It is possible to exchange it with a car equivalent or with a surcharge by meTranslated from Armenian,Nov-25-2022_00-56,,https://list.am/en/item/17524545
Agricultural,2200 sq.m.,Armavir › Parakar,"$15,000",USD,"I am selling an agricultural land, it has two fronts, 2200 sq. M. M:Translated from Armenian",Nov-25-2022_00-56,,https://list.am/en/item/17606993
For Residential Development,800 sq.m.,Armavir › Aknalich,"$5,500",USD,"He is selling a plot of land near the house, he has a half-built barn, I will exchange it with a car equivalent to the price, call for more information.Translated from Armenian",Nov-25-2022_00-56,,https://list.am/en/item/16946583
Agricultural,1800 sq.m.,Armavir › Yeghegnut,"$3,000",USD,"The land is located (Badal) Yeghegnut Yeraskhahun road, next to the road connected to Badal, the land is cultivated, it is possible to exchange or make a closed call, we will agreeTranslated from Armenian",Nov-25-2022_00-56,,https://list.am/en/item/17508678
Agricultural,5000 sq.m.,Armavir › Aghavnatun,"$160,000",USD,Կոդ` ID1572Վաճառվում է 5000քմ ընդհանուր մակերեսով հողատարածք։1750 քմ մակերեսով ջերմոց՝ ծածկով3000 քմ մակերեսով ջերմոց՝ առանց ծածկԿաթիլային համակարգՕդափոխումը մեխանիկականԿից երկհարկանի շինություն 100 քմ մակերեսով,Nov-25-2022_00-56,,https://list.am/en/item/17473364
Agricultural,3000 sq.m.,Armavir › Musaler,"$30,000",USD,Code: ID3627Agricultural land for sale in Musaler.Translated from Armenian,Nov-25-2022_00-56,,https://list.am/en/item/17800733
Agricultural,5100 sq.m.,Armavir › Aygek,"$45,000",USD,Code: ID3487Agricultural land for sale. Walled.Translated from Armenian,Nov-25-2022_00-56,,https://list.am/en/item/17382630
For Residential Development,1100 sq.m.,Armavir › Merdzavan,"$14,500",USD,Code: ID3612Land for residential buildings is for sale.Translated from Armenian,Nov-25-2022_00-56,,https://list.am/en/item/17632024
For Industrial Use,700 sq.m.,"Hanrapetutyun street, Armavir","$30,000",USD,"For sale is a workshop for garden support, water meter observation well, streams with auxiliary equipment.The land occupies an area of 700 sq/m, but it is fenced 400 sq/m.Translated from Armenian",Nov-25-2022_00-56,,https://list.am/en/item/18343879
For Residential Development,1200 sq.m.,Armavir › Echmiadzin,"$22,000",USD,"Land near the house is for saleEtchmiadzin city, Charents districtThe area is 1200 square metersAshotFor more information callCode A055Translated from Armenian",Nov-25-2022_00-56,,https://list.am/en/item/17407904
Agricultural,3000 sq.m.,Armavir › Echmiadzin,"$2,800",USD,"Վաճառվում է 3000քմ հող Արմավիրի մարզի Հայկաշեն գյուղում, ոռոգման ջուր, առանց միջնորդ",Nov-25-2022_00-56,,https://list.am/en/item/15560291
Agricultural,1000 sq.m.,Armavir › Echmiadzin,"$4,000",USD,"Հնարավոր է փոխանակում մեքենայի հետ։Գյուղ Աղավնատուն, տնամերձ հողատարածք, սեփականաշնորհված։",Nov-25-2022_00-56,,https://list.am/en/item/16257425
For Residential Development,1100 sq.m.,Armavir › Tairov,"$25,000",USD,Виноградное полеТорг уместен,Nov-25-2022_00-56,,https://list.am/en/item/16294761
For Residential Development,1000 sq.m.,Armavir › Tairov,"$200,000",USD,Продам участокИдеальное место для любой недвижимостиТорг уместен,Nov-25-2022_00-56,,https://list.am/en/item/16293134
Agricultural,"260,000 sq.m.",Armavir › Merdzavan,"$500,000",USD,"The road is completely fenced. There is a 2-storey house in the area, a cottage, electric electricity, irrigation system, 6 hectares of poplar garden, 1500 trees (apricot, plum, melon, nectar, cheerful)1 c. - 1.5 $:Translated from Armenian",Nov-25-2022_00-56,,https://list.am/en/item/16994441
For Residential Development,300 sq.m.,Armavir › Merdzavan,"$10,000",USD,"Call for details. Exchange with car, different price in case of exchange15x20Translated from Armenian",Nov-25-2022_00-56,"ELectricity, water supply, natural gas",https://list.am/en/item/16534573
Agricultural,7700 sq.m.,Armavir › Musaler,"$52,000",USD,The land is located next to the airport palaceTranslated from Armenian,Nov-25-2022_00-56,,https://list.am/en/item/18239565
Agricultural,5500 sq.m.,Armavir › Sardarapat,"55,000,000 ֏",AMD,"5.5 hectares of land is for sale in Sardarapat village. It is an orchard, 1500 square meters of which are black and Victoria plums. The rest is a vineyard. There are 3 irrigation options.For details, call the indicated phone number.Translated from Armenian",Nov-25-2022_00-56,,https://list.am/en/item/18115380
Agricultural,900 sq.m.,"Admiral Isakov street, Vagharshapat","$13,000",USD,"Продается земельный участок рядом аэропорта, возле АГНС, 900 м, возможно обмен",Nov-25-2022_00-56,,https://list.am/en/item/17759358
Agricultural,3000 sq.m.,Armavir › Armavir,"$11,000",USD,"Fruit garden. Peaches, apples,Cherry:There is gas, light, water, irrigation water in the land.It is possible to build a house.It is located next to the Sardarapat memorial.Translated from Armenian",Nov-25-2022_00-56,,https://list.am/en/item/17583337
For Residential Development,1880 sq.m.,"Echmiatsin Highway, Khoronk","$6,000",USD,The land has a two-way road. It is located very close to the village... It is intended for the neighborhood. Price is negotiable.Translated from Armenian,Nov-25-2022_00-56,,https://list.am/en/item/16800664
Agricultural,6000 sq.m.,Armavir › Echmiadzin,"$35,000",USD,The land is located on the road from Yerevan to Etchmiadzin in MusalerTranslated from Armenian,Nov-25-2022_00-56,,https://list.am/en/item/13510493
Agricultural,"16,967 sq.m.",Armavir › Armavir,"$6,000",USD,"Agricultural land, Armavir region, Aknalich community, 16,967 square meters, about 800 meters from the asphalt road leading to the nuclear power plant.Ideal for vines and fruit trees. The area is flat, provided with irrigation water.Translated from Armenian",Nov-25-2022_00-56,,https://list.am/en/item/18320709
Agricultural,"27,367 sq.m.",Armavir › Armavir,"$11,000",USD,"Agricultural land, Armavir region, Aknalich community, 27367 square meters, on the right side of the asphalt road leading to the nuclear power plant.The area is flat, it is provided with irrigation water, the distance from the gas distribution network is about 800 m, there is the possibility of connecting electricity and drinking water.Translated from Armenian",Nov-25-2022_00-56,,https://list.am/en/item/18320720
Agricultural,8215 sq.m.,Armavir › Armavir,"$15,500",USD,"Agricultural land 8215 square meters, 40 m from the Echmiadzin-Armavir highway (Armavir region, Arshaluys community), on the left side of the asphalt road leading to the nuclear power plant.The gas distribution network is directly in the plot, there is an asphalted road on both sides, there is irrigation water on both sides, and the possibility of electricity connection.Translated from Armenian",Nov-25-2022_00-56,,https://list.am/en/item/18320728
For Industrial Use,"16,000 sq.m.","20-րդ փողոց 22, Արշալույս","$27,500",USD,"The vineyard has a total cultivable area of 1.5 ha and a total of 1.6 ha of good grapes. The annual yield of the vineyard is 40 tons. Together with the vineyard, we give a contract of 27 tons to the Ararat Wine and Brandy Factory. It is located on the left side of the Armavir-Yerevan highway. Adjacent is a hail station and two working Artesian were.Translated from Armenian",Nov-25-2022_00-56,,https://list.am/en/item/18118127
Agricultural,7000 sq.m.,Armavir › Echmiadzin,"$20,000",USD,"Code 11885: Horticultural land for sale in Armavir region, v. In Zvartnots. 6000 out of 7000 square meters are vineyards, and 1000 square meters are fruit trees. Has irrigation water.Translated from Armenian",Nov-25-2022_00-56,,https://list.am/en/item/11471833
For Residential Development,880 sq.m.,"Երիտասարդության փողոց 1, Մերձավան","$13,000",USD,A plot of land near the house has a negotiable electricity price.Translated from Armenian,Nov-25-2022_00-56,,https://list.am/en/item/18299533
For Residential Development,1200 sq.m.,Armavir › Gai,"$5,500",USD,Land near the house is for sale very urgently. 1200 square metersTranslated from Armenian,Nov-25-2022_00-56,,https://list.am/en/item/17887490
For Residential Development,1100 sq.m.,Armavir › Armavir,"2,000,000 ֏",AMD,"It is a plot of land near the house, 1100 square meters. , the plot of land is located at the address belonging to the Noravan community adjacent to the 108 thgm of Armavir city, the area is indicated in the maps as Plot 2, for smaller plots, please call, only real buyers should call.Translated from Armenian",Nov-25-2022_00-56,,https://list.am/en/item/17891446
For Residential Development,730 sq.m.,Armavir › Ptghunk,"$14,000",USD,Գտնվում է Մուսալեռի վերջնամասում։Վաճառվում է սեփականատիրոջ կողմից։Находится в конце Мусалера.Продается собственником.It is located at the end of the Musaler.For sale by the owner,Nov-25-2022_00-56,,https://list.am/en/item/16741535
For Residential Development,482 sq.m.,"Charents street, Vagharshapat","$23,000",USD,"The land is located on the first line (it is a very good place), the position is such that it has two front parts. For more information call.Translated from Armenian",Nov-25-2022_00-56,,https://list.am/en/item/17153774
Agricultural,3300 sq.m.,Armavir › Sardarapat,"$9,000",USD,"Irrigated land is for sale in Sardarapat village, near the road, accessible to cars, the surface is flat, there are apricot fruit trees. I will exchange it for a car or a plot of land in the capital Yerevan and the surrounding area.Translated from Armenian",Nov-25-2022_00-56,,https://list.am/en/item/17610914
For Residential Development,400 sq.m.,Armavir › Armavir,"$3,500",USD,Продам земельный участок для строительства дома. Есть все необходимое коммуникации (газ вода электричество канализации),Nov-25-2022_00-56,,https://list.am/en/item/16712802
Agricultural,3200 sq.m.,"Echmiatsin Highway, Khoronk","$4,000",USD,"The land is located in Aghvnatun village, there is no problem with arable land waterTranslated from Armenian",Nov-25-2022_00-56,,https://list.am/en/item/17364885
Agricultural,"17,000 sq.m.",Armavir › Hatsik,"16,750,000 ֏",AMD,"Land for sale, Armavir Marz. Hatsik 6000 sq/m 15-year-old apricots and peaches 8000 sq/m 6-year-old apricots and peaches 3000 sq/m Victoria type plums 6 years old. There is no problem with irrigation water, it also has the possibility of artesian water, the price is negotiable.Translated from Armenian",Nov-25-2022_00-56,,https://list.am/en/item/18305612
For Residential Development,1000 sq.m.,Armavir › Musaler,"$12,000",USD,"Վաճառվում է հողատարածք Պտղունքի Մոնթեի 36 հասցեյում, փոխանակում համարժեք մեքենայի հետ",Nov-25-2022_00-56,,https://list.am/en/item/17330884
For Residential Development,1000 sq.m.,Armavir › Echmiadzin,"$5,000",USD,"1000 sq. M. Land near the house is for sale in Aknashen ""between Gay villages"".Translated from Armenian",Nov-25-2022_00-56,,https://list.am/en/item/17209750
Agricultural,4000 sq.m.,"Bagaran Roadway 114, Karakert","$20,000",USD,"More than 4 hectares, 3 hectares of alfalfa, more than 1 hectare, trees 350 apricots, 120 cherries, 50 peaches, 1-year-old treesTranslated from Armenian",Nov-25-2022_00-56,,https://list.am/en/item/18151746
For Residential Development,1000 sq.m.,"Улица М. Похосян 6, Шаумян","$8,000",USD,"Продам участок в Шаумяне. Подходит для постройки дома для постоянного проживания. Площадь 10 соток. Есть электричество, вода, газ. Расположен между городами Эчмиадзин и Аштарак.",Nov-25-2022_00-56,,https://list.am/en/item/18235582
