Type,Land Area,Address,Price,Currency,Description,Datetime,Service Lines,Links
Agricultural,"12,000 sq.m.",Armavir › Echmiadzin,"$29,000",USD,"12000 (thousand) square meters of flat land for sale in Etchmiadzin, Aknashen (Khatunarkh), one-sided 250 m tuff fence. Suitable for building a greenhouse. It is located about 20 km from Yerevan. Call after 13:00Translated from Armenian",Nov-25-2022_00-57,,https://list.am/en/item/16008611
Agricultural,6500 sq.m.,"Улица Алека Манукяна 69, Вагаршапат","$65,000",USD,$ 10 per square meter. It is located below VagharshapatTranslated from Armenian,Nov-25-2022_00-57,,https://list.am/en/item/17879285
Agricultural,7000 sq.m.,Armavir › Echmiadzin,"$12,000",USD,"Located in Aygek village, suitable for building a farm or a greenhouse, irrigation water, gas and I will exchange the light with the car right next doorTranslated from Armenian",Nov-25-2022_00-57,,https://list.am/en/item/15286267
For Residential Development,405 sq.m.,Armavir › Echmiadzin,"$24,000",USD,"The land is near the house, located in Etchmiadzin, the total area is 405 square meters, the frontage is 15m, the depth is 27m, it has all the utilities.Translated from Armenian",Nov-25-2022_00-57,,https://list.am/en/item/18202797
For Residential Development,1600 sq.m.,Armavir › Vardanashen,"188,734 ֏",AMD,"The property is the Bank's collateral, which is at the ARCS auction.Armavir region, village Land plot in Vardanashen, 1600 square meters, has irrigation water.You can also purchase the presented property through crediting by the Bank with the current credit terms and tariffs.Translated from Armenian",Nov-25-2022_00-57,,https://list.am/en/item/15115594
For Residential Development,1870 sq.m.,Armavir › Arevik,"813,583 ֏",AMD,"The property is the Bank's collateral, which is at the ARCS auction.Armavir region Ar-ik community, 27 street, residential construction plot at 18 address, third class, irrigated, has irrigation system. The total area is 1870 square meters.You can also purchase the presented property through crediting by the Bank with the current credit terms and tariffs.Translated from Armenian",Nov-25-2022_00-57,,https://list.am/en/item/9269149
Agricultural,2275 sq.m.,Armavir › Musaler,"$10,000",USD,Irrigation water and electricity are located near the land.Call or write a letter for details.UrgentTranslated from Armenian,Nov-25-2022_00-57,,https://list.am/en/item/16443293
Agricultural,8000 sq.m.,Armavir › Echmiadzin,"$27,000",USD,"Peach orchard for sale, Etchmiadzin city. Gardening.No water problem.There are 370 trees (mashtos variety) in the park.The trees are 2.5 years old and will be fully harvested next year.Call for detailsTranslated from Armenian",Nov-25-2022_00-57,,https://list.am/en/item/18159900
For Industrial Use,"16,000 sq.m.","Komitas street, Parakar","$820,000",USD,"For sale is a 16,000 square meter industrial area in Parakar, on Komitas Street. It is next to the road, has a wide front, 630m long. The road leading to the land is paved. There are 3 buildings on the land with a total area of 1200 square meters, a greenhouse of 630 square meters, a deep well, a substation, fruit trees.In case of questions related to the land, or to get acquainted with other properties, please call the indicated phone number.Sincerely, PROJECT real estate agency.Code 9001Translated from Armenian",Nov-25-2022_00-57,,https://list.am/en/item/18198130
For Residential Development,2000 sq.m.,Armavir › Arevashat,"4,500,000 ֏",AMD,Land near the house with different types of cherry and plum trees. It is 8 km away from Yerevan.Translated from Armenian,Nov-25-2022_00-57,,https://list.am/en/item/17944586
Agricultural,10 sq.m.,Armavir › Baghramyan,"$150,000",USD,Only call real buyersTranslated from Armenian,Nov-25-2022_00-57,,https://list.am/en/item/17453216
For Public Buildings,1000 sq.m.,Armavir › Ptghunk,"$18,000",USD,"Land, near the house, 1000mIt is located in the village of Ptghunk on the Etchmiadzin-Yerevan highway.300 m from the highway.Translated from Armenian",Nov-25-2022_00-57,,https://list.am/en/item/16492594
For General Purpose,2100 sq.m.,Armavir › Musaler,"$15,000",USD,"Orchard 2100 mIt is located in Musaler, Parakar section, near the airport. Price is negotiable.Translated from Armenian",Nov-25-2022_00-57,,https://list.am/en/item/16492476
For Residential Development,405 sq.m.,"Եղիշե Չարենցի փողոց 21, Վաղարշապատ","$15,000",USD,"Charents district, land near the house. On facebook Real estate in Ejmiatsin - Ansharj guyq EjmiacnumCode H-2062Translated from Armenian",Nov-25-2022_00-57,,https://list.am/en/item/17271140
Agricultural,7800 sq.m.,Armavir › Armavir,"$15,000",USD,"The land is located near the Armavir-Yerevan highway (first line)Not reached Metsamor from Armavir.The area is suitable for business use,The land is irrigated, there is a deep well nearby (Artizan)I will exchange with the car for a surchargeTranslated from Armenian",Nov-25-2022_00-57,,https://list.am/en/item/15717849
For Residential Development,740 sq.m.,Armavir › Musaler,"$16,500",USD,"Land near the house in Musaler. There is light, gas, water.For details, call the mentioned phone number.Translated from Armenian",Nov-25-2022_00-57,,https://list.am/en/item/17970984
Agricultural,"52,000 sq.m.","Armavir-Gyumri Highway, Karakert","$18,000",USD,Հարևանությամբ գտնվում են պտղատու այգիներ: Ունի ոռոգման հնարավորություն: Բնակավայրից հեռու է ընդամենը 1-2 կլիոմետր:,Nov-25-2022_00-57,,https://list.am/en/item/18173975
Agricultural,"60,000 sq.m.",Armavir › Lenughi,"$120,000",USD,"Located strategically near Lenughi village in Armavir region, is this 6 hectares of beautiful vineyard with productive capacity that generates annual income from grapes production.This vineyard can be upgraded to produce wine on site and increase production capacity and annual income significantly.If interested please call Varoujan at:Skype: Jay. Avanessian",Nov-25-2022_00-57,,https://list.am/en/item/18061178
Agricultural,5000 sq.m.,Armavir › Echmiadzin,"$7,900",USD,"Վաճ. 5000քմ. Վարելահող գ. ՄՈՒՍԱԼԵՌՈՒՄ, 2 կտորից, սեփ. Վկայական,Նկարագիր գ. Մուսալեռ, Կամարից 2կմ վրա, ծիրանուտ, հարթ տեղ, հոսանքի, ջրի հնարավորություն, հարմար է գյուղ. Նշանակության գործունեության և այգեգործության համար, ՇՏԱՊ",Nov-25-2022_00-57,,https://list.am/en/item/11499266
Agricultural,"10,000 sq.m.",Armavir › Armavir,"$20,000",USD,"1 ha of orchard, 0.5 ha of cherries (long-tailed, janfida, yellow), 0.5 ha of plums (Victoria, black plum) there is no water problem. In Aygeshat village of Khoktemberyan. Call with Viber numberTranslated from Armenian",Nov-25-2022_00-57,,https://list.am/en/item/18153638
For Residential Development,1020 sq.m.,Armavir › Echmiadzin,"$40,000",USD,"A 1020 square meter land is for sale on the 1st street of Aram Manukyan fish in Etchmiadzin + about 50-100 square meters of land in front of your land, which by law you can use without paper, as the entrance to the sold land is provided from that part. There are many young fruit trees and grape blossoms in the plot, for which the owner of the house takes good care.Code 17204Translated from Armenian",Nov-25-2022_00-57,,https://list.am/en/item/17132022
For Residential Development,480 sq.m.,Armavir › Echmiadzin,"$38,000",USD,"A 480 square meter fenced plot of land with a 16m frontage and 2/3 covered basement is for sale in the Aram Manukyan district of Etchmiadzin, adjacent to the highway (actually, about 1000 square meters, including the buffer land between the highway and the land) All communications are available: Gas, drinking water, sewage (from both sides, from the street and the highway)Code 17307Translated from Armenian",Nov-25-2022_00-57,,https://list.am/en/item/17918298
For Residential Development,900 sq.m.,Armavir › Echmiadzin,"$62,000",USD,"A 900 square meter area, about 20 meters from the house, is for sale in front of the gold factory between Parakar and Musaler.Code 16439Translated from Armenian",Nov-25-2022_00-57,,https://list.am/en/item/17356214
Agricultural,"17,000 sq.m.",Armavir › Amberd,"$65,000",USD,"For sale 17000 sq. M. Plot of land in Khakhokh Park, 50 m long, 310 sq. M., provided with permanent water supply.Translated from Armenian",Nov-25-2022_00-57,,https://list.am/en/item/17965739
For Residential Development,405 sq.m.,Armavir › Echmiadzin,"$23,000",USD,"AS025:K. A land plot of 405 square meters is for sale on Ara Manukyan Street in Etchmiadzin.The cost is $23,000.Agency address - c. Etchmiadzin, Baghramyan 18a/1bTranslated from Armenian",Nov-25-2022_00-57,,https://list.am/en/item/18017796
For General Purpose,2650 sq.m.,"Vagharshapat street, Parakar","$80,000",USD,Common land.Translated from Armenian,Nov-25-2022_00-57,,https://list.am/en/item/16875644
For General Purpose,2650 sq.m.,Armavir › Tairov,"$80,000",USD,Land area. The price is negotiable. Half near the house. Call with questionsTranslated from Armenian,Nov-25-2022_00-57,,https://list.am/en/item/18137831
For Residential Development,1350 sq.m.,Armavir › Echmiadzin,"$15,500",USD,Etchmiadzin Voskehat. 41 meter frontage on the central streetTranslated from Armenian,Nov-25-2022_00-57,,https://list.am/en/item/17564672
For Residential Development,880 sq.m.,"3-րդ փողոց, Այգեկ","8,500,000 ֏",AMD,"In the village of Aygek for sale (URGENTLY) is a plot of land near the house with fruit trees, it is fenced with a wire mesh, it has an iron gate. There is a cabin (6x3 sq. M.) in the area, there is drinking and irrigation water, electricity, gas (soon)It is located 10 km from Yerevan, 205 route works from Yerevan.Translated from Armenian",Nov-25-2022_00-57,,https://list.am/en/item/17864955
For General Purpose,2100 sq.m.,Armavir › Echmiadzin,"$6,000",USD,"1100-ը որպես տնամերձ, 1000-ը վարելահող: Տնամերձ հատվածում կառուցված է 4-9 մ չափերի ավտոտնակ, հողը ունի ոռողման հնարավորություն, էլ. Հոսանքը գտնվում է մոտ 100 մ հեռավորության վրա, շատ հարմար է ջերմոցի կառուցման համար:",Nov-25-2022_00-57,,https://list.am/en/item/12382682
Agricultural,8000 sq.m.,Armavir › Lukashin,"8,000,000 ֏",AMD,"I am selling a plot of land of 8000 square meters, planted with peach saplings, (middle-aged orange) and the entire free space is planted with saffron.Translated from Armenian",Nov-25-2022_00-57,,https://list.am/en/item/18134272
For Residential Development,405 sq.m.,"Ղարիբջանյան փողոց, Վաղարշապատ","$21,000",USD,"It is located at the back of 33 service + Teryan street, the 4th plot from the right on Etchmiadzin highway, for building a residential houseTranslated from Armenian",Dec-15-2022_22-09,"Electricity, water supply, natural gas, sewerage",https://list.am/en/item/18651631
For General Purpose,1700 sq.m.,Armavir › Armavir,"$4,500",USD,"A plot of land is for sale in the beginning of Tsaghkalanj village. There is a bakery near the area of 1700 square meters, there is electricity, irrigation water, 100m from the main road.Translated from Armenian",Dec-15-2022_22-09,,https://list.am/en/item/18640201
For Residential Development,500 sq.m.,Armavir › Parakar,"$55,000",USD,"Sakarkevi, located on the airport road in Parakar, the plot has a house plan and a separate building, there is electricity, gas and water, fenced, cultivated garden.Translated from Armenian",Dec-15-2022_22-09,,https://list.am/en/item/18531986
For Residential Development,1700 sq.m.,"Երևանյան փողոց 2-րդ նրբանցք, Փարաքար","$180,000",USD,"A building adjacent to the Yerevan-Etchmiadzin highway, intended for car repair, but can be used as desired. The land is fenced, utilities are nearby.Translated from Armenian",Dec-15-2022_22-09,,https://list.am/en/item/18527069
For Residential Development,680 sq.m.,Armavir › Musaler,"$20,000",USD,"The plot of land is located 50m from Echmiadzin road, Yerevan. It is flat, one side is fenced, there is electricity, water, call for details.Translated from Armenian",Dec-15-2022_22-09,"Electricity, water supply",https://list.am/en/item/18629957
For Residential Development,1200 sq.m.,Armavir › Armavir,"$14,500",USD,"Code K121A plot of land for residential buildings is for sale in the village of Mrgastan, front line. Communications are nearby.Translated from Armenian",Dec-15-2022_22-09,,https://list.am/en/item/18440136
For Residential Development,1400 sq.m.,Armavir › Nor Armavir,"$10,000",USD,"Land near the house, closed area, has drip water supply, cultivated yielding (800-1000 kg) average town-front type of fresh MUSH. It has water, electricity and gas connection nearby, street adjacent to the community.Translated from Armenian",Dec-15-2022_22-09,,https://list.am/en/item/18538739
For General Purpose,6200 sq.m.,"Մեսրոպ Մաշտոցի փողոց 1, Մուսալեռ","$14,500",USD,"A plot of land for sale in Musaler, adjacent to the airport area, adjacent to the asphalt road, currently planted with alfalfa, there is irrigation water, gas at a distance of 800 meters, water at a distance of 300 to 400 meters, suitable for creating a greenhouse or a recreation areaParakar Musaler PtghunkTranslated from Armenian",Dec-15-2022_22-09,,https://list.am/en/item/18548136
For Residential Development,5000 sq.m.,"10th Street, Pshatavan","$17,000",USD,"I am selling a plot of land, Armavir Region (Hoktemberyan) community, Pshatavan, 30th street, 1 plot5000 sq. M price. $17,000Objective significance: Settlements.Practical meaning or plot for residential developmentType of registered right: OWNERSHIPIt is located in the inhabited area of the village. Utilities nearby, irrigation water connected to the main stream. The land is first class, ready to be cultivated.Translated from Armenian",Dec-15-2022_22-09,,https://list.am/en/item/18463760
Agricultural,6000 sq.m.,Armavir › Ptghunk,"$25,000",USD,"SH T A P:Agricultural land for sale, the whole is a vineyard.It is located near the airport. The location is convenient.Etchmiadzin Ptghunk Musaler ParakarVineyardEjmiatsin ptghunq musaler paraqarGyughatntesakan hogh xaghoghi aygiXaxoxi aygi:Translated from Armenian",Dec-15-2022_22-09,,https://list.am/en/item/18477049
For Residential Development,3300 sq.m.,"Erevanyan street, Parakar","$7,000",USD,"A 3300 square meter flat plot of land near the house is for sale in Aknashen (Khatunakh) community, a newly built neighborhood, 60 meter frontage. Partial sale is possible.Translated from Armenian",Dec-15-2022_22-09,,https://list.am/en/item/15293563
For Residential Development,214 sq.m.,"Erevanyan street, Parakar","$58,000",USD,"First line, exchange is also possible, I will listen to offers.Translated from Armenian",Dec-15-2022_22-09,,https://list.am/en/item/18435577
Agricultural,3300 sq.m.,"Մելքոնյան փողոց, Մրգավետ","$10,000",USD,Fruit trees are provided with waterDate trees apricot apple plumGrapesTranslated from Armenian,Dec-15-2022_22-09,,https://list.am/en/item/18502153
For Residential Development,1500 sq.m.,"7-րդ փողոց , Այգեկ","$12,500",USD,"The total area of the plot is 1500 square meters, of which 150 square meters are for residential construction and 1350 square meters are for agricultural purposes.The land is flat and is located 12 km from YerevanTranslated from Armenian",Dec-15-2022_22-09,"Electricity, sewerage",https://list.am/en/item/18645388
For Residential Development,1170 sq.m.,Armavir › Armavir,"$3,500",USD,"A plot of land near the house is for sale in the village of Aygeshat, Armavir marz.Translated from Armenian",Dec-15-2022_22-09,,https://list.am/en/item/18398467
Agricultural,"10,000 sq.m.",Armavir › Echmiadzin,"$10,000",USD,It has gas / water / light and is very close to residential housesTranslated from Armenian,Dec-15-2022_22-09,,https://list.am/en/item/15814198
Agricultural,7000 sq.m.,Armavir › Mrgashat,"7,000,000 ֏",AMD,"7000 square meter vineyard for sale in Mrgashat village of Armavir marz. The vineyard was established in 2013 with the best materials. There are 360 bearaat trees of different varieties on the land. 150 pieces of kishmish, 120 pieces of Damascus palchik, 30 pieces of shahumyan, 30 pieces of cardinal, 30 pieces of mkhitari. Land has no irrigation water issues, call to find out moreTranslated from Armenian",Dec-15-2022_22-09,,https://list.am/en/item/18571949
Agricultural,8700 sq.m.,Armavir › Aknalich,"1,000,000 ֏",AMD,8700 square meters of agricultural land (arable land) in Aknalich community of Armavir marz is for sale.Translated from Armenian,Dec-15-2022_22-09,,https://list.am/en/item/18565631
For Residential Development,800 sq.m.,Armavir › Aknalich,"1,000,000 ֏",AMD,"Участок для жилой застройки в Акналичe, 800 кв. М.Վաճառվում է տնամերձ հողամաս Արմավիրի մարզի Ակնալիճ համայնքում, չափը 800 քառ. Մետր։",Dec-15-2022_22-09,,https://list.am/en/item/18565630
For General Purpose,2000 sq.m.,Armavir › Metsamor,"$40,000",USD,"Мецамор Ереван шоссе, обмен на автомобиль",Dec-15-2022_22-09,"Electricity, water supply, natural gas, sewerage",https://list.am/en/item/18635235
Agricultural,"21,900 sq.m.",Armavir › Echmiadzin,"75,000,000 ֏",AMD,"For sale... Blackberries, strawberries, raspberries. A gardenTranslated from Armenian",Dec-15-2022_22-09,Water supply,https://list.am/en/item/18724608
Agricultural,1000 sq.m.,Armavir › Mrgastan,"2,000,000 ֏",AMD,All utilities are nearbyTranslated from Armenian,Dec-15-2022_22-09,,https://list.am/en/item/18591089
For Residential Development,400 sq.m.,Armavir › Metsamor,"$4,000",USD,"The plot of land near the house is located in the 3rd district of Metsamor, 40m frontage, first line.Translated from Armenian",Dec-15-2022_22-09,,https://list.am/en/item/18724525
For Residential Development,600 sq.m.,Armavir › Parakar,"$30,000",USD,"Urgent sale, price negotiable.Translated from Armenian",Dec-15-2022_22-09,,https://list.am/en/item/18396624
For Residential Development,500 sq.m.,Armavir › Merdzavan,"16,000,000 ֏",AMD,It is located on the Yerevan highwayOn the main roadFrontal 21.8 m is marked in redTranslated from Armenian,Dec-15-2022_22-09,"Electricity, water supply, natural gas",https://list.am/en/item/18588817
Agricultural,2000 sq.m.,Armavir › Echmiadzin,"$30,000",USD,Call for all questions. Strawberry greenhouse.Translated from Armenian,Dec-15-2022_22-09,,https://list.am/en/item/18400555
For Residential Development,700 sq.m.,Armavir › Ptghunk,"$8,000",USD,A plot of land in Ptghunk village is for sale. The land is suitable for building a residential house. For more information call.Translated from Armenian,Dec-15-2022_22-09,,https://list.am/en/item/18475079
For General Purpose,1650 sq.m.,Armavir › Armavir,"$120,000",USD,"1650 square meters for sale. Plot of land occupying an area. Water, electricity are available. The land is located in Armavir marz, Ptghunk communityYerevan Etchmiadzin highway, 3 dead end house No. 1, second lane.Translated from Armenian",Dec-15-2022_22-09,"Electricity, water supply, sewerage",https://list.am/en/item/18723670
For Residential Development,1000 sq.m.,Armavir › Shahumyan,"$7,000",USD,"In a residential area. Water, gas, electricity are right next to the plot. It is suitable for all kinds of buildings. The land is corner, with road on both sides.Translated from Armenian",Dec-15-2022_22-09,"Electricity, water supply, natural gas, sewerage",https://list.am/en/item/18707299
For Residential Development,1000 sq.m.,Armavir › Echmiadzin,"5,000,000 ֏",AMD,"The land is located in the Shahumyan village of Etchmiadzin, 1000 square meters. M close to homeTranslated from Armenian",Dec-15-2022_22-09,,https://list.am/en/item/18633480
Agricultural,2200 sq.m.,"Vazgen Sargsyan street, Parakar","$20,000",USD,"The land is located next to the airport, it is possible to privatize it, get a building permitTranslated from Armenian",Dec-15-2022_22-09,,https://list.am/en/item/18666958
For General Purpose,1300 sq.m.,Armavir › Argavand,"$120,000",USD,"Land near the house is for sale in Argavand, Tairov. It is a flat area of 80 square meters. M. Building (bisetka), all utilities are available, has 22m frontage, sewer, drinking water, electricity, has 2 entrances, suitable for 2 separate houses with different entrancesTo build. 1300 sq. M. Is near the house. M.Also, exchange for an additional fee on your part, with a car, fenced on 4 sides. Only real buyers should call, the price is final.Translated from Armenian",Dec-15-2022_22-09,,https://list.am/en/item/18494521
For General Purpose,5900 sq.m.,Armavir › Gai,"$6,500",USD,"Privatization. The price is final, there is no lock and key. Everything grows. Water is not a problem.Translated from Armenian",Dec-15-2022_22-09,,https://list.am/en/item/18478553
For Residential Development,405 sq.m.,Armavir › Echmiadzin,"$32,000",USD,"Code H182A plot of land near the house is for saleAddress K. Etchmiadzin Charents district Land 405 square meters Has 2 wells, The area is fenced Swimming pool and cabinHro:Call for details#Echmiadzin#land:#Vagharshapat#Real_Property:#Land for saleTranslated from Armenian",Dec-15-2022_22-09,,https://list.am/en/item/13317194
Agricultural,5000 sq.m.,Armavir › Jrarat,"$4,500",USD,"Privatized plot of land in the village of Jararat. Near the asphalt road, water well.Translated from Armenian",Dec-15-2022_22-09,,https://list.am/en/item/18605416
For Residential Development,2000 sq.m.,"Griboedov Highway, Khoronk","9,000,000 ֏",AMD,"Urgent sale of 2000 square meters of land, 1500 square meters of greenhouse and a house.Translated from Armenian",Dec-15-2022_22-09,"Electricity, water supply",https://list.am/en/item/18722638
For Residential Development,700 sq.m.,Armavir › Parakar,"$24,000",USD,"There is a half-built building on the land, Urgent sale!Translated from Armenian",Dec-15-2022_22-09,,https://list.am/en/item/18481081
For General Purpose,"21,000 sq.m.",Armavir › Armavir,"$14,000",USD,"2.1 ha of arable land for sale. Armavir marz c. In Myasnikyan. The land is located near the village. Adjacent to the land is e. Current, provided with constant water. The land is very fertile and is privatized. Exchange with a car worth $6,000-$7,000 with an additional fee on your part.Translated from Armenian",Dec-15-2022_22-09,"Electricity, water supply",https://list.am/en/item/18607792
Agricultural,"10,000 sq.m.",Armavir › Echmiadzin,"$20,000",USD,"Located near the road, call or write for questionsTranslated from Armenian",Dec-15-2022_22-09,"Electricity, water supply",https://list.am/en/item/18651914
For Residential Development,1310 sq.m.,"Մեսրոպ Մաշտոցի փողոց, Մուսալեռ","$55,000",USD,"A plot of land is for sale in the village of Musaler, Armavir region, about 200 meters from the road.~ The land has 1310 sq. M. Area and importance of residential buildings.~ Front: 20 meters.~ There is an old residential building, cattle shed and pantry in the area.To get detailed information, write or call the specified number.The land is shown with a real estate showing contract.The service commission is 2% of the sales price.Translated from Armenian",Dec-15-2022_22-09,,https://list.am/en/item/18574108
Agricultural,"10,000 sq.m.",Armavir › Echmiadzin,"$40,000",USD,"1 hectare of land is for sale.There is drinking and irrigation water, gas is nearby.470 fruit trees.HilariousCode ID3697Translated from Armenian",Dec-15-2022_22-09,,https://list.am/en/item/18463415
For General Purpose,"23,000 sq.m.","Բաղրամյան փողոց 1, Մուսալեռ","$400,000",USD,"The land is located on the Yerevan-Echmiadzin central highway, a very convenient place where you can use any activity, there is a 5000m greenhouse on the land.Translated from Armenian",Dec-15-2022_22-09,,https://list.am/en/item/18441861
For Public Buildings,"20,000 sq.m.","Թումանյան փողոց 1, Մուսալեռ","$1,200,000",USD,"Code K103Public land for sale in Musaler, first line.Translated from Armenian",Dec-15-2022_22-09,,https://list.am/en/item/18394074
Agricultural,2700 sq.m.,Armavir › Parakar,"$120,000",USD,Code: ID3814Agricultural land for sale in Parakar.The meaning can be changed.First lineTranslated from Armenian,Dec-15-2022_22-09,,https://list.am/en/item/18528195
For Residential Development,1150 sq.m.,Armavir › Geghakert,"$6,700",USD,"A plot of land near the house is for sale in Geghakert village. The land is located close to the road, the irrigation water is 50m. It is far away.Call for details.Translated from Armenian",Dec-15-2022_22-09,,https://list.am/en/item/18533753
Agricultural,400 sq.m.,"Էջմիածնի խճուղի, Ապագա","3,000,000 ֏",AMD,"Greenhouse for sale: 3 pieces of glass and cellophane, equipped with mechanically opening and closing windows. Also has large heating coilsTranslated from Armenian",Dec-15-2022_22-09,,https://list.am/en/item/18613311
Agricultural,1650 sq.m.,"Հովհաննես Շիրազի փողոց, Փարաքար","$25,000",USD,"Privatization is for sale, which is suitable for livestock farming. There is a barn of 60 square meters. With the possibility of electricity and water, we will make an agreement with a real buyer.Translated from Armenian",Dec-15-2022_22-09,,https://list.am/en/item/18481239
