,Construction Type,New Construction,Elevator,Floor,Number of Rooms,Number of Bathrooms,Floor Area,Ceiling Height,Balcony,Renovation,Address,Price,Currency,Description
0,Panels,No,Available,9 / 14,2,1,65 sq.m.,from 2.7 m,Not available,Euro Renovation,"Nikol Duman Street, Yerevan","$87,000",USD,"The apartment is renovated,has all the utilitieslight,windows and doors of European productionheating system is installedair conditionerThe bathroom is tiledTranslated from Armenian"
1,Stone,No,Not available,3 / 4,4,2,175 sq.m.,from 3.5 m,Open balcony,No Renovation,"Nalbandyan street 17, Yerevan","$240,000",USD,"A unique apartment is for sale near Sakhrov Square. The building was built by Stalin's design with concrete slabs. The area of one part of the apartment is 3.3 m, the other is 4.5 m, where it is possible to build 2 floors. Has an entrance ամբ balcony.The apartment is displayed under a real estate display contract.Service commission - 2% of the sale price.Translated from Armenian"
2,Stone,No,Not available,2 / 5,2,1,68 sq.m.,from 2.7 m,Not available,Old Renovation,Yerevan › Shengavit,"$66,000",USD,2 rooms for sale ․ apartment in the 3rd partClean statePermanent water and gasIndividual heatingParquetThe bathroom is tiledFor more information call:CODE; 14324990:Translated from Armenian
3,Stone,No,Available,6 / 8,3,1,139 sq.m.,from 2.7 m,Multiple balconies,Major Renovation,"Marshal Baghramyan avenue, Yerevan","$360,000",USD,"A 3-4-room apartment in a special project stone building is for sale near the Opera House. The apartment is fully renovated, the entrance door is iron, the windows are of European production, individual heating system, the floor is laminate, the bathroom is tiled with Spanish tiles. There is an elevator in the building.The apartment is for sale together with the kitchen furniture.Translated from Armenian"
4,Stone,No,Not available,5 / 5,1,1,37 sq.m.,from 3 m,Open balcony,Old Renovation,"Charents street, Yerevan","$64,000",USD,"1 room, 37 sq. M., 5/5 floor, CHARENTSI street, STALINKA button, SAYAT NOVA crossroads, default conditions, windows are wooden, bathroom is old tile, gas, has no open balcony. Code b 1.06.1895:Translated from Armenian"
5,Panels,No,Not available,9 / 9,3,1,83 sq.m.,from 2.7 m,Not available,Major Renovation,"Nazarbekyan block, Yerevan","$68,000",USD,"The apartment has euro windows, an iron door, the bathroom is tiled, it is on the side, it has an air conditioner, a basement, it is for sale together with the furnitureTranslated from Armenian"
6,Panels,No,Available,12 / 12,3,1,84 sq.m.,from 2.75 m,Closed balcony,Cosmetic Renovation,"Azatutyan Avenue, Yerevan","$84,000",USD,3-room apartment for sale in Monument.Cosmetically renovated.Has a closed balcony.The position is awkward. For sale together with the whole property.Translated from Armenian
7,Panels,No,Available,8 / 9,3,1,80 sq.m.,from 2.7 m,Closed balcony,Major Renovation,Yerevan › Arabkir,"$105,000",USD,"K-21622Վաճառվում է 3 սենյականոց բնակարան Կոմիտասի պողոտայում՝ 9 հարկանի պանելային շենքի 8-րդ հարկում։ Բնակրաանը կապիտալ վերանորոգված է։ Մուտքի դուռը՝ երկաթյա, պատուհանները՝ եվրո, հատակը՝ լամինատ։ Սանհանգույցը՝ առանձին, նորաոճ սալիկապատ, էլ․ լարերը և խողովակները՝ փոխված։ Ունի ջեռուցման համակարգ, մշտական ջուր և գազ։ Տեսարանը՝ դեպի բակ։Գործակալության միջնորդավճարը կազմում է 2 %: Ցուցադրությունների համար կնքվում է ցուցադրման պայմանագիր։ Խնդրում ենք Ձեզ մոտ ունենալ անձը հաստատող փաստաթուղթ։An apartment for sale in Komitas Avenue. The rooms' quantity is 3 (a hall and 2 bedrooms) The apartment is newly renovated and is located an the 8th floor of the 9-storey panel building. The entrance door is iron-made, the windows are euro-based, the floor is covered by laminate. The bathroom is separate and modern tiled, the electric wires and pipes are newly changed. It has a heating system and is supplied with constant water and gas. The view is towards the yard.The commission of the Real Estate Agency is 2%. For showing the real estate, a contract is signed. Please have a passport, ID or driving-license with You."
8,Stone,No,Not available,2 / 5,2,1,45 sq.m.,from 2.8 m,Open balcony,Major Renovation,"Tpagrichner Street 9, Yerevan","$125,000",USD,"In the quietest part of the city center, near the Tpagrichner-Hanrapetutyan crossroads, a one-room converted into a two-room apartment is for sale.• The apartment is fully repaired, metal entrance door, euro windows, individual heating system, air conditioner are installed.• Sale with all property and equipment.• Has 6 square meters! Basement, open balcony with a good view.• The building has a beautiful yard, which is closed on both sides by a block.For other details, write or call the mentioned numbers.The apartment is displayed under a real estate display contract.Service commission - 2% of the sale price.Translated from Armenian"
9,Stone,No,Not available,2 / 4,1,1,49 sq.m.,from 3 m,Open balcony,Major Renovation,Yerevan › Kentron,"$152,000",USD,"5 + 11796:A 1-2 room converted apartment is for sale in Center. The apartment is fully renovated. Iron entrance door, tiled floor, euro windows. Has heating system, air conditioner, open balcony. The bathroom is combined tiled. Sale with furniture and appliances.Translated from Armenian"
10,Stone,No,Not available,1 / 4,3,1,71 sq.m.,from 2.5 m,Closed balcony,Partial Renovation,"Margarian street, Yerevan","$70,000",USD,"3 s for sale by the owner. Apartment on Margaryan street (Ajapnyak) 4/1 floor, 71 sq. M., iron door, corridor, kitchen and bathroom are tiled, rooms are parquet. It has a storage room and a basement. All the communal facilities are available. For sale with kitchen furniture. It is close to the bus stop, there is a school, a kindergarten, a Kaiser supermarket, pharmacies and shops in the neighborhood. Please do not disturb the agents.Translated from Armenian"
11,Monolith,Yes,Available,7 / 17,4,1,90 sq.m.,from 3 m,Open balcony,Designer Renovation,"Aram Street, Yerevan","$350,000",USD,"A luxurious 4-room apartment is for sale on Arami street, near Malibu Park, the area of which is 90 square meters.The design solutions of the apartment երը the materials used during the construction are of high quality and in accordance with the European standards. The apartment is located on the 7th floor of a newly built Diamond House building.The apartment has:3 bedrooms1 living roomkitchen1 bathroom1 open balconyThe service fee for the building is 18,000 AMD / month.The whole apartment is furnished, equipped with luxurious, high-quality European furniture and appliances.There are parking spaces in front of the building. It is possible to rent or buy underground parking.Nearby are many cafes, restaurants, necessary shops, places of entertainment, of course, the newly opened, spacious, bright garden.For sale together with all the property and equipment.The sale price is 350,000 USDCode: AH 969Translated from Armenian"
12,Panels,No,Available,10 / 12,2,2,74 sq.m.,from 2.75 m,Closed balcony,Partial Renovation,"Komitas Avenue, Yerevan","$88,000",USD,"2-room apartment for sale on Komitas avenue,Partial renovation,Floor: Parquet, bathroom 0 conditionHeating system, Windows of European productionHe is on the side.Ad number: N1189:Under a real estate display contract.Service commission - 2% of the sale price.Translated from Armenian"
13,Panels,No,Not available,3 / 4,3,1,74 sq.m.,from 2.6 m,Not available,Old Renovation,"Lepsius street, Yerevan","$58,000",USD,"Apartment for sale in Zeytun, on Lepsius street. The apartment is old renovated, is in clean condition, provided with all utilities. The building has a large panel.For more information call: /-օռէռ էէ սր /. / օթ ռէէ օռդ /NarineTranslated from Armenian"
14,Stone,No,Not available,1 / 5,2,1,70 sq.m.,from 2.75 m,Not available,Cosmetic Renovation,Yerevan › Arabkir,"$85,000",USD,"Code 3 + 22118:2-room apartment for sale in Arabkir. The apartment is renovated.It has an iron entrance door, euro windows, the floor is parquet,There is a heating system.For sale together with the kitchen furniture.Translated from Armenian"
15,Panels,No,Available,3 / 9,4,1,96 sq.m.,from 2.7 m,Not available,Major Renovation,"Margaryan St, Yerevan","$87,000",USD,"The apartment has euro windows, iron door, heating system, the bathroom is tiled, it is on the sideTranslated from Armenian"
16,Stone,No,Not available,1 / 4,3,1,74 sq.m.,from 2.6 m,Closed balcony,Major Renovation,"Shinararneri street, Yerevan","$60,000",USD,"Վաճառվում է 3 սենյականոց բնակարան Շինարարների փողոցում ` 4 Հարկանի քարե շենքի 1-ին հարկում, Բնակարանի մուտքի դուռը երկաթյա, Լուսամուտները եվրոպական արտադրության, Նախասրահի և խոհանոցի հատակը ծածկված է սալիկներով, Հյուրասենյակի և ննջասենյակների հատակը ծածկված է Մանրահատակով, Սանհանգույցը սալիկապատ, Գազ, Մշտական տաք և սառը ջուր, Անհատական ջեռուցման համակարգ, Փակ տնտեսական պատշգամբ, Կանգառին մոտ:"
17,Stone,No,Not available,4 / 5,3,1,80 sq.m.,from 2.7 m,Closed balcony,Old Renovation,"Komitas Avenue, Yerevan","$75,000",USD,"Sunny side, gas, parquet, good conditionTranslated from Armenian"
18,Monolith,Yes,Available,15 / 15,3,2,92 sq.m.,from 2.8 m,Not available,Major Renovation,Yerevan › Arabkir,"$130,000",USD,"The apartment is located on Griboyedov street, Arabkir community. Completely renovated apartment with all amenities.Translated from Armenian"
19,Panels,No,Not available,4 / 5,3,1,74 sq.m.,from 2.8 m,Closed balcony,Old Renovation,"Աջափնյակ վարչական շրջան, Երևան","$75,000",USD,"Վաճառվում է 3 սենյաանոց բնաարան 5հարկանի շենքի 4-րդ հարկում. Առաջին գիծ, գեղեցիկ բակով. Շենքն ունի 5 մուտք բնակարանը գտնվում է 3 մուտքում. Չեխական նախագիծ, երկաթյա դուռ, Բնակարանը հին վeրանորոգված է. Ունի 3 սենյակներ, նիշայով, գազ 2 կետ, ջուր, լույս, հեռախոս. Հոսանքի լարերը փոխված են. Բնակարանը տան ետնամասՀասցե: ․ Աջափնյակ, Բաշինջաղյան փողոց, 15 թաղամաս, 183 շենք, 28 բնակարանում ունի հնարավորություն 42ք. Մ. Ավելացնելու, շինարարությունը արված է. Հատակը կա. Նկարում երևում է. Ունի նկուղ շենում, արևկողմ. Շենքի ետնամասում առկա են դպրոցներ, մանկապարտեզ, խաղահրապարակներ, կանգառին կից. Մի խոսքով հարմարավետ է, և ամեն հնարավորություն էլ ունի. Սեփականացրած է. 75000 դոլար.There is a three room flat on the fourth (4th) floor of a five storied building ON SALE. It is situated in the first line with a nice garden. The building has three enterances. It is in the third enterance. It is a Czech project, with an iron door. It is old repaired. It has three rooms with a balcony, with water, a telephone and two gaz places. The electric lines are changed. The flat has an opportunity to enlarge the flat forty-two square km. Behind the flat the construction is done. You can see the floor in the picture. It has a cellar in the building. The building is in a sunny place. There is a school, a nursery school, a parking near the bulding. It is owned, comfortable. It costs 75000 (dollar) But we can bargain."
20,Panels,No,Not available,1 / 4,2,2,50 sq.m.,from 2.6 m,Closed balcony,Major Renovation,"Eghishe Tadevosyan Street, Yerevan","$56,000",USD,"Near Shengavit metro, partially renovated, converted 3 rooms, closed economic balcony, bathroom and kitchen tiled, basement, gasTranslated from Armenian"
21,Panels,No,Available,7 / 9,3,1,56 sq.m.,from 2.8 m,Not available,Major Renovation,Yerevan › Davitashen,"$75,000",USD,"3-room apartment on Tigran Petrosyan street for sale. The apartment is in a capitally renovated condition, euro-made windows are installed, the floor is tiled-laminate.It is provided with all the communal amenities.You can call the mentioned phone numbers for details.Translated from Armenian"
22,Panels,No,Available,5 / 9,3,1,98 sq.m.,from 2.8 m,Multiple balconies,Cosmetic Renovation,"Մայակ թաղամաս 30/1, Երևան","$70,000",USD,Ջրվեժ Մայակ թաղամասերեք սենյակ վերանորոգվածՄեջտեղի մուտքբարձրորակ ջեռուցման համակարգգինը սակարկելի
23,Stone,No,Available,6 / 6,2,1,84 sq.m.,from 2.7 m,Not available,No Renovation,"Malyan street, Yerevan","$58,000",USD,"Code-14251: 2-room apartment in Nor Nork 2nd block is for sale. It is a spacious, spacious apartment, it is under renovation.Translated from Armenian"
24,Panels,No,Available,8 / 10,2,1,71 sq.m.,from 2.75 m,Multiple balconies,Partial Renovation,"Victor Hambardzumyan Street 97, Yerevan","$82,000",USD,"Подробности по телефону, окна с двух сторон есть, 2 подвала... Торг на месте. БЕЗ ПОСРЕДНИКОВ. СОБСТВЕННИК."
25,Monolith,Yes,Available,7 / 9,3,2,90 sq.m.,from 3 m,Open balcony,Major Renovation,"Nikoghayos Adonts street, Yerevan","$145,000",USD,"ID01966:3-room apartment for sale in Arabkir, on Adonts street, in a NEW building, 90 sq. M., on the 9 / 7th floor. The apartment is fully renovated, has an open balcony and 2 bathrooms. For sale together with furniture and equipment.Translated from Armenian"
26,Panels,No,Available,1 / 9,2,1,55 sq.m.,from 2.7 m,Not available,Major Renovation,"Bashinjaghyan street, Yerevan","$65,000",USD,"2-3 turned, capitally renovated, laminate flooring, kitchen and corridor floor is pressed granite, bathroom tiled, windows are European, baxi system, has a basement all over the house, parking lot, for sale together with furniture and equipmentAd number: 15359703:Translated from Armenian"
27,Stone,No,Not available,2 / 5,3,2,90 sq.m.,from 2.8 m,Not available,Designer Renovation,"Avanesov street, Yerevan","$87,000",USD,"An apartment is for sale urgently on Avanesov street, Erebuni. Stone building Czech project. The total area is 90 square meters, it is capitally renovated. Wooden parquet, Corridor and kitchen floor is granite, outside door is iron. Bax system. For sale with partial furniture.For details, call the mentioned phone numbers.ArkadyOirirrddTranslated from Armenian"
28,Stone,No,Not available,3 / 4,3,1,97 sq.m.,from 3 m,Multiple balconies,Partial Renovation,"Sayat Nova avenue, Yerevan","$190,000",USD,"3-room apartment in a stone building designed by Stalin for sale on Sayat-Nova Nalbandyan crossroads. Iron entrance door, partial European windows, individual heating system, permanent water, electricity, gas, entrance, balcony, close to the bus stop, all the necessary shops.Translated from Armenian"
29,Monolith,Yes,Available,5 / 8,2,1,70 sq.m.,from 3 m,Open balcony,Major Renovation,"Azatutyan Avenue, Yerevan","$179,000",USD,A luxurious apartment with all amenities is for sale right next to Cascade. Has all utilities. For sale with property and equipment.Translated from Armenian
30,Panels,No,Available,2 / 16,3,1,77 sq.m.,from 2.75 m,Closed balcony,Cosmetic Renovation,Yerevan › Nor Nork,"$77,000",USD,"CODE 2 + 30561:2-3 room converted apartment is for sale on Gay avenue. The apartment is renovated. Iron entrance door, parquet floor, tiles, euro windows.The bathroom is separate, tiled.There is a heating system.It has a balcony.For sale together with kitchen furniture;Translated from Armenian"
31,Panels,No,Available,7 / 9,3,1,96 sq.m.,from 2.8 m,Open balcony,Old Renovation,"Komitas Avenue, Yerevan","$92,000",USD,"(code 3mk 57) 3-room spacious apartment is for sale on Komitas avenue, near the crossroads of Komitas and Papazyan streets. It is a building of Moscow project, with clean, well-maintained entrances. The apartment can be easily turned into a 4-room one, it is very spacious and bright. It has carpet parquet, BAXI individual heating system, open balcony, spacious kitchen and rooms. The building has a spacious yard, parking lot, playground. Close to bus stop, shops, schools, kindergartens, Rio Mall.Translated from Armenian"
32,Monolith,Yes,Available,10 / 14,4,2,154 sq.m.,from 3 m,Multiple balconies,Euro Renovation,Yerevan › Arabkir,"$250,000",USD,"Apartment for saleArabkir, Mamikonyats str.• 4 rooms• 154 square meters• 14 / 10th floor / new building_•thoroughly reconstructed•Heating System• Open balcony• Property / equipment• Iron door• Side:Translated from Armenian"
33,Panels,No,Available,9 / 9,3,1,75 sq.m.,from 2.7 m,Open balcony,Major Renovation,"Tigran Petrosyan street, Yerevan","$95,000",USD,"3-room apartment is for sale in Davitashen. The building is the first line. The apartment has 2 bedrooms, a living room, a kitchen, a big balcony. The roof is completely repaired. The apartment is for sale together with the furniture.Translated from Armenian"
34,Monolith,Yes,Available,9 / 14,3,2,116 sq.m.,from 3 m,Open balcony,Euro Renovation,"Komitas Avenue, Yerevan",,unknown,"3-room euro-renovated apartment is for sale on Komitas avenue, with an area of 116 square meters. It is a side apartment. It has euro windows, laminate flooring, individual heating system, 2 bathrooms covered with quality Spanish tiles, equipped with the necessary sanitary ware. It has an open balcony. Sale of property together with equipment.Translated from Armenian"
35,Stone,No,Not available,1 / 4,4,1,69 sq.m.,from 2.7 m,Closed balcony,Partial Renovation,"Davit Bek street, Yerevan","$55,000",USD,"EXCHANGE IS POSSIBLE WITH OWN HOUSE LOCATED IN EREBUNI REGION OF YEREVAN (except Sari Tagh and Sovetashen)!The apartment is in normal condition, has all the communal facilities ե It is a stone RESIDENTIAL building, IT WAS RESIDENTIAL IN THE PAST, The first floor is high! The 3 rooms have been turned into 4 rooms, it has a basement, a small plot of land in front of the house, it is close to Vardavar (Tokhmakh) park, only those who really want to apply. The bathroom needs renovation. For more information call:Translated from Armenian"
36,Panels,No,Available,2 / 9,3,1,94 sq.m.,from 2.75 m,Multiple balconies,Major Renovation,Yerevan › Kentron,"$210,000",USD,"Code 5 + 33518:3-room apartment is for sale in Small Center. The apartment is fully renovated. Iron entrance door. Floor: Laminate, tile. It has a heating system and air conditioner. The bathroom is combined, tiled. It has a balcony. For sale together with furniture and equipment.Translated from Armenian"
37,Stone,Yes,Not available,5 / 6,5,2,180 sq.m.,from 3 m,Multiple balconies,No Renovation,"Armen Tigranyan street 38, Yerevan","$105,000",USD,"Victory 200 meters away from the park (in the monument) : A. 5-room duplex apartment of 180 sq. M. Is for sale on the 5th-6th floors of a newly built 5-storey stone building on Tigranyan street. M area.• The construction of the building was done about 12 years ago, all the communications in the newly built section have been changed, in particular the sewerage, water lines, electric wires.• The apartment is in an additional part of a stone duplex built especially for apartments, in zero condition, windows are installed, mezzanine stairs միջ Partitions on the 2nd floor.• The apartment has a three-sided south-eastern position, due to which it is constantly grazed during the day.• The apartment has 2 spacious open balconies with a wonderful view of Mount Ararat and Victory Park.• On the 1st floor there is a living room, a bathroom, a kitchen, a bedroom, an open balcony.• 2nd floor: Hall, 3 bedrooms, bathroom, open balcony.• The second floor is not a mansard, but a full floor.• Has the ability to install a personal elevator.Hurry up to get this unique apartment, because with this project, the last of the apartments is left.For other details, write or call the mentioned numbers.The apartment is displayed under a real estate display contract.Service commission - 2% of the sale price.Translated from Armenian"
38,Panels,No,Available,8 / 10,3,1,90 sq.m.,from 2.75 m,Closed balcony,No Renovation,"Sharuri street, Yerevan","$62,000",USD,"3 rooms for sale. Apt. Side-by-side, state of affairs.Translated from Armenian"
39,Stone,No,Not available,4 / 5,3,1,76 sq.m.,from 2.75 m,Multiple balconies,Partial Renovation,"Chekhov street, Yerevan","$70,000",USD,"A 3-room apartment is for sale on Chekhov Street. At the intersection of Chekhov and Bagratunyats streets, the apartment has been partially renovated, the electric wires have been partially changed.There is a cab heating system.There is an open balcony.For more information callThe commission of the agency is 2% of the transaction. A contract is signed for the demonstration, please come with an identity document.Translated from Armenian"
40,Panels,No,Available,3 / 9,3,1,67 sq.m.,from 2.75 m,Closed balcony,Major Renovation,"Arzoumanian Street, Yerevan","$75,000",USD,"Fully renovated, heating system, air conditioner, kitchen-bedroom furniture, side.Translated from Armenian"
41,Panels,No,Available,4 / 9,1,1,44 sq.m.,from 2.7 m,Not available,Major Renovation,"Yervand Kochar street, Yerevan","$90,000",USD,"Նոր կապիտալ վերանորոգված, եվրո/դռ. ԵՒ պատուհան. , սանհանգույցը և խոհանոցը իսպանական սալիկ, մետլախ, մշտական տաք և սառը ջուր, գազ, ջեռուցման համակարգ, վերելակ:"
42,Stone,No,Not available,5 / 5,2,1,56 sq.m.,from 2.75 m,Closed balcony,Partial Renovation,"Artashisyan street, Yerevan","$55,000",USD,"2 rooms for sale. Apt. The windows are of European production, the bathroom and the kitchen is tiled, clean condition.Translated from Armenian"
43,Panels,No,Available,1 / 9,3,1,73 sq.m.,from 2.7 m,Closed balcony,Partial Renovation,"Մինսկի փողոց 16, Երևան","24,000,000 ֏",AMD,"Sale. 3-room apartment on the 1st floor. Partial renovation. The entrance door is changed to iron. Bedroom windows changed. There is a yard area in the back, where it is possible to park a car.Translated from Armenian"
44,Monolith,Yes,Available,11 / 12,3,2,80 sq.m.,from 3 m,Open balcony,No Renovation,"Nikoghayos Tigranyan street, Yerevan","$96,000",USD,Beautiful and large yardThere is no problem with parkingIt has been put into operationTranslated from Armenian
45,Panels,No,Not available,3 / 5,3,1,65 sq.m.,from 2.6 m,Closed balcony,Old Renovation,"Moldovakan street, Yerevan","23,000,000 ֏",AMD,"Nor-Nork 2nd block, The apartment is in good condition, has gas and permanent water, individual heating system, partial euro windows, metal door, furniture, basement and plotTranslated from Armenian"
46,Panels,No,Available,12 / 14,3,2,82 sq.m.,from 2.75 m,Open balcony,Old Renovation,"Komitas Avenue, Yerevan","$76,000",USD,"BITCOIN:The apartment is in good condition, the bathroom is tiled, the entrance door is iron. The apartment has an open balcony, a sitting position, two-sided lighting.A school, a kindergarten and many shops are nearby.Trading is also possible through Bitcoin (Crypto Exchange)Translated from Armenian"
47,Stone,No,Not available,5 / 5,3,1,86 sq.m.,from 3 m,Open balcony,Major Renovation,"Byron street, Yerevan","$200,000",USD,"Newly renovated, open balcony, Stalin project, located next to the Opera House, for sale urgently, call for detailsTranslated from Armenian"
48,Wooden,No,Not available,2 / 5,4,1,125 sq.m.,from 3 m,Multiple balconies,Old Renovation,"Mesrop Mashtots Avenue, Yerevan",,unknown,"Վաճառվում է 4 սենյականոց բնակարան Մաշտոցի պողոտայում։ Բնակարանն ունի երկաթյա դուռ, մասնակի եվրոպատուհաններ, հատակը՝ լամինատ, գազ, մշտական ջուր, օդորակիչ, անհատական ջեռուցման համակարգ, շքամուտք, շքապատշգամբ, փակ տնտեսական պատշգամբ։"
49,Panels,No,Available,2 / 14,3,1,67 sq.m.,from 2.75 m,Open balcony,Cosmetic Renovation,"Yervand Kochar street, Yerevan","$85,000",USD,"An apartment converted from 2 to 3 rooms is for sale on Yervand Kochari street, near ""Tashir"" shopping center.It is a neat, bright apartmentTranslated from Armenian"
50,Stone,No,Not available,1 / 5,3,1,83 sq.m.,from 2.8 m,Closed balcony,Euro Renovation,"Komitas Avenue, Yerevan","$125,000",USD,"Arabkir, Komitas avenue, near the crossroads of Vagharshyan street, 2nd line, on the 1st floor of a 5-storey building, 3m high, fully renovated apartment is for sale, it also has 2 basements, with kitchen furniture and built-in closets.Translated from Armenian"
51,Stone,No,Not available,2 / 5,1,1,15 sq.m.,from 2.7 m,Not available,Partial Renovation,"Vardashen 6-th street, Vardashen","$8,000",USD,"Former dormitory, constant hot or cold, call for detailsTranslated from Armenian"
52,Stone,No,Not available,2 / 5,3,1,87 sq.m.,from 3 m,Open balcony,Old Renovation,"Aghbyur Serob street, Yerevan","$93,000",USD,A 3-room apartment is for sale near the watch factoryneeds renovation2 open balconies1 closed balconyStalin projectTranslated from Armenian
