,Construction Type,New Construction,Elevator,Floor,Number of Rooms,Number of Bathrooms,Floor Area,Ceiling Height,Balcony,Renovation,Address,Price,Currency,Description
497,Monolith,Yes,Available,13 / 13,2,2,50 sq.m.,from 3 m,Open balcony,Designer Renovation,"Mesrop Mashtots Avenue, Yerevan","$255,000",USD,Բնակարանը կապիտալ վերանորոգված է դիզայներական ոճով:Վաճառվում է ամբողջ գույքի և տեխնիկաի հետ միասին:ՈՒնի աննկարագրելի գեղեցիկ տեսարան:
498,Monolith,Yes,Available,9 / 14,2,2,80 sq.m.,from 3 m,Open balcony,No Renovation,"Մամիկոնյանց փողոց, Երևան","$1,300",USD,"Urgent! 3-room apartment for sale in a new building on Mamikonyants street, 80 sq. M. Մ. , high ceilings, 14/9 floor open balcony.Zero condition (plaster sash) Euro windows, side position.Ad number: N328:Agency:Translated from Armenian"
499,Panels,No,Available,10 / 11,2,1,55 sq.m.,from 2.7 m,Closed balcony,Major Renovation,"Mamikonyants street, Yerevan","$79,000",USD,"(kod 2mk 138) 2-room apartment is for sale in Arabkir, on Mamikonyants street, near KARUSEL supermarket. The building was built in 2000 and has well-maintained and clean entrances անդ stairs. The apartment is fully renovated, it is very bright. It is currently on long-term lease.Translated from Armenian"
500,Stone,No,Not available,4 / 4,3,1,109 sq.m.,from 3 m,Multiple balconies,Old Renovation,"Մովսես Խորենացու փողոց 14, Երևան","$170,000",USD,"An apartment is for sale on Khorenatsi street, near the Kindergarten, in a building designed by Stalin.• The apartment has a three-sided, projecting and bright position.• There are three spacious open balconies with beautiful views.• There are the best shopping and entertainment centers on site.For other details, write or call the mentioned numbers.The apartment is displayed under a real estate display contract.Service commission - 2% of the sale priceTranslated from Armenian"
501,Monolith,Yes,Available,8 / 12,5,3+,260 sq.m.,from 3 m,Multiple balconies,Major Renovation,"Teryan street 66, Yerevan",,unknown,"#BITCOIN:A spacious 5-room apartment with a total area of 260 square meters is for sale on the crossroads of Teryan and Isahakyan streets, near the Yeritasardakan metro station.* It is located on the 8th floor of a 12-storey new residential building.* The building is considered one of the best in the city and the building is famous for its modern architectural engineering solutions.* The building has a 24-hour security system with staff, swimming pool, reception, gym - Only for the residents of the building.* The apartment is fully renovated, still uninhabited.* Panoramic windows are installed from the floor to the ceiling, so the area is full of lighting.* Heating and cooling are done by centralized system.* There is a laundry room, a dressing room and 3 open balconies with views of Mother Armenia, Cascade Complex, Opera and Ballet Theater.* The floor is covered with high quality oak parquet.* Interior doors are also made of wood. The apartment has 3 bathrooms, which are tiled with European tiles.* The building has a service fee, which includes heating and cooling costs.* There is an underground garage for 2 cars.* All the shops, banks, infrastructure and entertainment places are nearby.Translated from Armenian"
502,Stone,No,Not available,1 / 5,3,1,78 sq.m.,from 2.7 m,Not available,Old Renovation,"Margarian street, Yerevan","$72,000",USD,"* Address-Ajapnyak-Margaryan street ** Near Kaiser Supermarket ** 1st line ** Cosmetically renovated ** 3 rooms, spacious ** Constant hot and cold water ** Kitchen furniture, built-in cabinets ** Power cords changed, water lines changed ** Parquet floor ** There is a 50 square meter area in front of the apartment, fenced *Translated from Armenian"
503,Panels,No,Available,6 / 12,3,1,76 sq.m.,from 2.75 m,Closed balcony,Cosmetic Renovation,"Avan-Arinj 2nd micro, Yerevan","$62,000",USD,"Avan, 2nd micro ․․ 3-room, 76 sq. M., 9/9 floorEuro windowold renovationgasClosed balconyBuilt-in closetIron doorTranslated from Armenian"
504,Panels,No,Available,10 / 14,3,1,81 sq.m.,from 2.75 m,Closed balcony,Major Renovation,"Vratsakan street, Yerevan","$90,000",USD,"Urgently for sale, fully renovated apartment, has a heating boiler, sale with furniture and appliances;Translated from Armenian"
505,Stone,No,Not available,5 / 5,4,1,143 sq.m.,from 2.7 m,Multiple balconies,No Renovation,"Babayan street 38, Yerevan","$135,000",USD,"Apartment for sale on Babayan street, on the 5th floor of a 5-storey stone building, 143 sq. M., Czech project (with strong and very thick walls)Call for detailsMonument monument newly built ArabkirTranslated from Armenian"
506,Stone,No,Not available,1 / 5,3,1,80 sq.m.,from 2.75 m,Closed balcony,Partial Renovation,"Komitas Avenue, Yerevan","38,800,000 ֏",AMD,"Վաճառվում է 3 սենյականոց բնակարան, ունի փակ պատշգամբ 13քմ, եվրո պատուհաններ, ունի նկուղ որի մուտքը տանից է, նկուղի մակերեսը նույնպես13քմ է։ Տունը գտնվում է բարվոք վիճակում, սանհանգույցները վերանորոգված են, բաղնիք, տուալետ սալիկապատված, ունի մշտական տաք և սառը ջուր։ Դրսի դուռը երկաթից։"
507,Yerevan › Ajapnyak,,unknown,Փնտրում եմ 1 սենյականոց բնակարան քաղաքի ցանկացած հատվածում գինը միչև 23000 դոլարի սահմաններում,,,,,,,,,,
508,Monolith,No,Available,1 / 14,2,1,48 sq.m.,from 2.7 m,Closed balcony,Major Renovation,"Aksel Bakunts street, Yerevan","$35,000",USD,"Nor-Nork 4th district, with front entrance, Former area, renovated, has all the communal facilitiesTranslated from Armenian"
509,Monolith,Yes,Available,8 / 12,3,1,71 sq.m.,from 2.7 m,Closed balcony,Major Renovation,"Norashen block, Yerevan","$92,000",USD,"A 3-room apartment is for sale in Norashen district, on the 8th floor of a newly built 12-story building, the entrance door of the apartment is made of iron, the windows are European-made, the floor of the hall and kitchen is covered with tiles, the floor of the living room and bedrooms is covered with laminate, the bathroom is tiled, gas, constant hot and cold water, Individual heating system, Closed economic balcony, Apartment for sale with partial furniture and appliances, Near the bus stop.The commission of the agency is 2%, a contract for showing the apartment is signed. Please have an identity document with you.Translated from Armenian"
510,Stone,No,Available,9 / 9,3,1,80 sq.m.,from 2.8 m,Not available,Designer Renovation,"Mantashyan street, Yerevan","$100,000",USD,"The apartment is fully renovated (euro), is provided with all the amenities, is for sale with property.You can call the mentioned phone number for details.For sale with furnitureTranslated from Armenian"
511,Panels,No,Available,6 / 12,2,1,55 sq.m.,from 2.7 m,Not available,Major Renovation,"Yervand Kochar street, Yerevan","$76,000",USD,"2-room apartment on Yervand Kochar street for sale; The apartment is located on the 6th floor of a 12-storey panel building; There is an elevator in the building, the apartment is fully repaired, the bathroom is tiled, there is round-the-clock water supply, gas supply;CODE - 13462049:Translated from Armenian"
512,Panels,No,Available,9 / 9,2,1,63 sq.m.,from 2.75 m,Closed balcony,Major Renovation,"Avan-Arinj 1st micro, Yerevan","$57,000",USD,Վաճառվում է բնակարան Ավան-Առինջումկապիտալ վերանորոգվածպատուհանները եվրոպական արտադրությանանհատական ջեռուցման համակարգլամինատե հատակխոհանոցը և սանհանգույցը սալիկապատմշտական տաք և սառը ջուրմուտքում կա խորդանոցտանիքը վերանորոգվածվաճառվում է գույքի և տեխնիկայի հետ միասին
513,Monolith,Yes,Available,1 / 7,4,2,130 sq.m.,from 3 m,Closed balcony,No Renovation,"Անտառային փողոց 136/5, Երևան","$170,000",USD,"A 4-room apartment in zero condition is for sale in one of the elite districts of Yerevan, in a 7-storey new building in Antarayin.• Iron entrance door, thermo-aluminum windows are installed.• The building will have a well-maintained garden and playground.For other details, write or call the mentioned numbers.The apartment is displayed under a real estate display contract.Service commission - 2% of the sale price.Translated from Armenian"
514,Stone,No,Not available,1 / 5,3,1,72 sq.m.,from 2.8 m,Closed balcony,Major Renovation,"Mesrop Mashtots Avenue, Yerevan","$230,000",USD,ID03689Վաճառվում է 3 սենյականոց բնակարան Կենտրոնում Մաշտոցի պողոտայում 72քմ 5/1 բնակարանը կապիտալ վերանորոգված է վաճառվում է կահույքի և տեխնիկայի հետ միասին
515,Monolith,Yes,Not available,4 / 6,3,1,75 sq.m.,from 3 m,Closed balcony,Major Renovation,Yerevan › Ajapnyak,"$120,000",USD,Construction type: MonolithicCommunity: AjapnyakStreet: LeningradyanCondition: RefurbishedArea: 75 square metersTaxes: 4/6Consists of 3 rooms1 guest room1 kitchen2 bedrooms1 lobby1 bathroom1 balconyThe ceiling height is 3.0 mThe apartment is furnishedSold with property and appliancesSelling price: 120.000 USDCode: GS 441Translated from Armenian
516,Monolith,Yes,Available,4 / 14,2,1,85 sq.m.,from 3 m,Not available,Major Renovation,"Byuzand Street, Yerevan","$440,000",USD,"Beautiful capitally renovated apartment with all its communal facilities, for sale with property and equipmentTranslated from Armenian"
517,Monolith,Yes,Available,5 / 15,5,2,260 sq.m.,from 3 m,Multiple balconies,Euro Renovation,Yerevan › Kentron,,unknown,"A fully renovated apartment is for sale on Teryan avenue, a boat is for rentTranslated from Armenian"
518,Panels,No,Available,4 / 9,2,1,70 sq.m.,from 2.75 m,Not available,Major Renovation,"Bagratunyats Avenue, Yerevan","$75,000",USD,A spacious 2-room apartment is for sale in Bagratunyats Avenue.PROPERTY and TECHNIQUETranslated from Armenian
519,Monolith,Yes,Available,5 / 10,4,2,225 sq.m.,from 3 m,Multiple balconies,Euro Renovation,"Yekmalyan street 1, Yerevan","$655,000",USD,"Sale furnished is also possible empty. The apartment is located on the 5th floor of a 10-storey new monolith building, renovated in ""Art Deko"" style, in combination with the 18th century and Renaissance era, with the latest brand high-quality building materials. The height of the ceiling is 3.10 m. , has concrete roofs. In the pre-construction stage, soundproofing membranes are attached to all the walls of the house. The apartment has ion lamps combined with French ceilings, the lighting works in reverse, and the sockets belong to the ""Vilmar Golt"" series. ""All the tiles, decor and curtains covered with Swarovski stones եզ are gilded, brought from the USA. The whole floor is heated, and the tiles are Spanish. It is heated by"" BAXI ""gas boiler. Produced by the famous ""Roberto Cavalli"", which bear Swarovski stones and crystals. , ""Grab"", ""Oak"" ալ Italian with ""Massive"" wood combination, the apartment has 2 bathrooms, 4 and 6 sq. M. A, Jacuzzi with its drying system. It has an open balcony, 5 sq. M. Մ. Area and closed balcony, 15 sq. M. Մ. Area, 2 living rooms, 50 sq. M. Մ. Area and 30 sq. M. Մ. Area, 3 bedrooms, 2 of which are 20 sq. M. Մ. And the third is 15 square meters. Մ. One lobby, 13 square meters. Մ. Area, 1 kitchen, 20 sq. M. Մ. Եւ 1 wardrobe area. If desired, 30 sq. M. Մ. The living room can be furnished and to become a 4th bedroom. The apartment has a security and fire-fighting system. ""SEASONS"" restaurant, after Margaryan, is nearby. Maternity hospital after Shahumyan School, various supermarkets, bank branches, places of rest and entertainment The apartment has 4 bedrooms, if the tenant wishes it can be rented with 1 bedroom, 2 bedrooms or 3 and 4 bedrooms. In this case, the daily fees will be $ 200-350, the rent - $ 3000-4500 (by deposit) The apartment can also be sold with furniture, with all the property, the furniture of the apartment belongs to the famous Italian ""Natuzzi"" and ""Nieri"" Italian companies var bna jam ora amsapartments for saleapartment for sale in the center of a new buildingApartment for sale in a new building in the centerNear Noraygusaleapartments for sale in the centerApartments for sale in a new buildingTranslated from Armenian"
520,Panels,Yes,Available,10 / 12,3,1,98 sq.m.,from 2.75 m,Not available,Major Renovation,"Margaryan St, Yerevan",,unknown,"The apartment has euro windows, iron door, heating system, the bathroom is tiled, it is on the side, laminate, it is for sale together with the kitchen furnitureTranslated from Armenian"
521,Stone,No,Available,1 / 11,3,1,85 sq.m.,from 2.75 m,Not available,Major Renovation,"Եզնիկ Կողբացու փողոց, Երևան","$185,000",USD,"The apartment has a heated floor, air conditioners, heating system, security system, iron door, euro windows, the entrance to the basement is 10 square meters, which can be used as a pub, the apartment is for sale with furniture and appliances.Translated from Armenian"
522,Stone,No,Available,1 / 7,3,1,122 sq.m.,from 2.8 m,Closed balcony,Old Renovation,"Sundukyan Street, Yerevan","$135,000",USD,Բնակարանը գտնվում է պետական մաքուր վիճակում
523,Monolith,Yes,Available,8 / 8,3,1,70 sq.m.,from 3 m,Not available,Euro Renovation,Yerevan › Nor Nork,"$82,000",USD,"Nor Nork, Gyurjyan str.The apartment has all the communal facilities: Individual heating system, parking lot, children's playground, intended only for the residents of the building, has an area of 20 square meters in the apartment, which can be used for different purposes.Translated from Armenian"
524,Monolith,Yes,Available,13 / 15,2,1,70 sq.m.,from 3 m,Open balcony,Major Renovation,"Komitas Avenue, Yerevan","$120,000",USD,"2-room apartment in a new building on Komitas avenue is for saleIt is capitally renovated. The floor is laminate, tiled. Has an open balcony heating system.Windows of European production.He is on the side.Code- N259:Translated from Armenian"
525,Stone,No,Not available,5 / 5,2,1,50 sq.m.,from 2.8 m,Closed balcony,Old Renovation,"Vahram Papazyan street, Yerevan","$65,000",USD,"CODE 6816:Arabkir, Papazyan streetOn the 5th floor of a 5-storey stone building50 sq. M. Մ. , 2 rooms,Czech projectThe apartment is old renovatedThe roof is also repaired.He is on the side.Price: $ 65,000Translated from Armenian"
526,Monolith,No,Available,5 / 9,2,1,70 sq.m.,from 2.8 m,Not available,Major Renovation,Yerevan › Kentron,"$156,000",USD,-----Բնակարանը կապիտալ վերանորոգված է-----Ունի բոլոր կոմունալ հարմարությունները-----Կոդ K450
527,Monolith,Yes,Available,5 / 17,3,1,95 sq.m.,from 2.75 m,Open balcony,No Renovation,"Byuzand Street, Yerevan","$258,000",USD,"0 condition, euro windows and doors are installed, has an open balcony, the walls are dividedTranslated from Armenian"
528,Stone,Yes,Not available,1 / 6,3,1,125 sq.m.,from 3 m,Open balcony,Cosmetic Renovation,"Tumanyan street, Yerevan","$275,000",USD,-The total area is 125 square meters-It is convenient to use as an office-Code K477:Translated from Armenian
529,Stone,No,Available,2 / 6,2,1,80 sq.m.,from 2.75 m,Closed balcony,Major Renovation,"David Anhaght street, Yerevan","$98,000",USD,"3-room apartment in a stone building with an area of 80 sq. M. Is for sale. The windows of the apartment are of European production, the floor is parquet, the kitchen and the bathroom is tiled with Spanish tiles. The apartment has an individual heating system, elevator. The apartment is for sale together with the kitchen furniture.Translated from Armenian"
530,Stone,No,Not available,5 / 5,2,1,66 sq.m.,from 2.8 m,Closed balcony,No Renovation,"Mesrop Mashtots Avenue, Yerevan","45,000,000 ֏",AMD,"A 2-room apartment is urgently for sale, Mashtots Lusavorich crossroad.The apartment is unrenovated, gas-fired, double-sided windows, sunny side facing Mashtogh Avenue. Close to the Market, entertainment places, bus stop nearby.For more information call:Translated from Armenian"
531,Panels,No,Available,8 / 9,2,1,72 sq.m.,from 2.75 m,Closed balcony,Old Renovation,Yerevan › Davitashen,"$80,000",USD,"Կոդ՝ D-22332Վաճառվում է 2-ը 3 սենյակի ձևափոխված բնակարան Դավթաշենում՝ 9 հարկանի պանելային շենքի 8-րդ հարկում։ Բնակարանը միջին վիճակում է, առաջին գիծ։ Մուտքի դուռը՝ երկաթյա, պատուհանները՝ եվրո, հատակը՝ լամինատ, սանհանգույցը՝ առանձին։ Բնակարանն ունի փակ լոջա, խորդանոց, քարե ավտոտնակ, ջեռուցման համակարգ, մշտական ջուր և գազ։Գործակալության միջնորդավճարը կազմում է 2%, ցուցադրությունների համար կնքվում է ցուցադրման պայմանագիր։ Խնդրում ենք Ձեզ մոտ ունենալ անձը հաստատող փաստաթուղթ։An apartment for sale in Davtashen. The rooms' quantity is 2 remodeled into 3, which includes a hall and 2 bedrooms. The apartment is middle renovated and is located on the 8th floor of the 9-storey panel building, that is stationed on the 1st line. The entrance door is iron-made, the windows are euro-based, the floor is covered by laminate, the bathroom is separate. The apartment has a balcony, storage room, stone garage, heating system and is supplied with constant water and gas.The commission of the Real Estate Agency is 2%. For showing the real estate a contract is signed. Please have passport, ID or driving license with You․"
532,Stone,No,Not available,5 / 5,1,1,32 sq.m.,from 2.8 m,Not available,Old Renovation,"Vagharsh Vagharshyan street, Yerevan","$50,000",USD,ID06459Վաճառվում է 1 սենյականոց բնակարան Արաբկիրում Վաղարշյան փողոցում 32քմ 5/5-րդ հարկում բնակարանը վաճառվում է կահույքի հետ միասին:
533,Monolith,Yes,Available,2 / 8,3,1,68 sq.m.,from 2.7 m,Not available,Major Renovation,"Gyurjyan street, Yerevan","$82,000",USD,"Nor-Nork 3rd block, the apartment is capitally renovated, it is air-conditionedTranslated from Armenian"
534,Stone,No,Not available,5 / 6,2,1,70 sq.m.,from 3 m,Open balcony,Partial Renovation,"Komitas Avenue, Yerevan","$83,000",USD,A stone building of the Stalin project is for saleAnnouncement number. N1026Translated from Armenian
535,Stone,No,Not available,3 / 4,4,1,100 sq.m.,from 3.5 m,Open balcony,Euro Renovation,"Abovyan street, Yerevan","$255,000",USD,"4-room comfortable and bright apartment of 100 sq. M. Is for sale. Մ. Located in the best part of the city, at the crossroads of Abovyan and Isahakyan streets, on the 3rd floor of a 4-storey stone building of historical and cultural value, designed by Stalin. The apartment is fully repaired, an iron entrance door, European windows are installed, it is heated with a gas boiler. The floor is covered with high quality laminate. Bathroom են The kitchen is tiled, the bathroom is equipped with sanitary ware. It has an open-air balcony with a beautiful view. ""Yeritasardakan"" metro station, ""SAS"" supermarket, brand shops, school, cafes and other entertainment places are nearby.In case of questions related to the apartment, or to get acquainted with other properties, please call the mentioned phone number.Sincerely, PROJECT Real Estate Agency.Translated from Armenian"
536,Monolith,Yes,Available,15 / 15,2,1,75 sq.m.,from 3 m,Open balcony,Designer Renovation,"Sevan street, Yerevan","$135,000",USD,"For saleZeytun, P. Sqak str.• 2 rooms• 75 square meters• 15 / 15th floor / New building /_P. A bright 2-room apartment with a high-quality renovation is for sale on the 15th floor of a 15-story monolith building in a newly built building on Tsak street. The apartment has a unique design, the total area is 75 square meters. Iron entrance door, euro windows, gas boiler, air conditioners are installed. The floor is covered with high quality parquet and tiles. The bathroom is tiled with European tiles, equipped with sanitary ware. The apartment is modernly furnished, provided with modern equipment. All property is new. The apartment has an open balcony with a beautiful view. There are 2 elevators in the building, there is a security system. All the necessary shops, banks and transport stops are nearby. For sale together with furniture and equipmentTranslated from Armenian"
537,Stone,No,Available,5 / 7,2,1,71 sq.m.,from 2.75 m,Open balcony,Major Renovation,"Komitas Avenue, Yerevan","$115,000",USD,"BITCOIN:The apartment is fully repaired with high quality materials, the bathroom is tiled, the floor is covered with quality parquet, the entrance door is iron, the windows are of European production. The apartment has individual heating system, shower position, double-sided lighting, open balcony.The apartment is for sale together with all the property and equipment.For more details you can call the mentioned phone numbers.Service commission - 2% of the sale price.Trading is also possible through BITCOIN (crypto exchange) Best CapitalTranslated from Armenian"
538,Stone,No,Not available,4 / 4,4,2,105 sq.m.,from 3 m,Not available,Cosmetic Renovation,"Grigor Lusavorich street, Yerevan","$170,000",USD,"The apartment is located on Grigor Lusavorich Street, next to Mashtots Avenue4/4 floorThe total area is 105 square meters2 side positionshas one bathroomRenovated yardIt has the same area on the roofThe apartment is in a generally clean conditionHeating SystemThe windows have changed7star:Translated from Armenian"
539,Stone,No,Available,4 / 7,3,1,115 sq.m.,from 2.75 m,Multiple balconies,Old Renovation,"Mkhitar Heratsi Street, Yerevan","$135,000",USD,"3-room apartment is for sale on Heratsi street, 115 sq. M. Մ. Located on the 4th floor of a 7-storey special project stone building. The apartment is old renovated. Iron door, partial euro windows are installed, the floor is covered with parquet. It is provided with constant water and gas supply. The bathroom is tiled, equipped with sanitary ware. There are open and closed balconies.Translated from Armenian"
540,Panels,No,Available,2 / 16,3,1,72 sq.m.,from 2.75 m,Not available,Old Renovation,"Saryan Street, Yerevan","$120,000",USD,"Code 12904 3-room apartment is for sale in Kentron community, on Saryan street. The apartment is located on the 2nd floor of an 11-storey panel building, the total area of which is 72 square meters.Translated from Armenian"
541,Stone,No,Not available,5 / 5,3,1,81 sq.m.,from 2.75 m,Open balcony,Major Renovation,Yerevan › Arabkir,"$110,000",USD,Վաճառվում է 3 սենյականոց բնակարան Արաբկիրում։ Վերանորոգված է։ Առկա է բաց պատշգամբ։
542,Monolith,Yes,Available,8 / 14,3,1,122 sq.m.,from 3 m,Open balcony,Major Renovation,"Paronyan street, Yerevan","$225,000",USD,"A spacious 3-room apartment is for sale on Paronyan street, near the Dvin Hotel, on the 8th floor of a 14 storey new building. The total area is 121.7 square meters. Մ.The building is monolithic, seismically resistant, insulated with the latest technologies and standards.The apartment has double-glazed windows, one side looks at the city, the other side overlooks the Hrazdan River and St. Hovhannes Church.Adjacent to the building is the former Dvin, now the David Beck high-class hotel and St. John's Church.The window on the living room wall to the Hrazdan River and overlooking the church is stained glass (floor-to-ceiling), stained-glass windows are the windows of the bedrooms, which open to the open balcony.Translated from Armenian"
543,Monolith,Yes,Available,2 / 10,3,1,92 sq.m.,from 3 m,Open balcony,Major Renovation,Yerevan › Arabkir,"$150,000",USD,"The apartment is renovated. The windows have been changed. It is gasified, has round-the-clock water supply. BAXI heating system is installed. The bathroom is tiled.Translated from Armenian"
544,Monolith,Yes,Not available,4 / 4,1,1,40 sq.m.,from 3 m,Open balcony,Euro Renovation,"Hrachya Kochar Street, Yerevan","$69,000",USD,Վրացական Քոչար խաչմերուկ նորակառույց: Վերանորոգվաց բնակարան: Ունի ջեռուցման համակարգ: Շատ լուսավոր բնակարան: Բնակարանից բացվումա հիանալի տեսարան: Վաճառքը գույքով և տեխնիկայովВрацакан Кочар перекресток новостройка Отремонтированная квартира. Есть централизованное отопление. Очень светлая квартирa С квартиры открывается великолепный вид Продажа с мебелью и техникойVracakan Kochar crossroad new building Renovated apartment. There is central heating. Very bright apartment. The apartment offers a magnificent view. Sale with furniture and equipment
545,Stone,No,Available,2 / 5,3,1,80 sq.m.,from 2.8 m,Closed balcony,Cosmetic Renovation,"David Anhaght street, Yerevan",,unknown,"Code 5 + 300587:3-room apartment for sale in Zeytun, D ․ On the Invincible Street. The apartment is cosmetically renovated. Iron entrance door, European windows, parquet floor, kitchen and bathroom are tiled with Spanish tiles. The apartment has an individual heating system. For sale together with kitchen furniture.Translated from Armenian"
