,Construction Type,New Construction,Elevator,Floor,Number of Rooms,Number of Bathrooms,Floor Area,Ceiling Height,Balcony,Renovation,Address,Price,Currency,Description
715,Monolith,Yes,Available,15 / 16,2,1,62 sq.m.,from 3 m,Open balcony,Designer Renovation,"Nairi Zaryan street, Yerevan","$125,000",USD,"2-room apartment for sale. The apartment is fully renovated and furnished. It is provided with all the communal facilities, permanent water supply and gas supply. The apartment has an open balcony with a beautiful view.For details, call the indicated phone numberTranslated from Armenian"
716,Panels,No,Available,5 / 9,3,1,92 sq.m.,from 2.75 m,Multiple balconies,Cosmetic Renovation,Yerevan › Kentron,"$110,000",USD,"Code 2 + 31911:3-room apartment is for sale in Center. The apartment is cosmetically renovated. Iron entrance door, parquet floor, euro windows, tiled kitchen and bathroom.The apartment has an open and closed balcony, heating system.For sale together with furniture and equipment.Translated from Armenian"
717,Monolith,Yes,Available,6 / 18,3,2,93 sq.m.,from 3 m,Open balcony,Designer Renovation,"Nersisyan deadlock, Yerevan","$250,000",USD,For sale together with property and furniture parkingTranslated from Armenian
718,Monolith,Yes,Available,3 / 6,3,2,123 sq.m.,from 3 m,Open balcony,No Renovation,"Verin Antarayin street, Yerevan",,unknown,Շենքը կհանձնվի 2021 ի վերջ
719,Panels,No,Available,9 / 11,3,1,96 sq.m.,from 2.8 m,Not available,Cosmetic Renovation,"Hrachya Kochar Street, Yerevan","$96,000",USD,"CODE 6326:Arabkir, H. Kochar street, 1st lineOn the 9th floor of a 10-storey residential building96 sq. M. Մ. , 3 roomsThe apartment is cosmetically renovatedThere is an OPEN balconyIt is bright and spacious...Translated from Armenian"
720,Stone,No,Not available,3 / 4,1,1,45 sq.m.,from 2.6 m,Closed balcony,Major Renovation,"Manandyan Street, Yerevan","$59,000",USD,"Code - 352. CAPITAL upwards. 1 - 2 Converted, Heating system, STONE BUILDING4/3 floorTranslated from Armenian"
721,Stone,No,Not available,2 / 4,3,1,75 sq.m.,from 2.7 m,Multiple balconies,Partial Renovation,"Artashisyan street, Yerevan","$64,500",USD,"Code - 791. STONE BUILDING, 3 - 4 Converted, Renovated, E / door, European windows, Bathroom kitchen tiled, GAS, Wires Pipes changed, Heating system, Closed and Open balcony4/2 floorTranslated from Armenian"
722,Stone,Yes,Available,5 / 10,3,2,106 sq.m.,from 3 m,Not available,Major Renovation,Yerevan › Kentron,"$281,000",USD,"Kentron district, Saryan street3-room, fully furnished, equipped apartment is for sale on the first line of the Saryan-Pushkin crossroads. The apartment has 2 bedrooms, 2 bathrooms. Parquet, doors and furniture is made entirely of oak, has constant gas, water, electricity, elevator. The apartment is for sale with property and equipment.Translated from Armenian"
723,Panels,No,Available,9 / 9,2,1,67 sq.m.,from 2.7 m,Not available,Major Renovation,Yerevan › Arabkir,"$70,000",USD,"2-room apartment is for sale on Papazyan street, near Rio mall. The roof of the apartment is renovated, individual heating is provided. The apartment is for sale together with the kitchen furniture.Translated from Armenian"
724,Stone,No,Available,1 / 9,2,1,48 sq.m.,from 2.7 m,Open balcony,Major Renovation,Yerevan › Arabkir,"$70,000",USD,"CODE 7161:2-room apartment on Orbeli street for sale. The apartment is fully renovated, has individual heating. There is an open balcony. The apartment is for sale together with the furniture.Translated from Armenian"
725,Stone,No,Not available,2 / 5,3,1,103 sq.m.,from 3 m,Open balcony,Major Renovation,Yerevan › Kentron,"$255,000",USD,"Վաճառվում է 3 սենյականոց բնակարան Սարյան փողոցում, ստալինյան քարե նախագիծ, ծածկը՝ բետոնյա: Բնակարանը կապիտալ վերանորոգված է, անցկացված է անհատական ջեռուցում, տեղադրված է օդորակիչ: Սանհանգույցը սալիկապատված է, որակյալ կաղնե մանրահատակ: Առկա է բաց պատշգամբ"
726,Stone,No,Not available,3 / 4,5,2,130 sq.m.,from 2.7 m,Open balcony,Euro Renovation,"Kievyan street, Yerevan","85,000,000 ֏",AMD,"The apartment is euro-renovated,has all the utilitiesDoors and windows of European productionIndividual heating system is installedair conditionerThe apartment has an open balconyTranslated from Armenian"
727,Panels,No,Available,7 / 9,3,1,80 sq.m.,from 2.75 m,Multiple balconies,Partial Renovation,"B2 DISTRICT, Yerevan","$65,000",USD,"Partly renovated, parquet, bathroom tiled, windows of European production, closed-open balcony, sideTranslated from Armenian"
728,Panels,No,Available,3 / 9,3,1,63 sq.m.,from 3.2 m,Not available,Old Renovation,"Ծովակալ Իսակովի պողոտա, Երևան","$55,000",USD,"2-room apartment for sale in Yerevan. Malatia-Sebastia Ts. Isakov Avenue 38 building 4 apartments. Next to Nep House. The price is 55,000 USD.Translated from Armenian"
729,Monolith,Yes,Available,9 / 13,3,1,86 sq.m.,from 3 m,Multiple balconies,Major Renovation,"Gyulikekhvyan street, Yerevan","$140,000",USD,"3-room project apartment is for sale in Nor Nork, on Gyulikekhvyan street.The total area is 86 square meters.The apartment consists of:1 living room (with kitchen)2 bedrooms1 bathroom2 open balconies (view to Masis mountain)* There is also a parking lot ․ The rent is 15,000 drams.* The apartment is for sale together with the property and equipment.* Living room windows are stained glass.Sale price: 140,000 USDCode: AH 016Translated from Armenian"
730,Monolith,Yes,Available,5 / 14,2,1,85 sq.m.,from 3 m,Open balcony,Major Renovation,"Tsarav Aghbyuri Street, Yerevan","$135,000",USD,"Fully renovated with all its amenities, has an open balconyTranslated from Armenian"
731,Stone,No,Not available,1 / 3,2,1,52 sq.m.,from 3 m,Not available,Old Renovation,Yerevan › Arabkir,"$50,000",USD,"Code 3 + 21637:2-room apartment for sale in Arabkir.It is an apartment in average condition. Iron entrance door, parquet floor.Translated from Armenian"
732,Stone,No,Not available,2 / 4,1,1,35 sq.m.,from 3 m,Not available,Old Renovation,"Azatutyan Avenue, Yerevan","$57,000",USD,Code: 5 + 1028241 room apartment on Azatutyan avenue for sale. The apartment is located on the 2nd floor of a 5-storey Stalin-designed stone building.He is on the side.It is close to the bus stop and shops.Translated from Armenian
733,Panels,No,Available,10 / 10,3,1,80 sq.m.,from 2.8 m,Not available,Old Renovation,"Pushkin Street, Yerevan","$170,000",USD,"ID14598A 3-room apartment for sale in the center on Pushkini street, 80 square meters, on the 10th/10th floor.Translated from Armenian"
734,,,,,,,,,,,,,,
735,Stone,No,Not available,3 / 5,1,1,32 sq.m.,from 3 m,Not available,Cosmetic Renovation,Yerevan › Arabkir,"$55,000",USD,"Ստալինյան նախագծի շենք,Եվրոդռներ և պատուհաններ,Սանհանգույցը սալիկապատված.Գինը սակարկելի։"
736,Panels,No,Available,4 / 12,3,1,94 sq.m.,from 2.7 m,Open balcony,Major Renovation,"Sundukyan Street, Yerevan","$113,000",USD,"Renovated apartment turned into 3-4,European windowsHeating SystemThe bathroom is tiledbuilt-in cabinetshas an open balconyTranslated from Armenian"
737,Stone,No,Not available,2 / 5,3,1,68 sq.m.,from 2.8 m,Closed balcony,Major Renovation,Yerevan › Shengavit,"$58,000",USD,"Urgent sale of 3 rooms. Apartment, Shirak StreetThoroughly reconstructedAlso sold with property and equipment at an additional costHeatingE/p, e/dS/h tilePermanent water and gasBright and sunnyWell-kept yardTranslated from Armenian"
738,Monolith,Yes,Available,12 / 14,3,2,107 sq.m.,from 3 m,Open balcony,No Renovation,"Malkhasyants street 12, Yerevan",,unknown,"We offer HIGH QUALITY price.3-room apartment for sale in a NEWLY BUILT building FROM IMMEDIATELY CONSTRUCTION ՑFirst line, quiet part, near Komitas Avenue.The total area of the apartment is 107 square meters.Here are 16 reasons to buy an apartment in Malkhasyants Complex:Office on the ground floorTightened security systemA + energy saving certificate9 + seismic resistanceThe complex participates in the national mortgage program4000 sq / m green indoor park with a children's playground, where cars will not be allowed to enter.Free children's room under the supervision of our employeeCo-Working space:6-storey parking lot: 5 above-ground and 1 undergroundKONE brand elevators, which are included in the top five elevator companies in the worldOwn pumping stations of German ""Wilo"" brand, equipped with basic-backup pump pumps, and on each floor there are water pressure regulatorsPower substation with 2 different power suppliesWindows and doors and doors made of aluminum profiles with thermal bridges, equipped with complex valves, of German ""Roto"" brandAll apartments have floor-to-ceiling stained glass windows with aluminum thermal frames.European standards for construction quality assuranceA new road connecting Mamikonyants Street to Aram KhachatryanFor more details, please call.Translated from Armenian"
739,Panels,No,Available,9 / 9,3,2,80 sq.m.,from 2.75 m,Not available,Old Renovation,"Marshal Baghramyan avenue 62, Yerevan","$98,000",USD,"3-room apartment is for sale, it is a bright apartment, oak parquet, tiled, metal door, good view from the window Mount Masi. The sale is possible with property as well. Special project, closed roof, which can be used or built.Translated from Armenian"
740,Panels,No,Available,9 / 11,1,1,42 sq.m.,from 2.75 m,Closed balcony,Euro Renovation,"Saryan Street, Yerevan","$87,000",USD,"1 turned 2-room apartment is for sale on Saryan street, 42 sq. M. Մ. Located on the 9th floor of an 11-storey building. The apartment is euro-renovated. Iron door, euro windows, air conditioner are installed, the floor is covered with parquet. It is provided with constant water and gas supply. It is heated by a heating system. The bathroom is tiled, equipped with sanitary ware. There is a closed balcony. The apartment is for sale together with the property.Translated from Armenian"
741,Monolith,Yes,Available,8 / 10,3,2,170 sq.m.,from 3 m,Multiple balconies,Major Renovation,Yerevan › Kentron,,unknown,"Վաճառվում է 3 սենյականոց բնակարան՝ 170քմ մակերեսով: Մուտքի դուռը՝ երկաթյա, պատուհանները՝ եվրոպական արտադրության, գազ, ջեռուցման անհատական համակարգ, հատակը՝ մանրահատակ, նախասրահը և խոհանոցը՝ սալիկապատ, հատակը տաքացվող է, 2 համակցված սանհանգույց ՝ սալիկապատ, վաճառվում է խոհանոցի կահույքի հետ միասին: Ունի 2 բաց պատշգամբ: Մուտքը բարեկարգ է:"
742,Stone,No,Not available,5 / 5,4,1,98 sq.m.,from 2.75 m,Multiple balconies,Old Renovation,"Sebastia Street 134, Yerevan","$62,000",USD,"Urgently for sale 4s apartment on the 1st line stone building, the apartment is in good condition.Translated from Armenian"
743,Monolith,Yes,Available,13 / 14,3,1,97 sq.m.,from 3 m,Multiple balconies,Euro Renovation,Yerevan › Avan,,unknown,"Code 2 + 30612:3-room fully renovated and uninhabited apartment is for sale on Tsarav Aghbyur street. The entrance door is iron, the floor is laminate, the windows are euro, the bathroom is tiled.The apartment has a loggia, heating system.For sale together with furniture and equipment.It is sunny.Translated from Armenian"
744,Panels,No,Available,1 / 9,3,1,54 sq.m.,from 2.75 m,Not available,Euro Renovation,"Arzoumanian Street, Yerevan","$68,000",USD,"1 room apartment is for sale, which has been turned into 3 rooms.The apartment is fully renovated.The windows are of European production, the outside door is iron.The floors of the rooms are laminate, the bathroom, the corridor and the kitchen are tiled.There is gas, heating system.Basement of the house - 30 square meters.For sale with all the property.Special note! Only buyers who want to buy an apartment through the agency will call.The apartment is displayed under a real estate display contract.Please have your ID:Service commission - 2% of the sale priceTranslated from Armenian"
745,Panels,No,Available,9 / 9,1,1,42 sq.m.,from 2.75 m,Closed balcony,Cosmetic Renovation,"Azatutyan Avenue, Yerevan","$60,000",USD,"(kod 1mk 13), Վաճառվում է 1 սենյականոց բնակարան Մոնումենտում: 9 Հարկանի պանելային շենքի 9-րդ հարկում: Բնակարանի ունի 15 տարվա կապիտալ վերանորոգում: Արևկող է, սանհանգույցը սալիկապատ, տան հատակը պարկետ և մետլախ: Տանիքը վերանորոգված է: Գտնվում է շատ հարմար դիրքում: Մոտակայքում կա անհրաժեշտ ամենինչ՝ խանութներ, դպրոցներ, մանկապարտեզներ: Շատ մոտ է կանգառին: Պատուհանից բացվում է գեղեցիկ տեսարան դեպի քաղաք: Հնարավոր է վաճառք նաև քարից ավտոտնակի հետ միասին հավելավճարով"
746,Panels,No,Available,8 / 14,2,1,73 sq.m.,from 2.8 m,Open balcony,Cosmetic Renovation,"Zoravar Andranik street, Yerevan","$63,000",USD,"Cosmetically renovated 2-4 room apartment for sale.There is a cash system, euro windows, an iron door.Translated from Armenian"
747,Stone,No,Available,1 / 7,4,1,100 sq.m.,from 2.8 m,Closed balcony,Euro Renovation,"Hrachya Nersisyan street, Yerevan","$105,000",USD,"Բնակարանը կապիտալ վերանորոգված է և կահավորված, ունի մշտականտաք և սառը ջուր, գազաֆիկացված է, անհատական ջեռուցման ևհովացման համակարգ, էլեկտրալարերը և ջրի խողովակները փոխված են,պատուհանները և դռները եվրոպական արտադրության, սանհանգույցը սալիկապատված, մուտքի դուռը երկաթյա,բնակարանում առկա է սառնարան, լվացքի մեքենա, հեռուստացույց, գազօջախ,հյուրասենյակի, խոհանոցի, ննջասենյակի կահույք, դոմոֆոն:Վաճառվում է ամբողջ գույքի, տեխնիկայի հետ միասին,մանրամասների համար զանգահարել նշված հեռախոսահամարով:"
748,Stone,No,Not available,5 / 5,2,1,73 sq.m.,from 2.8 m,Open balcony,Old Renovation,"Tamanyan street, Yerevan","$235,000",USD,"Bright, sunny apartment on Tamanyan street for saleIn one of the best parts of the city, on the 5th floor of a 5-story stone building.Ceilings are 3.10 highThe apartment needs renovation.It is heated by a gas boiler, the floor is covered with parquet,the bathroom is equipped with plumbing fixtures.It has an open balcony.Translated from Armenian"
749,Panels,No,Available,1 / 9,3,2,88 sq.m.,from 2.75 m,Closed balcony,Major Renovation,"Atoyan street passing, Yerevan","$95,000",USD,"Close to Ereboni Mall, near the 2 high-rises built next to the park, a fully renovated, furnished and clean 3-room apartment with an area of 88 sq. M., on the first floor of a 9-story building, is for sale. It has built-in cabinets, there is a 200-liter water tank above the toilet, 10 sq. M. Renovated basement - which can be converted into an office. Under the rooms, there is a common basement with a height of more than 2 m, where water lines and sewer lines do not pass, and it was repaired and turned into a semi-basement floor. In front of the living room window is a concrete patio and 1 tree that can be fenced. There is parking in front of the one bedroom window - which can also be fenced off to the end of the concrete driveway. More than 50 square meters in total. There is Wi-Fi for 3,000 drams per month, and a telephone for 500 drams per month. Currently undergoing some cosmetic renovations.Translated from Armenian"
750,Stone,No,Not available,3 / 3,4,1,130 sq.m.,from 3.5 m,Open balcony,Cosmetic Renovation,"Shahsuvaryan street, Yerevan","$110,000",USD,"Արաբկիր, Կոմիտասի եկեղեցու մոտ3 հարկանի քարե շենքի 3-րդ հարկումՍտալինյան նախագիծ՝ առաստաղի բարձրությունը 3,20մ:130 ք. Մ. , 5 սենյակՈւնի մեծ բաց պատշգամբ 2 ննջասենյակներից կա ելք դեպի պատշգամբ:Տանիքը կապիտալ վերանորոգված է,Կոդ 5506"
751,Stone,No,Not available,1 / 5,3,1,75 sq.m.,from 2.75 m,Closed balcony,Partial Renovation,"Artashisyan street, Yerevan","$60,000",USD,"Partly renovated, closed balcony,Iron door, European windows,Gas, projectile, SHTAPTranslated from Armenian"
752,Panels,No,Available,16 / 16,4,1,119 sq.m.,from 2.8 m,Open balcony,Partial Renovation,"Yervand Kochar street, Yerevan","$138,000",USD,"ID12584:4-room apartment is for sale in Center, on Yervand Kochar street, 119 sq. M., on the 16/16th floor. The apartment has an open balcony and a basement.Translated from Armenian"
753,Panels,No,Available,1 / 9,3,1,74 sq.m.,from 2.8 m,Closed balcony,Major Renovation,Yerevan › Nor Nork,"$62,000",USD,"The apartment is located in the 7th block of the new NorkhContact: RenovatedEuro windowsWater, systemKitchen furnitureTranslated from Armenian"
754,Panels,No,Available,5 / 9,3,1,74 sq.m.,from 2.7 m,Closed balcony,Euro Renovation,"Gusan Sheram Street, Yerevan","$77,000",USD,"1-ին գիծ, կանգառին մոտ, Երկաթե դուռ, կապիտալ վերանորոգված, եվրոպատուհաններ, նոր ներսի դռներ, փակ տնտեսական պատշգամբ, սանհանգույց խոհանոց սալիկ մետլախ, լամինատե հատակ, գազ, Բաքսի համակարգ, կոնդիցյոներ:ՎԱՃԱՌՎՈՒՄ Է ԿԱՀՈՒՅՔ և ՏԵԽՆԻԿԱՅՈՎ"
755,Panels,No,Available,8 / 14,3,1,84 sq.m.,from 2.75 m,Not available,Euro Renovation,"Gusan Sheram Street, Yerevan","$82,000",USD,"3-room apartment is for sale on the 8th floor of a 14-story panel building on Gusan Sheram street, near Nor Zovk supermarket. The total area is 84 square meters. Iron entrance door, euro windows are installed. The floor is covered with laminate, the entrance hall and the kitchen are tiled.For sale together with kitchen furniture. In case of additional payment, the sale is possible with all the furniture.Call for more information.Translated from Armenian"
756,Stone,No,Not available,4 / 4,4,2,115 sq.m.,from 3.5 m,Multiple balconies,No Renovation,"Tigran Mets Avenue, Yerevan","$120,000",USD,Apartment for sale in Tigran Metsi Avenuenear Khachmeruk of GlinkaStalin's projectHas 2 certificatesYou can easily get 2 apartmentsTranslated from Armenian
757,Stone,No,Not available,2 / 4,3,1,136 sq.m.,from 2.8 m,Closed balcony,Major Renovation,"Nar-Dos street, Yerevan","$150,000",USD,"ID04927Վաճառվում է 3 սենյականոց բնակարան Կենտրոնում Նար-Դոսի փողոցում 136քմ 5/2-րդ հարկում: Բնակարանը ունի 2 բաց պատշգամբ, վաճառվում է կահույքի և տեխնիկայի հետ միասին:"
758,Panels,No,Available,8 / 9,2,1,50 sq.m.,from 2.75 m,Closed balcony,Major Renovation,"Malatia street, Yerevan","$59,500",USD,"A 2-room completely renovated, uninhabited apartment is for sale in Malatya, near ""Yerevan City"".FOR SALE WITH PROPERTY AND APPLIANCESTranslated from Armenian"
759,Panels,No,Available,3 / 9,4,2,100 sq.m.,from 2.75 m,Closed balcony,Euro Renovation,Yerevan › Malatia-Sebastia,"35,000,000 ֏",AMD,"Babajanyan street near the roadEDSK, e / d, balcony, and / or, doors, Baxi, bathroom, kitchen and entrance hall: Tiled, laminate floor, kitchen furniture, storage room, permanent water, gas, shower, urgent.Translated from Armenian"
760,Stone,No,Not available,4 / 5,4,1,100 sq.m.,from 2.75 m,Open balcony,Major Renovation,"Khorenatsi street, Yerevan","$185,000",USD,"4-room apartment of 100 sq. M. Is for sale. Մ. Located on Khorenatsi street, on the 4th floor of a 5 storey stone building. The apartment is fully renovated. Iron door, euro windows are installed, the floor is covered with parquet. It is provided with constant water and gas supply. It is heated by a heating system. The bathroom is tiled. It has an open balcony.Translated from Armenian"
761,Stone,No,Not available,3 / 4,1,1,35 sq.m.,from 3 m,Open balcony,Major Renovation,"Nalbandyan street, Yerevan","$100,000",USD,"1 re-planned 2-room apartment is for sale, 35 sq. M. Մ. Located on Nalbandyan street, on the 3rd floor of a 4-storey Stalinist project building. The apartment is fully renovated. It is heated with electricity, an air conditioner is installed. The bathroom is tiled, equipped with the necessary sanitary ware. All the necessary shops and entertainment places are nearby. For sale together with furniture and equipment.Translated from Armenian"
762,Stone,No,Not available,4 / 4,2,1,55 sq.m.,from 3 m,Open balcony,No Renovation,"Sebastia Street, Yerevan","$43,000",USD,"Condition, parquet, gas, open balcony, first line, sideTranslated from Armenian"
763,Stone,No,Not available,5 / 5,3,1,79 sq.m.,from 2.75 m,Multiple balconies,Cosmetic Renovation,"Gyulbenkyan street, Yerevan","50,000,000 ֏",AMD,The apartment is located near the Komitas-Gulbenkyan crossroads. It has 1 closed and 1 open balcony.It is heated by a gas stove. The windows are euro.The apartment is clean and tidy. Price is negotiable.Translated from Armenian
764,Monolith,Yes,Available,8 / 13,2,1,76 sq.m.,from 3 m,Open balcony,Designer Renovation,Yerevan › Arabkir,"$192,000",USD,"Apartment for saleArabkir, Gulbenkyan str.• 76 square meters area• 2 rooms• 13/8th floor/new building/•renovated in designer style• uninhabited•property/equipment• European windows/doors•Heating System• open balcony• sunnyTranslated from Armenian"
765,Monolith,Yes,Available,9 / 14,3,2,105 sq.m.,from 3 m,Open balcony,Major Renovation,"Tsarav Aghbyuri Street, Yerevan","$180,000",USD,The apartment is renovated in an elegant style. For sale with property and equipment. Has all the utilities.Translated from Armenian
766,Monolith,Yes,Available,8 / 15,3,2,102 sq.m.,from 3 m,Open balcony,No Renovation,"Գրիբոյեդովի փողոց, Երևան","70,000,000 ֏",AMD,"The building will be put into operation in the fall of 2024.You will pay me 27,760,000 at the time of sale5,000,000 - 09/22:5,000,000 - 03/23:7,000,000 - 09/23:7,000,000 - 03/24:18,240,000 - from receiving the final ownership certificate (until 09/24)You will be able to start renovation in the apartment from 03/24.The plan is attached. The developer can divide the rooms according to your design.Address: 17 Griboyedov StreetTranslated from Armenian"
767,Panels,No,Available,5 / 9,4,1,86 sq.m.,from 2.8 m,Not available,Designer Renovation,"Armen Tigranyan street, Yerevan","$98,000",USD,Next to Phys Math School in MonumentA completely renovated 4-room apartment is for salethe apartment is in perfect conditionfor sale with kitchen furniturecall to viewTranslated from Armenian
768,Stone,No,Not available,2 / 4,2,1,71 sq.m.,from 3 m,Closed balcony,Old Renovation,Yerevan › Kentron,"$98,000",USD,"10 + 20568:2-room apartment for sale in Center. The apartment is clean.Iron entrance door, parquet floor, euro windows, bathroom tiled with Czech tiles. The apartment has a closed balcony, a basement. He is on the side.Translated from Armenian"
769,Monolith,Yes,Available,5 / 9,3,1,86 sq.m.,from 3 m,Open balcony,Major Renovation,"Ler Kamsari Street, Yerevan","$133,000",USD,URGENT!3-room apartment in a new building is for sale.Located on the grounds of the American University.Renovated. There is an individual heating system.Has the possibility of a second bathroom.Translated from Armenian
770,Panels,No,Available,4 / 9,2,1,71 sq.m.,from 2.75 m,Not available,Major Renovation,Yerevan › Arabkir,"$112,000",USD,"Կոդ՝ D-11289Վաճառվում է կամ տրվում է վարձով 2 սենյականոց բնակարան Բաղրամյան պողոտայում` 9 հարկանի պանելային շենքի 4-րդ հարկում: Բնակարանը կապիտալ վերանորոգված է: Մուտքի դուռը՝ երկաթյա, պատուհանները` Եվրո, հատակը՝ մանրահատակ: Սանհանգույցը՝ առանձին, նորաոճ սալիկապատ, էլ. Լարերը և խողովակները՝ փոխված: Ունի ջեռուցման համակարգ, ներկառուցված պահարաններ, խոհանոցի կահույք, մշտական ջուր և գազ:Գործակալության միջնորդավճարը կազմում է 2%, ցուցադրությունների համար կնքվում է ցուցադրման պայմանագիր։ Խնդրում ենք ձեզ մոտ ունենալ անձը հաստատող փաստաթուղթ։An apartment for sale or for rent in Baghramyan Avenue. The rooms' quantity is 2 (1 hall and 1 bedroom) The apartment is newly renovated and is located on the 4th floor of the 9-storey panel building. The entrance door is iron-made, the windows are euro-based, the floor is covered by parquet. The bathroom is separate and modern tiled, the electric wires and pipes are newly changed. The apartment has a heating system, kitchen furniture, built-in closets and is supplied with constant water and gas.The commission of the Real Estate Agency is 2%. For showing the real estate a contract is signed. Please have passport, ID or driving license with You."
