Type,Floor Area,Address,Price,Currency,Description,Datetime,Furniture,Elevator,Location from the Street,Entrance,Lease Type,Minimum Rental Period,Prepayment,Utility Payments,Links
Retail Space,20 sq.m.,Vayots Dzor › Vernashen,"25,000 ֏",AMD,Shop for rentTranslated from Armenian,Nov-24-2022_22-29,,,,,,,,,https://list.am/en/item/11709686
Retail Space,100 sq.m.,"Jermuk Highway, Vayk","80,000 ֏",AMD,"Space for rent, on the 1st floor of a 5-story building in Vaik city, separated into commercial and storage parts,2 entrances from different sides, bathroom, stained glass windows, spare polkas. Suitable for all types of activities.Translated from Armenian",Nov-24-2022_22-29,Available,Not available,Second Line,Separate from the Street,Direct Lease,6 months,By Agreement,Not included,https://list.am/en/item/18297762
Office Space,70 sq.m.,"Ջերմուկի խճուղի, Vayk","120,000 ֏",AMD,"В г. Вайк, в 135км от г. Ереван, сдаётся в аренду помещение. Оно расположено на государственной трассе Ереван-Мегри. Есть все необходимые условия для работы. Есть электричество, а также горячая и холодная вода. Недалеко от помещения есть магазины, точки питания, чуть дальше-банки.По все вопросам звонить по указанному номеру",Nov-24-2022_22-29,,,,,,,,,https://list.am/en/item/17582101
Retail Space,54 sq.m.,Vayots Dzor › Vayk,"220,000 ֏",AMD,"An auto parts shop is for rent (with goods if desired) the store is located in the city of Vaik, on the 2nd km of the Vaik-Goris highway.For more information callTranslated from Armenian",Dec-15-2022_21-28,,,,,,,,,https://list.am/en/item/18393328
Multifunctional Space,5000 sq.m.,Vayots Dzor › Yeghegnadzor,"$100,000",USD,"Տրվում է վարձով անասնագոմ! Աղնջաձոր գյուղում իր բոլոր հարմարություններով, մշտական ջուր, եռաֆազ հոսանք, էլեվատոր։Անասնագոմին կից՜ունի սենյակ բնակվելու համար բոլոր հարմարություններով։Գինը սակարկելի, լրացուցիչ տեղեկությունների համար զանգահարել’В продаже территория с полностью готовым зданием. Подходит практически под любой вид деятельности, так же при необходимости можно использовать просто для проживания. Все необходимые удобства и коммуникации подключены. Звоните. Хозяин.",Dec-15-2022_21-28,,,,,,,,,https://list.am/en/item/18384038
