Office Space,150 sq.m.,"Չարենցի փողոց 4-րդ նրբանցք, Արմավիր","300,000 ֏",AMD,"Fully renovated space for rent in Armavir cityThe area canwas used as office space, beauty salon.Translated from Armenian",Dec-15-2022_21-29,Not available,Not available,Second Line,Separate from the Courtyard,,Direct Lease,1 year,By Agreement,Not included,https://list.am/en/item/18724355
Automotive Service,,"Էջմիածին փողոց 1, Պտղունք","50,000 ֏",AMD,"The area of the building is 45 square meters, it can be used as a car service pointIt is located on the 1st line of the Yerevan-Echmiadzin highway.These changes can be used as a point of auto serviceCar service fee is 50,000 AMD per monthTranslated from Armenian",Dec-15-2022_21-29,Not available,Not available,First Line,Separate from the Street,,Direct Lease,2 months,1 month,Not included,https://list.am/en/item/17307096
Agricultural Space,5500 sq.m.,Armavir › Araks,"3,000,000 ֏",AMD,"Greenhouses for rent, 18 greenhouses in Araks village of Etchmiadzin, 300 square meters each, 5500 square meters of land, and there is also a mobile home with all its amenities. The cost is AMD 3,000,000 per yearTranslated from Armenian",Dec-15-2022_21-29,Not available,Not available,Second Line,Separate from the Street,,Direct Lease,1 year,By Agreement,Not included,https://list.am/en/item/18594192
Retail Space,24 sq.m.,"Եղիշե Չարենցի փողոց, Վաղարշապատ","50,000 ֏",AMD,"A shop is for rent at 1 Charents Street. First line, has a bathroom.If you have any questions, call or write an email.Translated from Armenian",Dec-15-2022_21-29,Not available,Not available,First Line,Separate from the Street,,Direct Lease,6 months,Without prepayment,Not included,https://list.am/en/item/18478430
Industrial and Manufacturing,54 sq.m.,Armavir › Echmiadzin,"150,000 ֏",AMD,"Duduk workshop with all machine tools is for long-term leasethe area has a front of 6 meters, a depth of 9 meters, a height of 3.6 meters and more, there is no concrete roof, it is covered with plywood and the roof is paneled.Lathe machines 1ka62, 2 pieces of lathe with tables, big tachilo, small tachilo, multi-functional sverlen, compressor with its hose with pulizater, forms for making duduk holes, 1 self, possible 2 self, disc, 2 dazda, 2 tables, I will mention small tools, for example rezet, swerlo...If necessary, I will explain the duduk preparation technology and inform you in detaila contract will be signed for at least 1 year and the new manufacturer should not enter my market.I have been producing for 10 years and I have quite a lot of duduks, we should not disturb each other's normal trade.Translated from Armenian",Dec-15-2022_21-29,Available,Not available,Second Line,Separate from the Street,Outdoor parking,Direct Lease,1 year,By Agreement,Not included,https://list.am/en/item/18691194
Restaurant,300 sq.m.,"Isakov St, Yerevan","500,000 ֏",AMD,"Location, location, location. Renting this 300 sq meters restaurant / shawarma house equipped with furniture, refrigerators, full kitchen, and grills. Great location by the airport off the street.Местоположение, местоположение, местоположение. Аренда этого ресторана/шаурмы площадью 300 квадратных метров оснащен мебелью, холодильниками, полностью оборудованной кухней и грилем. Отличное расположение рядом с аэропортом с улицы.",Dec-15-2022_21-29,Available,Not available,First Line,Common from the Street,Outdoor parking,Direct Lease,1 year,3 months,Not included,https://list.am/en/item/18690096
Multifunctional Space,105 sq.m.,Armavir › Armavir,"90,000 ֏",AMD,"Площадь подходит для офиса. Коммерческих или других целей. Можно использовать как детский сад. Отдельные от подезда, выходы на улицу. Имеется газ, трехфазный счетчик электроэнергии санузел. Подходит под аренду. Цена договорная. Տարածքը հարմար է գրասենյակային, առևտրային և այլ նպատակով օգտագործելու համար։ Հնարավոր է օգտագործել որպես մանկապարտեզ։ Ունի 3 մուտք, Մուտքերը առանձնացված են շենքի մուտքերից, ունի եռաֆազ հոսանք, գազ, սանհանգույց։ Տարածքը վաճառվում է կամ տրվում է վարձով։",Dec-15-2022_21-29,Not available,Not available,First Line,Separate from the Street,,Direct Lease,6 months,By Agreement,Not included,https://list.am/en/item/18720980
Warehouse,350 sq.m.,Armavir › Tairov,"$3,500",USD,"Commercial space for rent with an area of 350 square meters, windows: Euro, hot and cold water, electricity, heating system. It has a very large parking space. A storage room, also a 50 square meter container with all the necessary facilities, a commercial space, can be used as a warehouse, suitable as a printing office. For more information, please call the address 99 Mayrakatyayin Street, Yerevan. The price is negotiable.Translated from Armenian",Dec-15-2022_21-29,Not available,Not available,First Line,Common from the Street,,Direct Lease,5 years,1 month,By Agreement,https://list.am/en/item/18585211
Industrial and Manufacturing,78 sq.m.,Armavir › Armavir,"150,000 ֏",AMD,Call in case of questionsTranslated from Armenian,Dec-15-2022_21-29,Not available,Not available,Second Line,Separate from the Courtyard,Outdoor parking,Direct Lease,6 months,By Agreement,Not included,https://list.am/en/item/18618960
Multifunctional Space,90 sq.m.,"Արագած փողոց 16, Վաղարշապատ","5,000,000 ֏",AMD,"The building is capital, made of stone, has two basements + zalivka, there is water, electricity. One part is capital, the other is partial, for questions, call. Front part 13 x 6 x 8.5 metersTranslated from Armenian",Dec-15-2022_21-29,Not available,Not available,Other,Common from the Courtyard,,Direct Lease,5 years,By Agreement,By Agreement,https://list.am/en/item/18585266
Warehouse,2000 sq.m.,"Կարեն Դեմիրճյանի փողոց 1/22, Փարաքար","3,000,000 ֏",AMD,"Office and warehouse. Office, 2 floors, 300 square metersTranslated from Armenian",Dec-15-2022_21-29,Available,Not available,First Line,Separate from the Street,Outdoor parking,Direct Lease,3 months,By Agreement,Not included,https://list.am/en/item/18717140
Retail Space,1000 sq.m.,"H. Abrahamyan street 19, Parakar","$4,000",USD,"Commercial spaces are for rent. The spaces can be used for a supermarket, pharmacy, fast food restaurant and other similar activities.Translated from Armenian",Dec-15-2022_21-29,Not available,Available,First Line,Common from the Street,Outdoor parking,Direct Lease,1 year,1 month,Not included,https://list.am/en/item/18444898
Agricultural Space,2000 sq.m.,Armavir › Echmiadzin,"1,500,000 ֏",AMD,It is in ready condition. The price is negotiable.Translated from Armenian,Dec-15-2022_21-29,,,,,,,,,,https://list.am/en/item/18458218
Retail Space,20 sq.m.,"Վահան Տերյանի փողոց, Վաղարշապատ","100,000 ֏",AMD,For rent commercial container very suitable for grocery store drug store auto parts etc. Call for inquiriesTranslated from Armenian,Dec-15-2022_21-29,Not available,Not available,First Line,Separate from the Street,,Direct Lease,5 years,By Agreement,By Agreement,https://list.am/en/item/18433648
Warehouse,200 sq.m.,"Mesrop Mashtots street, Vagharshapat","200,000 ֏",AMD,Warehouse and production premises for rent. The first lane on the highway to Etchmiadzin is equipped with cameras and security guards.Translated from Armenian,Dec-15-2022_21-29,By agreement,Not available,First Line,Separate from the Street,,Direct Lease,3 months,Without prepayment,By Agreement,https://list.am/en/item/18667475
Industrial and Manufacturing,250 sq.m.,Armavir › Tairov,"200,000 ֏",AMD,"A house for rent, not renovated, 60 square meters. Completely fenced. Iron gate.Water, sewer, electricity, internet available. It can also be used as a residential house or storage space.Translated from Armenian",Dec-15-2022_21-29,Not available,Not available,Second Line,Separate from the Street,Outdoor parking,Direct Lease,1 month,By Agreement,Not included,https://list.am/en/item/18639450
Automotive Service,120 sq.m.,Armavir › Arshaluys,"15,000 ֏",AMD,All amenities are thereTranslated from Armenian,Dec-15-2022_21-29,Available,Not available,First Line,Common from the Street,Outdoor parking,Direct Lease,6 months,By Agreement,By Agreement,https://list.am/en/item/18691122
Automotive Service,28 sq.m.,"Yerevanyan Street 29/3, Armavir","15,000 ֏",AMD,"It will be rented. It has a stone garage, box electricity, craftsmen can work in the garageTranslated from Armenian",Dec-15-2022_21-29,Not available,Not available,First Line,Common from the Street,Garage,Direct Lease,5 years,By Agreement,By Agreement,https://list.am/en/item/18713886
Office Space,120 sq.m.,Armavir › Metsamor,"200,000 ֏",AMD,"Վարձով տարածք Մեծամոր քաղաքում 120քմ բոլոր կոմունալ հարմարություններով: Լույս, ջուր, ջեռուցում, գազ։Сдается в аренду помещение площадью 120кв. М. В городе Мецамор. Обустроена туалетом, светом, горячей и холодной питьевой водой, отоплением, газом. На верхнем этаже работает офис wildberries. Торг уместен в зависимости от срока аренды. Мецамор находится в 35км от Еревана)Translated from Armenian",Dec-15-2022_21-29,Not available,Not available,First Line,Separate from the Street,,Direct Lease,1 year,By Agreement,By Agreement,https://list.am/en/item/18391796
Hotel,2000 sq.m.,"Isakov St, Yerevan","$25,000",USD,"Renting 3 story building with 10 Room Hotel with VIP rooms, some rooms with full kitchen, bathrooms all new construction. Furthermore, included on 2nd floor the hotel, 1st floor Restaurant and Banquet Hall, basement another 600 square meters that can be used as night club or for additional rooms. Bonus, including next door shawarma grill house and second restaurant. This is ideal for investors who want to have already built Hotel and Restaurant business. Each floor is approximately 600 square meters and total of 3 floors. Also by the hotel a single restaurant and shawarma grill another 300 square meters with full kitchen and all equipment.Аренда 3-этажного здания с 10-комнатным отелем с VIP-комнатами, некоторые номера с полностью оборудованной кухней, ванные комнаты нового строительства. Кроме того, на 2-м этаже находится отель, ресторан и банкетный зал на 1-м этаже, подвал еще 600 квадратных метров, которые можно использовать в качестве ночного клуба или для дополнительных номеров. Бонус, включая соседнюю гриль-хаус в шаурме и второй ресторан. Это идеально подходит для инвесторов, которые хотят уже построить гостиничный и ресторанный бизнес. Каждый этаж составляет около 600 квадратных метров и в общей сложности 3 этажа. Также рядом с отелем есть один ресторан и гриль-шаурма еще на 300 квадратных метров с полностью оборудованной кухней и всем оборудованием.",Dec-15-2022_21-29,Available,Not available,First Line,Common from the Street,Outdoor parking,Direct Lease,1 year,6 months,Included,https://list.am/en/item/18697550
Industrial and Manufacturing,200 sq.m.,"Պետրոզավոդսկ փողոց, Վաղարշապատ","450,000 ֏",AMD,"Կարի արտադրամաս/Швейный цехСдается в аренду готовый швейный цех (работал больше 30 лет) на 15-20 рабочих мест с оборудованием и товарным остатком (ткани и готовые женские одежды) Площадь цеха 200 м2,Подробности по телефону.",Dec-15-2022_21-29,,,,,,,,,,https://list.am/en/item/18551296
Retail Space,120 sq.m.,"Nar-Dos street 9, Vagharshapat","350,000 ֏",AMD,Commercial space for rentTranslated from Armenian,Dec-15-2022_21-29,Not available,Not available,Second Line,Separate from the Street,Outdoor parking,Direct Lease,1 year,By Agreement,Not included,https://list.am/en/item/18650282
Industrial and Manufacturing,"10,000 sq.m.","Մերձավանի խճուղի, Փարաքար",$500,USD,"It is rented in whole or in part. The area has a separate electricity substation. It is suitable for the organization of all kinds of productions, as well as for the parking of warehouse building equipment.Translated from Armenian",Dec-15-2022_21-29,Available,Not available,First Line,Separate from the Street,"Outdoor parking, covered parking, garage",Direct Lease,1 year,By Agreement,By Agreement,https://list.am/en/item/18655595
Warehouse,200 sq.m.,Armavir › Echmiadzin,"120,000 ֏",AMD,"For questions, call in the area of TsakhboutsakanTranslated from Armenian",Dec-15-2022_21-29,Not available,Not available,Other,Separate from the Courtyard,,Direct Lease,2 years,By Agreement,By Agreement,https://list.am/en/item/18481234
Retail Space,30 sq.m.,"2-րդ փողոց 15, Մերձավան","100,000 ֏",AMD,"An operating grocery store is for rent at 1/1 Merdzavan Street 2. The store is located between residential buildings. There is a village hall, a kindergarten and a school next to the store. For other questions, call the indicated numbers.Translated from Armenian",Dec-15-2022_21-29,Available,Not available,Second Line,Common from the Street,,Direct Lease,1 year,By Agreement,By Agreement,https://list.am/en/item/18382799
Functioning Business,48 sq.m.,"Կամոյի փողոց, Վաղարշապատ","300,000 ֏",AMD,Code A015+ 30% intermediate feePublic space for rent (bistro)Along with the propertyIn the center of Etchmiadzin cityThe area is 48 square metersAshotFor more information callTranslated from Armenian,Dec-15-2022_21-29,Available,Not available,First Line,Common from the Street,Outdoor parking,Direct Lease,1 year,Without prepayment,Not included,https://list.am/en/item/18653530
Retail Space,10 sq.m.,Armavir › Echmiadzin,"130,000 ֏",AMD,"An air-conditioned apartment is for rent in the center of Etchmiadzin, on Kirov street, it has air conditioning, it has been renovated, it has cold water.Translated from Armenian",Dec-15-2022_21-29,Not available,Not available,First Line,Common from the Street,Outdoor parking,Direct Lease,1 year,1 month,Included,https://list.am/en/item/18618334
Office Space,100 sq.m.,Armavir › Echmiadzin,"100,000 ֏",AMD,"Operating business for rent100,000 dramsAMD 50,000 commissionTranslated from Armenian",Dec-15-2022_21-29,Available,Not available,First Line,Common from the Street,Outdoor parking,Direct Lease,1 year,Without prepayment,Not included,https://list.am/en/item/16267285
Everything Else,380 sq.m.,Armavir › Echmiadzin,"2,500,000 ֏",AMD,"Space for rent c. At a distance of 200 m from the Square in Echmiadzin. It has a parking lot, there is a bus stop in front of it serving 20 villages, it is suitable for all kinds of activities, it has gas, electricity, water, three-phase electricityTranslated from Armenian",Dec-15-2022_21-29,Not available,Not available,First Line,Common from the Street,,Direct Lease,2 years,Without prepayment,Not included,https://list.am/en/item/18559792
Industrial and Manufacturing,553 sq.m.,Armavir › Echmiadzin,"300,000 ֏",AMD,"K. A commercial space is for rent in Etchmiadzin, on the first line. The area is 553 square meters. There is a completely renovated office, 2 rest rooms and a bathroom. The cost is AMD 300,000.Agency address - c. Etchmiadzin, Baghramyan 18a/1bTranslated from Armenian",Dec-15-2022_21-29,By agreement,Not available,First Line,Common from the Street,Outdoor parking,Direct Lease,1 year,By Agreement,Not included,https://list.am/en/item/18664269
Office Space,90 sq.m.,"Nalbandyan street, Armavir","150,000 ֏",AMD,"The area is located on the second floor of the ""ISAHAKYAN CENTRE"" building. Office containerTranslated from Armenian",Dec-15-2022_21-29,,,,,,,,,,https://list.am/en/item/18545337
Office Space,90 sq.m.,"Nalbandyan street, Armavir","150,000 ֏",AMD,"The area is located on the second floor of the ""ISAHAKYAN CENTRE"" building. Office containerTranslated from Armenian",Dec-15-2022_21-29,,,,,,,,,,https://list.am/en/item/18545342
Automotive Service,220 sq.m.,"Զվարթնոց թաղամաս, Վաղարշապատ","150,000 ֏",AMD,"A two-story commercial space is for rent or sale on the Yerevan-Echmiadzin main highway in Zvartnots. The total area is 220 square meters, of which 150 is the building. The commercial area is suitable for vulcanizing, (boxer) car washes, and other businesses. The price is AMD 150,000 for rent, and $150,000 for sale. It is also exchanged for a 2-3 room apartment, with an additional payment from you.Agency address - c. Etchmiadzin, Baghramyan 18a/1bTranslated from Armenian",Dec-15-2022_21-29,Not available,Not available,First Line,Common from the Street,"Outdoor parking, covered parking, garage",Direct Lease,1 year,By Agreement,Not included,https://list.am/en/item/18659897
Office Space,100 sq.m.,Armavir › Armavir,"100,000 ֏",AMD,"We give half the price to the store, call for the priceTranslated from Armenian",Dec-15-2022_21-29,,,,,,,,,,https://list.am/en/item/18530382
Agricultural Space,4500 sq.m.,Armavir › Taronik,"90,000 ֏",AMD,"Livestock building for rent in Zeva village of Echmiadzin.Two livestock buildings built on a 4.5ha plot of land.No electricity, gas, water (hot and cold) very suitable for ready-made business.Call for other questions.Translated from Armenian",Dec-15-2022_21-29,,,,,,,,,,https://list.am/en/item/18412826
Retail Space,24 sq.m.,"Մխիթար Հերացու փողոց 8/1, Արմավիր","50,000 ֏",AMD,"A 24 square meter area is for rent, which was used as a vegetable shop. The shop has all the necessary things to run a vegetable shop. If you wish, you can carry out other activities. It is located on Heratsi Street in Armavir city, next to the newly built church.Translated from Armenian",Dec-15-2022_21-29,Available,Not available,First Line,Common from the Courtyard,,Direct Lease,1 month,1 month,Included,https://list.am/en/item/18460272
Retail Space,271 sq.m.,"Էջմիածին փողոց 140, Պտղունք","420,000 ֏",AMD,"25 m. In length, 12 m. The width is 271 square meters. Newly built commercial area with a total area, with three-phase electricity and round-the-clock water supply, in front of the building is the entire length of the building and 11 m. Wide parking space. The area is located on the Yerevan-Echmiadzin highway (near Musaler village, Ptghunk community)Translated from Armenian",Dec-15-2022_21-29,Not available,Not available,First Line,Common from the Street,,Direct Lease,3 years,Without prepayment,Not included,https://list.am/en/item/18386928
Industrial and Manufacturing,300 sq.m.,"Էջմիածնի խճուղի 18, Ապագա","800,000 ֏",AMD,A dairy factory for rent with all its facilities. Tani Panri Ttvaseri Milk Curd. Owned by Sarnara.Translated from Armenian,Dec-15-2022_21-29,Available,Not available,First Line,Separate from the Street,"Outdoor parking, covered parking, garage",Direct Lease,5 years,By Agreement,Not included,https://list.am/en/item/18601688
Multifunctional Space,650 sq.m.,Armavir › Parakar,"520,000 ֏",AMD,"Multipurpose space for rent in Parakyar.There are buildings on the premises that can serve as workshop space and some for storage. The area of the spare part is 650 square meters, AMD 800 per square meter.The area of the production area is 1600 square meters, 1 square meter costs AMD 700.For details, you can call the indicated phone number and the same numberwhatsapp (+ 374)viber (+ 374)Translated from Armenian",Dec-15-2022_21-29,By agreement,Not available,First Line,Separate from the Street,,Direct Lease,1 year,By Agreement,By Agreement,https://list.am/en/item/18432930
Industrial and Manufacturing,400 sq.m.,Armavir › Echmiadzin,"400,000 ֏",AMD,"Production space for rent.The area is under video surveillance, there is a security system, WiFi, three-phase water, constant water.There is parking for trucks and cars.Next to Etchmiadzin-Yerevan highway.Translated from Armenian",Dec-15-2022_21-29,,,,,,,,,,https://list.am/en/item/18494524
Retail Space,80 sq.m.,"Jivani street 15, Armavir","180,000 ֏",AMD,"Area 4 rooms. Renovated, suitable for both commercial and office use (call this number - zero, ninety eight, twenty six, zero, zero, seventy)Translated from Armenian",Dec-15-2022_21-29,,,,,,,,,,https://list.am/en/item/18464931
Multifunctional Space,1200 sq.m.,Armavir › Echmiadzin,"$1,000",USD,Сдаётся площадь от собственника,Dec-15-2022_21-29,,,,,,,,,,https://list.am/en/item/18562642
Everything Else,80 sq.m.,"Vazgen Arajin street, Vagharshapat","250,000 ֏",AMD,"For rent, call for detailsTranslated from Armenian",Dec-15-2022_21-29,,,,,,,,,,https://list.am/en/item/18551391
Agricultural Space,800 sq.m.,Armavir › Echmiadzin,"75,000 ֏",AMD,"Cattle farm for rent, intended for pigs, but can be used for other animals. Livestock farm premises 5.30 / 7.30 plot premises 800 square meters fenced on the main roadTranslated from Armenian",Dec-15-2022_21-30,,,,,,,,,,https://list.am/en/item/18522782
Office Space,1600 sq.m.,"Մեսրոպ Մաշտոցի փողոց, Վաղարշապատ","2,000,000 ֏",AMD,A lot for the innovation center tooTranslated from Armenian,Dec-15-2022_21-30,,,,,,,,,,https://list.am/en/item/18414802
Office Space,50 sq.m.,"Jivani street 15, Armavir","120,000 ֏",AMD,The apartment has two rooms and a bathroom. It is located in front of cheese and bread with a detailed greetingTranslated from Armenian,Dec-15-2022_21-30,,,,,,,,,,https://list.am/en/item/18023745
Hotel,600 sq.m.,"Մերձավանի խճուղի 1, Փարաքար","1,000,000 ֏",AMD,"It is an active business. 10 rooms with their own bathrooms. Some rooms have sauna, swimming pool. All rooms have air conditioning. Has a kitchen. It's on the way. The rent of the entire hotel is AMD 1,000,000 per monthTranslated from Armenian",Dec-15-2022_21-30,,,,,,,,,,https://list.am/en/item/18461590
Retail Space,111 sq.m.,"Mesrop Mashtots street, Vagharshapat","550,000 ֏",AMD,"A two-story space is for rent in Etchmiadzin, with a total area of 111 square meters. It also has a basement. The area is located in the central part of Etchmiadzin city. The space is multifunctional and can be used for office as well as other types of activities.Translated from Armenian",Dec-15-2022_21-30,,,,,,,,,,https://list.am/en/item/18477164
Automotive Service,80 sq.m.,Armavir › Echmiadzin,"100,000 ֏",AMD,The rental price is finalTranslated from Armenian,Dec-15-2022_21-30,,,,,,,,,,https://list.am/en/item/18449655
