Construction Type,New Construction,Elevator,Floors in the Building,Floor Area,Number of Rooms,Number of Bathrooms,Ceiling Height,Floor,Balcony,Renovation,Address,Price,Currency,Description,Datetime,The House Has,Parking,Furniture,Window Views,Appliances,Links
Stone,No,Not available,1.0,126 sq.m.,5,1,from 2.7 m,1.0,Closed balcony,Cosmetic Renovation,"Սուրեն Մատնիշյան փողոց 238, Գյումրի","$40,000",USD,"A privatized apartment on the first floor of a stone building, on the second floor, is for sale. It has constant water, electricity, gas, internet, it is heated, there is a yard, a garage. Near the 5th school.Translated from Armenian",Nov-25-2022_14-08,,,,,,https://list.am/en/item/18028756
Stone,No,Not available,4.0,86 sq.m.,3,1,from 2.7 m,4.0,Open balcony,Cosmetic Renovation,Shirak › Artik,"$16,000",USD,"Urgent sale of a 3-room apartment in Sasuntsi Davti 2/3 flat. 7 (Shushi buildings district), next to the 5th school. The door is iron, the kitchen is furnished.Translated from Armenian",Nov-25-2022_14-08,,,,,,https://list.am/en/item/17101856
Stone,No,Not available,5.0,56 sq.m.,3,1,from 2.6 m,3.0,Closed balcony,Major Renovation,"Մանուշյան փողոց 16Ա, Գյումրի","$40,000",USD,Details telephone overhaul euro repaired baxTranslated from Armenian,Nov-25-2022_14-08,,,,,,https://list.am/en/item/15992398
Monolith,Yes,Not available,5.0,78 sq.m.,3,1,from 3 m,5.0,Multiple balconies,No Renovation,"Ախուրյանի խճուղի 1/1, Գյումրի","$50,000",USD,Akhuryan road in Gyumri. Newly built apartment of 78 sq. M. With 2 open balconies for sale.Translated from Armenian,Nov-25-2022_14-08,"INtercom entry, playground",OUtdoor parking,Not available,"YArd view, street view, city view",,https://list.am/en/item/16290501
Stone,No,Not available,5.0,59 sq.m.,2,1,from 2.8 m,4.0,Not available,Cosmetic Renovation,"5-я улица Антараван 16Б, Гюмри","$23,000",USD,"Продаю 2-х комнатную квартиру в жилом доме.Стоит аристон, дом утеплённый.Плитка в прихожей, в туалете и ванне.Все окна финские, изолированные, с 2-х слойным тетропактом.Входной дверь железный.Рядом есть садик и школаВся мебель остаётся.Хорошие и дружелюбные соседи.Чистая продажа, подходит под ипотеку.Агентам не беспокоить!",Nov-25-2022_14-08,,,,,,https://list.am/en/item/16346480
Stone,Yes,Not available,5.0,60 sq.m.,2,2,from 2.7 m,4.0,Closed balcony,Designer Renovation,"Կամոյի փողոց 38Ա, Գյումրի","$25,000",USD,"2-room apartment for sale. B. H warm apartment. Renovation in bright and warm colors will only lift your spirits. It has 2 bedrooms (1 with a sign), a closed balcony, which can be turned into a children's room. Located on the 4th floor of a 5-storey building. It has a water heater, a clean and tidy bathroom, a toilet. A school and a kindergarten are nearby, there are several playgrounds and shops in the yard. He has a garage. It is the most affordable apartment in the area.Translated from Armenian",Nov-25-2022_14-08,,,,,,https://list.am/en/item/16800195
Stone,No,Not available,1.0,58 sq.m.,3,1,from 2.7 m,1.0,Not available,No Renovation,"Spandaryan Street, Arevshat","$13,000",USD,"A 1-storey private house is for sale in Ar-Shat village, Shirak region, adjacent to a cattle barn, adjacent to a garage.Has 1300 square meters of land,has drinking water, lightThere is a possibility to draw gas.The house needs renovation.Translated from Armenian",Nov-25-2022_14-08,,,Available,,,https://list.am/en/item/17920072
Monolith,Yes,Not available,4.0,150 sq.m.,2,2,from 2.7 m,1.0,Not available,Cosmetic Renovation,"Պարույր Սևակի փողոց 2, Գյումրի","18,300,000 ֏",AMD,"The apartment is located in Gyumri city, P. Sevak Street, next to the Pedagogical Institute, is 2-storey with a privatized basement. The basement is also tiled and has a bathroom, the total area of the basement is 50 square meters. The apartment is also very suitable for commercial use, call for other questions. Exchange with own house is possibleTranslated from Armenian",Nov-25-2022_14-08,,,Not available,,,https://list.am/en/item/17951241
Stone,No,Not available,1.0,225 sq.m.,4,1,from 3.2 m,1.0,Closed balcony,Major Renovation,"Ղուկասյան փողոց 67, Գյումրի","$95,000",USD,The total area of the house is 225 m2.The area of the yard is 541 m2.Overhauled partThe rest by phone.Translated from Armenian,Nov-25-2022_14-08,,,Available,,,https://list.am/en/item/17636308
Stone,No,Not available,3.0,131 sq.m.,2,2,from 3.2 m,3.0,Multiple balconies,Designer Renovation,"Улица Саят-Нова 5, Гюмри","$75,000",USD,"Два уровня (этажа) Все коммуникации (вода, канализация, электрика, газ) новые. Кровля новая, усиленная. Планировка свободная, возможность планирования от двух до пяти комнат. Один открытый балкон смотрит на театр. Большие возможности расширения и бизнеса.",Nov-25-2022_14-08,,,Available,"YArd view, street view, city view","FRidge, stove, washing machine",https://list.am/en/item/18374383
Stone,Yes,Not available,4.0,60 sq.m.,2,1,from 3 m,3.0,Open balcony,Major Renovation,"9-я улица 6, Гюмри","15,000,000 ֏",AMD,"It is for sale, it is in good condition, the house has not been lived in, euro window repair, perfect condition, Mush 2 district, the last price, I will give you a daily rent, the price is negotiable.Translated from Armenian",Nov-25-2022_14-08,,,Available,,,https://list.am/en/item/18033053
Stone,Yes,Not available,4.0,60 sq.m.,2,1,from 3 m,3.0,Open balcony,Euro Renovation,Shirak › Gyumri,"15,000,000 ֏",AMD,"It is for sale, it is in good condition, the house has not been lived in, Mush 2 district, I am giving it as daily rent, the price is negotiable.Translated from Armenian",Nov-25-2022_14-08,,,Available,,,https://list.am/en/item/18066452
Monolith,Yes,Not available,4.0,60 sq.m.,2,1,from 3 m,3.0,Open balcony,Major Renovation,"9-я улица 6, Гюмри","15,000,000 ֏",AMD,"It is for sale, with heating system, with Euro windows, it has not been lived in, perfect apartment in Mush 2 district, I also give a daily rent of 10,000 drams, the price is negotiable.Translated from Armenian",Nov-25-2022_14-08,PLayground,OUtdoor parking,By agreement,YArd view,,https://list.am/en/item/17817740
Stone,No,Not available,4.0,96 sq.m.,4,1,from 2.75 m,2.0,Closed balcony,Old Renovation,"Aram Khachatryan Street 2, Gyumri","13,000,000 ֏",AMD,"The entrance door of the apartment is metal, the interior doors are wooden, the windows are metal-plastic, with all utilities.Code 11-08Translated from Armenian",Nov-25-2022_14-08,,,,,,https://list.am/en/item/18157042
Monolith,No,Not available,4.0,98 sq.m.,4,2,from 3 m,4.0,Closed balcony,Old Renovation,"Trdat Architector street 6, Gyumri","$28,000",USD,"A spacious 4-room apartment is for sale in 58 district (Ani district), Trdat Architect 6 building. The apartment has 2 floors, 4-5 floors, with a closed balcony.In the yard of the building there is a large garden with fruit trees.The apartment is in state condition.Exchange with an apartment in Yerevan is possible.Translated from Armenian",Nov-25-2022_14-08,,,By agreement,,,https://list.am/en/item/17200096
Stone,No,Not available,3.0,68 sq.m.,3,1,from 2.8 m,1.0,Closed balcony,Partial Renovation,Shirak › Gyumri,"$28,000",USD,"3-room apartment is for sale in Gyumri, on Shirakatsi street, 68 sq. M. Մ. , 1/3 floor, partial renovation, stone building.Translated from Armenian",Nov-25-2022_14-08,,,By agreement,,,https://list.am/en/item/17160520
Monolith,Yes,Not available,4.0,107 sq.m.,4,2,from 2.8 m,4.0,Not available,Partial Renovation,Shirak › Gyumri,"$35,000",USD,"The apartment is a duplex, occupies 4 and 5 floors. The windows are changed, there is an individual heating system, one of the bathrooms is completely renovated, the other is in good condition. There is a basement.Translated from Armenian",Nov-25-2022_14-08,,,,,,https://list.am/en/item/17389474
Stone,Yes,Not available,4.0,41 sq.m.,1,1,from 3 m,4.0,Open balcony,Old Renovation,"Սայաթ-Նովա փողոց 9, Գյումրի","24,290,000 ֏",AMD,"Please read carefully - One-room sunny apartment for sale by the owner on Sayat-Nova street-9/9a building-4th floor. The building is in the heart of the city - in the center, in the facade of the theater. The building is a unique new construction in the city center. The total area is 40.5 square meters. The position is sunny. The apartment is in habitable condition, with European windows, with normal household facilities (gas, water, bathroom) It has a large sunny balcony with a tin roof. Can be trimmed. It will be converted into a two-room apartment at low cost. In the back I can give a spacious large closet with an additional, large iron door. The price is 24 million 290 thousand drams. I should add that the apartment prices in all famous 70-80-year-old dilapidated buildings in the city center are double or more expensive. Will negotiate to buyer.I also sell.2. Own house on Koshtoyan Street, near the maternity hospital, 300 square meters, the living room is about 120 square meters /5 rooms/. With yard, trees. With a gate-garage. It is in normal habitable condition with a brand new heating system, the newly purchased Ariston has not been installed yet, it works with Baxi. Interior finishing works can be done on request. The house was fully built, renovated from the ground up in 1994, the documents are available. The sewage and water supply system has also been completely changed. It has a capacious-absolutely dry basement. The entire roof is 07mm zinc sheet. The price is $72,500. Will be negotiated.3. Karashen garage on Hovsepyan Street, with a full basement. Close to Charles Aznavour Square. Currently priced at $1,850 for a quick sale. Bargaining possible.Translated from Armenian",Nov-25-2022_14-08,,,Not available,,,https://list.am/en/item/17914213
Stone,No,Not available,3.0,75 sq.m.,3,1,from 2.75 m,3.0,Open balcony,Old Renovation,"Խաչատուր Աբովյանի փողոց 1/1, Արթիկ","$14,000",USD,"Apartment in Sasuntsi Davit, gas, electricity, water, everything is available, call for detailsTranslated from Armenian",Nov-25-2022_14-08,,,,,,https://list.am/en/item/17574802
Stone,No,Not available,3.0,87 sq.m.,3,1,from 3 m,3.0,Open balcony,Euro Renovation,"Շիրակացի փողոց 61/2Ա, Գյումրի","$80,000",USD,"A spacious, bright, warm apartment is for sale in Gyumri, on the third floor of a three-story building. The apartment is in excellent condition, has three rooms, faces east and west, has two open balconies, individual heating system, constant hot and cold water, iron door. Is, the windows are euro, the windowsills are made of natural stone, the floor is tiled and the bedrooms are laminated. It also has an individual water pump. The roof is completely renovated, there is also a space for a garage in the yard. It is located near the Dwin restaurant. It is sold together with the property.Code 1515Translated from Armenian",Nov-25-2022_14-08,,,,,,https://list.am/en/item/18305562
Monolith,No,Not available,4.0,76 sq.m.,3,1,from 2.8 m,1.0,Not available,Cosmetic Renovation,"13th street, Gyumri","$38,000",USD,"A three room apartment is for sale in 58 Ani district, 13 street, 2nd building (next to the 11th school)The apartment is in good condition, you can separate the entrance.Translated from Armenian",Nov-25-2022_14-08,,,,,,https://list.am/en/item/17022347
Monolith,No,Not available,5.0,100 sq.m.,4,1,from 2.7 m,4.0,Not available,Designer Renovation,Shirak › Gyumri,"$50,000",USD,4-room renovated apartment in Ani district.Translated from Armenian,Nov-25-2022_14-08,,,,,,https://list.am/en/item/13975755
Stone,No,Not available,2.0,110 sq.m.,5,2,from 3.5 m,1.0,Open balcony,Cosmetic Renovation,Shirak › Gyumri,"18,600,000 ֏",AMD,"Gorku 101, near the station, is also suitable for other activities.Translated from Armenian",Nov-25-2022_14-08,,,Not available,,,https://list.am/en/item/17637147
Stone,No,Not available,5.0,63 sq.m.,3,1,from 2.8 m,3.0,Not available,Old Renovation,"Գարեգին Նժդեհի հրապարակ 2Ա, Գյումրի","$30,000",USD,"For sale is a 3-room apartment on the 3rd floor of a 5-story building and a 2-story detached garage near Garegin Nzhdehi Square.The apartment has a bathroom. Storage iron door, total area 63 sq. M. Has telephone and Ucom, Rostelecom internet lines.The garage is located in front of the building, it has two floors, it has a basement, a balcony, iron bars, the entrance door is heat-resistant (made of copper plate), the total area is 47 m. K.There is a playground, a shopping center, a school and a kindergarten near the apartment.The distance from the center is 1.4 km (8 minutes by foot to the center)The total price of the apartment and the garage is AMD 13,000,000.Translated from Armenian",Nov-25-2022_14-08,,,,,,https://list.am/en/item/18358349
Stone,No,Not available,3.0,68 sq.m.,3,1,from 2.75 m,1.0,Not available,Old Renovation,"Շիրակացի փողոց 62, Գյումրի","$28,000",USD,"In the central part of Gyumri, near the Vega store on Shirakatsi street, next to the sanitary epidemiological station, a very comfortable 3-room apartment with a total area of 68 square meters facing east and west is for sale with all communal facilities, hot and cold water, European windows. It is also possible to exchange it with an apartment with 1 + 1 rooms for an additional fee.Translated from Armenian",Nov-25-2022_14-08,,,Available,,,https://list.am/en/item/17254708
Stone,Yes,Not available,4.0,63 sq.m.,3,1,from 2.75 m,4.0,Open balcony,Euro Renovation,"Մուշ 2 թաղամաս 4/30, Գյումրի","$30,000",USD,"Has heating system (mercury), the house is in a completely new condition, the location of the house has never been inhabited, east to westTranslated from Armenian",Nov-25-2022_14-08,,,Not available,,,https://list.am/en/item/17786095
Monolith,No,Not available,4.0,80 sq.m.,3,1,from 2.7 m,3.0,Multiple balconies,No Renovation,"Trdat Architector street, Gyumri","13,300,000 ֏",AMD,"Apartment for sale, Ani district, Trdat Chartarapet street, near the Red Cross.The phone number may not be available, please write.Translated from Armenian",Nov-25-2022_14-08,,,Not available,,,https://list.am/en/item/18081787
Stone,No,Not available,5.0,63 sq.m.,2,1,from 2.75 m,2.0,Open balcony,Major Renovation,"Մուսայելյան փողոց 167, Գյումրի","$48,000",USD,"2 + 1 room, completely renovated. 200,000 is also available for rent.Translated from Armenian",Nov-25-2022_14-08,,,,,,https://list.am/en/item/18232839
Monolith,Yes,Not available,4.0,86 sq.m.,3,1,from 3 m,1.0,Multiple balconies,Old Renovation,"9-րդ փողոց 3, Գյումրի","$29,000",USD,"A 3-room apartment is for sale in the back of the police station in district 58, partially renovated, the door is iron, the bathroom is partially renovated, two balconies, one of which can be converted into a room, it has a basement, a school, a store and a kindergarten are nearby.Call in the eveningTranslated from Armenian",Nov-25-2022_14-08,,,Not available,,,https://list.am/en/item/18078499
Monolith,Yes,Not available,4.0,97 sq.m.,4,1,from 2.75 m,3.0,Not available,Euro Renovation,"Մինաս Ավետիսյանի փողոց 1, Գյումրի","$46,000",USD,"4-room (remodeled 3) (96 square meters) apartment for sale in Ani (58) district of Gyumri city, gas, electricity, hot and cold water, heating, water heater, large bathroom, iron door, 3rd floor. With kitchen furniture, European windows, south-west position, privatized.Комнаты-3, площадь-96, 5/3 этаж,Windows - plastic, south-west, gas, water - 24/7, electricity, heating - individual.Translated from Armenian",Nov-25-2022_14-08,,,By agreement,,,https://list.am/en/item/17995530
Stone,No,Not available,5.0,76 sq.m.,3,2,from 2.8 m,5.0,Multiple balconies,Old Renovation,"Улица Дзержинского 20, Մարալիկ","$13,000",USD,"The apartment is auctioned without exchange and closed! The apartment has not been inhabited since 2000, it is fenced, the electrical connections can be said to be new, the roof is metal. The apartment has a balcony overlooking the 2nd school. The doors and windows are old (Moskovsky) The apartment is located in the center of Maraliko! The building is considered one of the last buildings built in the Soviet period.I can send other pictures if you want.Translated from Armenian",Nov-25-2022_14-08,,,Not available,,,https://list.am/en/item/18371933
Monolith,Yes,Not available,4.0,83 sq.m.,4,1,from 2.8 m,3.0,Not available,Old Renovation,"3rd street 1, Gyumri","15,500,000 ֏",AMD,"АНИ (58) квартал. Площадь 83,23 кв, м. Все ком, удобства. Постоянная горячая и холодная вода, газ, элек-во. Индивидуальное отопление (частично), система Sguirrel. Трубы водоснабжения поменяны (частично) на пластиковые, канализационные тоже. Железная дверь, кладовка, подвал 14 кв, м. Ремонт в изначальном состоянии. Очень тёплая, светлая и сухая квартира. Возможности для внутреннего изменения широкие.Дом расположен на заднем дворе от банка ВТБ. Рядом ГУМ (старый), бистро КАРС. Детсады, Школа, Поликлиника, Аптеки, Банки, множество разных Магазинов на ОЧЕНЬ БЛИЗКОМ расстоянии от дома. С документами НЕТ НИКАКИХ ПРОБЛЕМ. Собственник Я. Чтобы увидеть квартиру звоните по ниже указанному номеру.О ЦЕНЕ ПО ЗВОНКУ НЕ ДОГОВАРИВАЮСЬ! ПО ЦЕНАМ С ОКРАИН И НЕ ПРОСИТЕ! РЕАЛЬНЫЙ ПОКУПАТЕЛЬ ПУСТЬ ПРИДЁТ УВИДЕТЬ - МОЖЕТ БЫТЬ ДОГОВОРИМСЯ!",Nov-25-2022_14-08,,,Not available,,,https://list.am/en/item/18037265
Panels,No,Not available,3.0,80 sq.m.,3,1,from 2.7 m,1.0,Closed balcony,Partial Renovation,"Minas Avetisyan street, Gyumri","$37,500",USD,"Gyumri. The apartment has a heating system, the windows are euro, only the kitchen is fully renovatedTranslated from Armenian",Nov-25-2022_14-08,,,Not available,,,https://list.am/en/item/15673883
Stone,Yes,Not available,2.0,600 sq.m.,5,1,from 2.7 m,2.0,Multiple balconies,Cosmetic Renovation,Shirak › Akhuryan,"$8,000",USD,"2-storey apartment, private house, dry and warm... There is no such price, it is the price of a garage... It is very dry for the size of the house... With a large yard... In New Ayuryan... With iron doors... The area of the house is 222.sq. M:Translated from Armenian",Nov-25-2022_14-08,,,,,,https://list.am/en/item/17232908
Monolith,Yes,Not available,4.0,101 sq.m.,4,1,from 2.75 m,4.0,Multiple balconies,Major Renovation,"Եղիշե Չարենցի փողոց 13Ա, Գյումրի","18,500,000 ֏",AMD,"The apartment is fully renovated. Before the renovation, the water line and wiring were completely changed. The windows are euro, the outer door is iron, individual heating system Mercury, it has an open and closed balcony. It is for sale together with the kitchen, two bedrooms, stylish furniture in the hallway. The part of the roof in the size of the apartment was exploited by me.Translated from Armenian",Nov-25-2022_14-08,,,Available,,,https://list.am/en/item/18233080
Stone,Yes,Not available,4.0,50 sq.m.,2,1,from 2.5 m,4.0,Open balcony,Major Renovation,"Տրդատ Ճարտարապետի փողոց 13, Գյումրի","$29,000",USD,"Վաճառվում է 2 սենյականոց բնակարան, կոմունալ բոլոր հարմարություններով։Տրդատ Ճարտարապետի փողոց 13/1 շենք. Սակարկելի։ Մանրամասների համար զանգահարել։Продается 2-х комнатная квартира, со всеми коммуникациями.Улица Трдат Архитектор, дом 13/1.Торг. Звоните.Translated from Armenian",Nov-25-2022_14-08,,,,,,https://list.am/en/item/18371490
,,,,,,,,,,,"Ֆուրմանով փողոց 53, Գյումրի","13,000 ֏ monthly",AMD,"Վարձով է տրվում տուն՝Գյումրու կենտրոնում: Տունը կապիտալ վերանորոգված է, տեղադրված են եվրո պատուհաններ և միջսենյակային փայտյա դռներ: Հատակը սալիկապատված է, ննջասենյակում՝ մանրահատակ: Տունն ապահովված է շուրջօրյա ջրամատակարարմամբ և գազամատակարարմամբ։Նախատեսված է 3-4 հոգու համար: Տունն ունի խոհանոց ՝իր բոլոր հարմարություններով, լոգարան և լոգասենյակ։Сдается в аренду дом в центре Гюмри. Дом капитально отремонтирован, установлены евроокна и межкомнатные деревянные двери. Пол выложен плиткой, паркет в спальне. Дом обеспечен круглосуточным водоснабжением и газоснабжением. В доме есть кухня со всеми удобствами, ванная и ванная.",Nov-25-2022_14-08,,,,,,https://list.am/en/item/17618412
Stone,No,Not available,5.0,76 sq.m.,3,1,from 2.8 m,5.0,Open balcony,Old Renovation,Shirak › Gyumri,"10,000,000 ֏",AMD,3-room apartment for sale in Gyumri city. Tbilisi highway Khrimyan Hayrik 10a building 35 apartment. Has a long balconyTranslated from Armenian,Nov-25-2022_14-08,,,,,,https://list.am/en/item/17003346
Stone,No,Not available,4.0,75 sq.m.,4,1,from 2.75 m,3.0,Not available,Euro Renovation,"Shirakatsi street, Gyumri","$37,000",USD,"Vajardum 4-room apartment with details of all utilities, call for detailsTranslated from Armenian",Nov-25-2022_14-08,,,,,,https://list.am/en/item/14778939
Panels,No,Not available,5.0,101 sq.m.,4,2,from 2.8 m,2.0,Closed balcony,Partial Renovation,"Պարույր Սևակի փողոց 3, Գյումրի","$45,000",USD,"4-room apartment for sale in Ani district, Paruyr Sjak street, the price is negotiableTranslated from Armenian",Nov-25-2022_14-08,,,,,,https://list.am/en/item/17690159
Monolith,No,Not available,5.0,49 sq.m.,1,1,from 3 m,1.0,Not available,Euro Renovation,Shirak › Gyumri,"$32,000",USD,"58 кварталКвартира находится в отличном состоянии. Теплая, просторная, уютная, светлая квартира на юго-восточной стороне.Имеется полисадник под окнами и подвал.",Nov-25-2022_14-08,,,,,,https://list.am/en/item/18228539
Stone,No,Not available,3.0,56 sq.m.,2,1,from 2.75 m,1.0,Closed balcony,Partial Renovation,"Երևանյան խճուղի 117, Գյումրի","$16,900",USD,"Yerevan highway (Stroymash) Very warm apartment. It has a basement, the entrance is from the house. Gas, electricity, constant cold, hot water. Very good neighbors, peaceful yard, you can park your car right under the windows. The closed balcony has been converted into a bedroom. There is a kindergarten and a school very close.Translated from Armenian",Nov-25-2022_14-09,,,Not available,YArd view,,https://list.am/en/item/17673242
Monolith,No,Not available,4.0,86 sq.m.,3,1,from 2.7 m,4.0,Not available,Cosmetic Renovation,"7-րդ փողոց 2, Գյումրի","$33,000",USD,"3-room apartment 86 sq. M. Is for sale. Մ. Located in Ani district, behind the Church. Exterior door: Wooden, euro windows, interior doors are made of wood. It is provided with round-the-clock water and gas supply. The apartment has 3 closets, open balcony. Outdoor parking spaces are provided for cars. All the necessary shops, places of rest, entertainment, etc. Are nearby.Translated from Armenian",Nov-25-2022_14-09,,,,,,https://list.am/en/item/14072585
Monolith,No,Not available,3.0,117 sq.m.,5,1,from 2.75 m,1.0,Multiple balconies,Old Renovation,"11-րդ փողոց 8, Գյումրի","$36,000",USD,"This 5-room apartment with a total area of 117 sq. M. Is for sale in Ani district, near Pyatoryochka. There is a wooden door, wooden windows, interior doors are made of wood, the bathroom is tiled. It is provided with round-the-clock water supply and gas supply. There are 1 open and 3 closed balconies. Outdoor parking spaces are allocated for cars. All necessary shops, recreation and entertainment places, etc. Are nearby.Translated from Armenian",Nov-25-2022_14-09,,,,,,https://list.am/en/item/18130303
