Monolith,No,Not available,4,103 sq.m.,4,1,from 2.8 m,2,Multiple balconies,Major Renovation,Shirak › Gyumri,"$60,000",USD,"District 58, near Karmir Khach. Clean, good house, iron door wires have been changed and fixed. Partial works are available upon request. Call for more information.Translated from Armenian",Dec-15-2022_22-58,Playground,Outdoor parking,By agreement,"Yard view, street view",Fridge,https://list.am/en/item/18674623
Stone,No,Not available,4,80 sq.m.,3,1,from 2.7 m,4,Multiple balconies,Cosmetic Renovation,"Vazgen Sargsyan street 10ա, Gyumri","$38,000",USD,"Apartment for rent and salec. Gyumri, Vazgen Sargsyan80 square meters. Total area4/4th floor3 + 1 roomStoneLightWith a heating systemUtility with all amenitiesWith hot and cold waterWith propertyBy techniqueOpen balconyRental price: AMD 120,000Selling price: $38,000Translated from Armenian",Dec-15-2022_22-58,,,By agreement,,,https://list.am/en/item/18721427
Stone,No,Not available,5,70 sq.m.,3,1,from 3 m,3,Open balcony,Partial Renovation,Shirak › Artik,"8,900,000 ֏",AMD,"Read carefully, just call! The apartment is located in Shushi Mile, it is the first building on the newly constructed road of the city stadium, the open balcony faces the military unit. The apartment is on the third floor, neighbors live on all sides, it is a very warm and sunny apartment. It is a solid and quality built building. The streets adjacent to the building are paved, there is external lighting. The parquet is of high quality, it does not need to be varnished. The kitchen window has been changed to a European window, the balcony of the room has also been changed, together with the door, it is a European window. It has a large storage room, where a cabinet is assembled, it can serve as a wardrobe or a pantry. The apartment is sold without property. The price will be slightly negotiated with a real buyer.Translated from Armenian",Dec-15-2022_22-58,,,,,,https://list.am/en/item/18399347
Stone,No,Not available,4,60 sq.m.,2,1,from 2.7 m,1,Not available,Cosmetic Renovation,"Խրիմյան Հայրիկ, Գյումրի","$31,000",USD,"Apartment for salec. Gyumri, Khrimyan Hayrik60 square meters. Total area4/1st floor2 roomsStoneUtility with all amenitiesState conditionLightOn the sunny sideSelling price: $31,000Translated from Armenian",Dec-15-2022_22-58,,,Not available,,,https://list.am/en/item/18721303
Stone,No,Not available,2,80 sq.m.,3,1,from 2.8 m,1,Not available,Designer Renovation,"Улица Таманяна, Гюмри","$60,000",USD,"A designer renovated 3-room apartment is for sale on Tamanyan street (Textile district)1 bedroom, 1 living room, the basement is renovated and can be used as a bedroom. Sold together with the property.For details, call the indicated number. Agency.Translated from Armenian",Dec-15-2022_22-58,,,Available,,"Fridge, stove, washing machine, drying machine",https://list.am/en/item/18672848
Panels,No,Not available,5,47 sq.m.,1,1,from 2.8 m,1,Not available,Old Renovation,"Улица Паруйра Севака, Гюмри","$18,000",USD,A 1-room apartment is for sale on Paruyr Sevak street (district 58)State condition without repairs.Call the agency for details.Translated from Armenian,Dec-15-2022_22-58,,,Not available,,,https://list.am/en/item/18682464
Panels,No,Not available,5,74 sq.m.,3,1,from 2.8 m,1,Open balcony,Partial Renovation,"Улица Камо, Гюмри","$28,500",USD,"2 + 1 room apartment for sale on Kamo street, 74 square meters.First floor.For details, call the agency at the indicated phone number.Translated from Armenian",Dec-15-2022_22-58,,,By agreement,,,https://list.am/en/item/18672830
Stone,No,Not available,5,54 sq.m.,3,1,from 2.75 m,1,Not available,Euro Renovation,"Եղիշե Չարենցի փողոց, Արթիկ","$27,000",USD,"2-3-room apartment for sale, 54 square meters. M: High first floor of a 5-story stone building. Renovated, with all utilities. Located in the city center, all necessary infrastructures are nearby. Suitable for both residential and commercial use. It has a basement, a garage, a storage room. Possible sale with or without property and equipment.Translated from Armenian",Dec-15-2022_22-58,,,By agreement,,,https://list.am/en/item/18657674
Stone,No,Not available,2,180 sq.m.,3,1,from 2.8 m,2,Open balcony,Euro Renovation,"Կարեն Դեմիրճյան փողոց, Գյումրի","$120,000",USD,Two-storey first floor with three-phase current facilities with all utilities privatized for details call two-storey for sale togetherTranslated from Armenian,Dec-15-2022_22-58,,,By agreement,,,https://list.am/en/item/18005658
Monolith,Yes,Not available,5,96 sq.m.,4,1,from 2.8 m,3,Multiple balconies,Euro Renovation,"Улица Егише Чаренца 15, Гюмри","$50,000",USD,"A 4-room apartment for sale on Yeghishe Charents street, 37 in front of the school, the apartment is newly renovated and uninhabited, there is a heating system (BAXI), completely new unused, a completely new washing machine, refrigerator, TV, the bathroom is also newly renovated and unused, iron entrance door, windows of European manufacture, the apartment is sold together with property and appliances.Translated from Armenian",Dec-15-2022_22-58,,Outdoor parking,Available,"Yard view, street view, city view","Air conditioner, stove, washing machine",https://list.am/en/item/18687385
Monolith,No,Not available,4,115 sq.m.,4,2,from 2.8 m,1,Not available,Partial Renovation,"Улица Паруйра Севака, Гюмри","$52,000",USD,"Продам 4 комнатную квартиру в городе Гюмри в хорошем районе! Рядом магазины, школы, садики, и хорошая транспортная развязка! В доме установлено газовый котёл 2контурный высококачественный Squirell! Есть дворик с плодороднымый деревьями + место для машины...",Dec-15-2022_22-58,,,Available,,,https://list.am/en/item/18454996
Stone,No,Not available,3,65 sq.m.,3,1,from 2.8 m,3,Open balcony,Partial Renovation,"Խրիմյան Հայրիկ խճուղի, Գյումրի","$29,000",USD,"The apartment is located very close to the center of Gyumri, next to the IMPERIAL restaurantTranslated from Armenian",Dec-15-2022_22-58,Playground,,Available,"Street view, city view",,https://list.am/en/item/18631006
Panels,No,Not available,4,84 sq.m.,3,1,from 2.6 m,3,Open balcony,No Renovation,"Շիրակացի փողոց 1, Գյումրի","$17,000",USD,"The apartment is in state condition, it is not equipped with gas. The price is negotiable, there are no problems with the documents.Translated from Armenian",Dec-15-2022_22-58,,,Not available,,,https://list.am/en/item/18704087
Stone,No,Not available,4,62 sq.m.,2,1,from 2.6 m,2,Closed balcony,Cosmetic Renovation,"Manushyan street 6ա, Gyumri","15,000,000 ֏",AMD,"Permanent gas, water, electricity, internet.Translated from Armenian",Dec-15-2022_22-58,,,Not available,,,https://list.am/en/item/18718556
Stone,No,Not available,5,80 sq.m.,3,1,from 2.5 m,5,Not available,Euro Renovation,"Madoyan Street, Gyumri","$48,500",USD,"It is located in the center of Gyumri, right in front of the Vanatur restaurant. It is on the 5th floor of a 5-story building.Translated from Armenian",Dec-15-2022_22-58,,,,,,https://list.am/en/item/18548076
Stone,No,Not available,3,54 sq.m.,2,2,from 3 m,2,Not available,Major Renovation,"Garegin Nzhdeh Avenue, Gyumri","$50,000",USD,"The apartment is located on Independence Square (G. Nzhdeh 26), near Kenaron Square, it has all communal facilities, there are food outlets, shops, a park and other entertainment places nearby.The total area is divided into 2 separate apartments.It is sold together with property and equipment (everything is new)Suitable for hotel business.Translated from Armenian",Dec-15-2022_22-58,,Outdoor parking,Available,,"Fridge, stove, washing machine",https://list.am/en/item/18495205
Stone,Yes,Not available,4,95 sq.m.,3,1,from 2.7 m,1,Not available,Cosmetic Renovation,"Ղանդիլյանի փողոց, Գյումրի","11,800,000 ֏",AMD,"Apartment for salec. Gyumri, Ghandilyan street95 square meters. Total area50 square meters. Basement (Entrance from the house)4/1st floor3 roomsCosmetically refurbishedStoneUtility with all amenitiesWith hot and cold waterBasementSale price: 11,800,000 AMDTranslated from Armenian",Dec-15-2022_22-58,,,By agreement,,,https://list.am/en/item/18717127
Stone,Yes,Not available,4,95 sq.m.,3,1,from 2.8 m,3,Not available,Euro Renovation,"Aragats street, Գյումրի","300,000 ֏",AMD,"Վարձով է տրվում 3սենյականոց բնակարան քաղաքի կենտրոնում, կոմունալ վճարները մեր վրա, շուրջօրյա հսկողություն։ здаётсья 3комнатная квартира в центре города, комумунальных плат нет, круглосуточная охрана, здаёться дом в центре Гюмри 4комнат есть всё необхадимое 350000в месяц, 30000в день",Dec-15-2022_22-59,,,Available,,,https://list.am/en/item/18293571
Monolith,Yes,Not available,4,150 sq.m.,6,1,from 3 m,1,Multiple balconies,Major Renovation,Shirak › Maralik,"$50,000",USD,"Apartment for sale in K. In Maralik. 6 converted into 4 rooms. The apartment has constant hot and cold water, completely renovated. It has a small, tiled yard, and a large, tiled garage next to it. Also a large pavilion with all facilities. The windows are completely covered with bars. The apartment has open and closed balconies. It has two basements, a small and comfortable kitchen on the outside. For details, call the indicated phone number. NegotiableTranslated from Armenian",Dec-15-2022_22-59,,,,,,https://list.am/en/item/18480905
Monolith,Yes,Not available,4,150 sq.m.,4,1,from 3 m,1,Multiple balconies,Major Renovation,Shirak › Maralik,"$50,000",USD,"An apartment is for sale in the city of Maralik. On the 1st floor of a 4-storey building. 4 rooms, turned into 6, the entrance is separate from the entrance of the building. It has open and closed balconies, a large garage, a pavilion with all its comforts, a summer kitchen, 3 basements, a small plot of land. It is sold together with the property. There are video cameras in the area. The price is negotiable.Translated from Armenian",Dec-15-2022_22-59,,,,,,https://list.am/en/item/18479664
Stone,No,Not available,2,63 sq.m.,2,1,from 3 m,2,Not available,Old Renovation,"Shirakatsi street, Gyumri","$20,000",USD,"Very urgent: I am selling my 2-bedroom apartment, it needs renovation, it is very warm, it also has European windows. The apartment is located almost in the center of the city, in front of the Vayeni Chast, near the Italian polyclinic, school, passport desk, etc. , if you are interested, write to me and I will answer.)) write only real buyers?Translated from Armenian",Dec-15-2022_22-59,Playground,Outdoor parking,Not available,Yard view,,https://list.am/en/item/18589214
Stone,No,Not available,3,66 sq.m.,2,1,from 3.2 m,2,Multiple balconies,No Renovation,"Գարեգին Նժդեհի պողոտա 4/5, Գյումրի","$55,000",USD,"It is the building of 68. The apartment is located next to the newly built park, in front of the NANE hotel. For details, call the indicated number.Translated from Armenian",Dec-15-2022_22-59,,,Available,,,https://list.am/en/item/18532209
Monolith,Yes,Not available,4,50 sq.m.,1,1,from 2.8 m,3,Closed balcony,Partial Renovation,"Պարույր Սևակի փողոց, Գյումրի","12,000,000 ֏",AMD,"1 + 1 Apartment 2 room account. It is a very warm and dry apartment. It is also possible to sell the property, in which case it will increase by $2500, call for details.Translated from Armenian",Dec-15-2022_22-59,Playground,Outdoor parking,Not available,"Yard view, street view",Stove,https://list.am/en/item/18646721
Stone,No,Not available,2,58 sq.m.,2,1,from 3 m,2,Not available,Major Renovation,"Bagratunyats Square 4, Gyumri","$110,000",USD,"2-room apartment for sale in Gyumri University, Haparak (Kirov), Bakratun, the apartment is completely renovated and uninhabited. It is sold with completely new furniture and appliances.Translated from Armenian",Dec-15-2022_22-59,,,Available,,,https://list.am/en/item/18187309
Stone,No,Not available,5,100 sq.m.,5,1,from 2.8 m,1,Closed balcony,Cosmetic Renovation,"Կամոյի փողոց 46, Գյումրի","14,500,000 ֏",AMD,"5 rooms, 1 floor, east-west entrance separate. Possible to divide into 2 housesHouse + shop, house + guest house, there is a basement, a parking lot, a healthy neighborhood with a very solid foundation. Central zone, 2nd lane. Below market valueTranslated from Armenian",Dec-15-2022_22-59,,,Not available,,,https://list.am/en/item/18565497
Stone,No,Not available,3,67 sq.m.,3,1,from 2.75 m,2,Open balcony,Cosmetic Renovation,"Ghandilyan street, Gyumri","$32,000",USD,"Apartment for sale, on the 2nd floor of a 3-story stone building, 2 + 1 rooms, cosmetically renovated, constant hot and cold water, gasification, sunny side, iron entrance door, interior doors and windows Euro, sold with partial ownership.Translated from Armenian",Dec-15-2022_22-59,,,,,,https://list.am/en/item/18383641
Monolith,No,Not available,4,100 sq.m.,4,1,from 2.8 m,2,Not available,Partial Renovation,"Անի թաղամասի 3-րդ փողոց 3, Գյումրի","3,600,000 ₽",RUB,The house is located on the 3rd street of Ani district. The house includes all the property and the location. The house has water supply and gas supply.Call for detailed questionsTranslated from Armenian,Dec-15-2022_22-59,Playground,Outdoor parking,Available,"Yard view, street view","Fridge, washing machine",https://list.am/en/item/18713920
Panels,No,Available,9,95 sq.m.,3,1,from 2.5 m,1,Closed balcony,No Renovation,"Արագած թաղամաս, Գյումրի","$21,000",USD,"Unrenovated 3 + 1 apartment for sale in Gyumri Oragat district, price negotiableTranslated from Armenian",Dec-15-2022_22-59,,,Not available,Yard view,,https://list.am/en/item/18713690
Stone,Yes,Not available,2,98 sq.m.,2,1,from 3 m,1,Not available,No Renovation,"Սարուխանյան փողոց, Գյումրի","$12,500",USD,"The apartment is located in the old part of the nursing home in Noravan district, it needs renovation, one part is newly built, the location of the apartment is south-west, it is owned, there are no problems with the papers.Call for detailed information.Translated from Armenian",Dec-15-2022_22-59,,,Not available,,,https://list.am/en/item/18445897
Stone,No,Not available,3,40 sq.m.,1,1,from 3 m,2,Open balcony,Partial Renovation,"Շիրակացի փողոց 62/7, Գյումրի","$18,000",USD,An apartment with partial renovation is for sale. Open balcony to the southeast. It is furnished (the furniture is old)Translated from Armenian,Dec-15-2022_22-59,Playground,Outdoor parking,Available,Yard view,"Fridge, stove",https://list.am/en/item/18713499
Monolith,No,Not available,4,44 sq.m.,1,1,from 2.7 m,4,Open balcony,Cosmetic Renovation,"Paruyr Sevak St 4, Gyumri","$25,000",USD,"With all utilities, with a separate living room, it is possible to convert one into two rooms. It is possible to sell the property under contract.Translated from Armenian",Dec-15-2022_22-59,,Outdoor parking,Available,,,https://list.am/en/item/18640946
Stone,No,Not available,5,105 sq.m.,4,1,from 3.2 m,2,Multiple balconies,Old Renovation,"Trdat Architector street, Gyumri","$61,000",USD,"Продается 4 комнатная квартира в Гюмри на улице Трдат Чартарапет. На втором этаже. Сделан капитальный ремонт, 105 кв м. Есть 2 балкона, во всех комнатах есть окна, большая светлая чистая квартира. Есть подвал. Возможен торг. Վաճառվում է 4 սենյականոց բնակարան Գյումրի, Տրդատ Ճարտարապետ փողոց, երկրորդ հարկում, կապիտալ վերանորոգված, 105քմ, ունի 2 պատշգամբ, մեծ լուսավոր մաքուր բնակարան։կա նաև նկուղ։ Հնարավոր է սակարկություն։",Dec-15-2022_22-59,,,Not available,,,https://list.am/en/item/18712109
Monolith,No,Not available,2,100 sq.m.,4,2,from 2.8 m,1,Multiple balconies,Old Renovation,"Ghandilyan street, Gyumri","$50,000",USD,"Reinforced concrete bunker-house. 1 high floor of 2. 2 open balconies, 4 rooms, 2 bathrooms. 60 square meters with a dry and bright basement.It is also available for rent, 150,000-200,000Translated from Armenian",Dec-15-2022_22-59,,,Available,,,https://list.am/en/item/18436419
Stone,Yes,Not available,4,40 sq.m.,1,1,from 3 m,2,Not available,Euro Renovation,"Մուշ 2 թաղամաս 12, Գյումրի","$22,000",USD,"South facing, very clean dry warm flat, pool at rear of shopCode 4597296Translated from Armenian",Dec-15-2022_22-59,,,,,,https://list.am/en/item/18108162
Stone,Yes,Not available,5,58 sq.m.,2,1,from 2.7 m,3,Open balcony,Major Renovation,"Մուշ 2 թաղամաս 6, Գյումրի","$28,000",USD,"Վաճառվում է բնակարան Գյումրու Մուշ թաղամասի նորակառույց շենքում, կապիտալ վերանորոգված, մասնակի կահույք, բաքսի համակարգ, տեսարան դեպի բակ, փողոց և այգի: Նորակառույց թաղամասում:Продается квартира в новостройке в Мушском районе в городе Гюмри, капитальный ремонт, частичная мебель, отопление, вид во двор, на улицу и в сад.",Dec-15-2022_22-59,Playground,Outdoor parking,Partial Furniture,"Yard view, street view, park view","Fridge, stove",https://list.am/en/item/18710907
Stone,No,Not available,4,49 sq.m.,2,1,from 2.7 m,4,Open balcony,Old Renovation,"Մեքենավարների փողոց, Գյումրի","$20,000",USD,"The house is located in the settlement of the railway line (behind the line), euro windows, iron exterior door, gas, water. It needs repair. The windows face the sun, it is a very warm house. Details on site.Translated from Armenian",Dec-15-2022_22-59,,Outdoor parking,Not available,Street view,,https://list.am/en/item/18418307
Monolith,No,Not available,4,80 sq.m.,3,1,from 3 m,2,Closed balcony,Old Renovation,Shirak › Gyumri,"$50,000",USD,"The apartment is in good condition with all utilities, in the neighborhood of Shirak Mu, 500m from the central square, the apartment is also for rent.Translated from Armenian",Dec-15-2022_22-59,Playground,Outdoor parking,Available,Street view,"Fridge, stove, washing machine",https://list.am/en/item/18679127
Stone,No,Not available,5,84 sq.m.,4,1,from 2.6 m,2,Multiple balconies,Major Renovation,"Улица С. Григоряна 10А, Гюмри","$60,000",USD,"Վաճառվում է 4 սենյականոց բնակարան Գյումրիում, Երկաթ գծի բանավան թաղամասի Սաշա Գրիգորյան 10ա հասցեում։ Գտնվում է երկաթուղային կայարանի անմիջապես հետևում։ Հենց շենքի հետևում կա մի քանի խանութ, դպրոց, մանկապարտեզ, դեղատուն, ֆուտբոլային դաշտ, հենց բակում կա երեխաների համար նախատեսված փոքր խաղադաշտ։ Շենքը սեյսմակայուն է, ամրացված է ""ԼինՍի"" հիմնադրամի միջոցներով։ Բնակարանը արևկող է, մշտապես տաք։ Ձմռանը չնչին միջոցների հաշվին տունը տաքացվում է շատ հեշտ։ Հյուսիսային և հարավային կողմերից ունի լուսամուտներ։ Բնակարանի բոլոր լուսամուտները ""Եվրո"" են։ Տունը ունի մեծ հյուրասենյակ, 3 սենյակ և երկու փակ պատշգամբ, 1 սանհանգույց - լոգասենյակ և մեծ խոհանոց։ Բոլոր կոմունալ պայմաններով կահավորված է, մշտական տաք և սառը ջուր։ Տունը տաքացվում է պարսկական գազի վառարանով։ Կապիտալ վերանորոգված է։ Գինը վերջնական չէ, ռեալ գնորդներին կսակարկեմ։ Այլ մանրամասների համար զանգահարեք կան գրեք նշված համարին Whatsapp - ով։Продаётся 4 - комнатная квартира в Гюмри, на улице Саша Григоряна 10а. Находится прямо за зданием Железнодорожного вокзала. За самим зданием есть несколько магазинов, школа, аптека, детский сад, футбольное поле, также перед зданием присутствует маленькая игровая площадка для детей. Здание сейсмоусточиво, усилено фондом ""ЛинСи"". В квартиру почти целый день падает солнце, сама по себе тёплая квартира. Зимой очень мало средств уходит на отопление. С северной и южной сторон есть окна. Все окна европейского стандарта. В квартире есть большая гостевая, 3 комнаты, 1 санузел с душевой, большая кухня. Все коммунальные услуги присутствуют на постоянной основе, тёплая и холодная вода постоянно. Дом отопляется газовой печкой, паровой системы нет, но все трубы на месте, при желании можно установить. Ремонт капитальный. Цена не окончательна, с реальными покупателями возможен торг. До лета работает и вариант приобретения под ипотеку. При возникновении других вопросов звонить или писать на Whatsapp по нижеуказанному номеру.",Dec-15-2022_22-59,,,By agreement,,,https://list.am/en/item/18677100
Stone,Yes,Not available,4,111 sq.m.,4,1,from 3.2 m,1,Not available,No Renovation,Shirak › Gyumri,"$9,000",USD,"A space on the first floor of the building is urgently for sale.The area is 111 square meters. M, address Sheram 1, 2 district 3 building (Mush 1)It needs renovation, it is possible to make it into a commercial area or a spacious apartment (4 rooms), the price is $9000 (negotiable)For more information call.Translated from Armenian",Dec-15-2022_22-59,Playground,Outdoor parking,Not available,"Yard view, street view",Air conditioner,https://list.am/en/item/18709875
Stone,No,Not available,5,80 sq.m.,3,2,from 3 m,2,Open balcony,Old Renovation,"Ղանդիլյանի փողոց 28Ա, Գյումրի","$25,900",USD,"The apartment is located not far from the center, the apartment can easily become 4 rooms (if desired), all facilities are nearby: Shops, supermarket, bistro, restaurant, school, kindergarten.The condition of the apartment is clearly visible in the pictures.You can call for details.AGENTS DO NOT CALL, I WORK WITH EVERYONE AT 2%, IF REAL BUYER CALLTranslated from Armenian",Dec-15-2022_22-59,,,Available,"Yard view, street view",Fridge,https://list.am/en/item/18689723
Monolith,No,Not available,4,99 sq.m.,4,1,from 2.7 m,2,Closed balcony,Partial Renovation,"Եղիշե Չարենցի փողոց, Գյումրի","$36,000",USD,"4-room apartment for sale, 99 sq. M. With a plot of land located in the neighborhood of Ani, next to the Danish Hospital. A wooden door is installed, euro windows, interior doors are made of wood. It is provided with round-the-clock water supply and gas supply. Outdoor parking spaces are allocated for cars. There is a closed balcony. Nearby are all necessary shops, playground, recreation and entertainment places, etc.Translated from Armenian",Dec-15-2022_22-59,,Outdoor parking,Not available,"Yard view, street view, city view, park view",,https://list.am/en/item/13968003
Stone,No,Not available,5,70 sq.m.,3,2,from 2.8 m,5,Open balcony,Partial Renovation,"Շիրակացու փողոց 7Բ, Գյումրի","$35,000",USD,"Sunny, sunny, dry and warm, with the heating system, I stayed with the phone number indicated.Translated from Armenian",Dec-15-2022_22-59,,,Not available,,,https://list.am/en/item/18387352
Panels,No,Not available,3,100 sq.m.,4,1,from 3 m,3,Multiple balconies,Designer Renovation,"Պարույր Սևակի փողոց 19, Գյումրի","$60,000",USD,"Completely renovated, with constant hot and cold water, with all utilities, an Ariston system is installed. There is a school, a kindergarten, a supermarket, a bus stop nearby.Translated from Armenian",Dec-15-2022_22-59,,,Not available,,,https://list.am/en/item/18515096
Stone,Yes,Not available,4,77 sq.m.,3,1,from 2.7 m,3,Closed balcony,Cosmetic Renovation,Shirak › Gyumri,"$48,000",USD,"Newly built apartment for sale and rentc. Gyumri, Tbilisi highway77 square meters. Total area4/3rd floor3 roomsStoneUtility with all amenitiesCosmetic repairLightSouth-WestNew constructionClosed balconyFirst lineSelling price: $48,000Rental price: AMD 100,000Translated from Armenian",Dec-15-2022_22-59,,,By agreement,,,https://list.am/en/item/18706847
