Construction Type,New Construction,Elevator,Floors in the Building,Floor Area,Number of Rooms,Number of Bathrooms,Ceiling Height,Floor,Balcony,Furniture,Renovation,Address,Price,Currency,Description,Datetime,Parking,Appliances,Window Views,Links
Stone,No,Not available,4,80 sq.m.,3,1,from 3 m,4,Open balcony,Not available,Old Renovation,Aragatsotn › Tsaghkahovit,"$16,000",USD,"Urgent sale of 3-room apartments, for details, call the indicated numbersTranslated from Armenian",Nov-25-2022_14-10,,,,https://list.am/en/item/18261673
Stone,No,Not available,2,750 sq.m.,4,2,from 3 m,2,Open balcony,,Partial Renovation,Aragatsotn › Ashtarak,"$100,000",USD,"I am selling and exchanging a two-story private house at Proshyan address in Ashtarak city.I am the owner.The total area is 750 square meters.Land 600 square metersEach floor of the house is 150 square meters.Ceilings of two floors made of monolithic concrete.On the first floor there is a large living room, a kitchen, a separate bathroom and a large dryer.On the second floor there are 4 rooms, a large living room and a toilet. From the windows of the rooms you can see a beautiful view of Mount Masis and 80% of the city of Ashtarak.The house has a balcony along the length of the house.It has all utilities (hot and cold), water, gas, electricity.Internet, landline telephone.Translated from Armenian",Nov-25-2022_14-10,,,,https://list.am/en/item/18077784
Panels,No,Available,10,97 sq.m.,3,1,from 2.8 m,2,Multiple balconies,Available,Major Renovation,Aragatsotn › Davtashen,"$115,000",USD,"An apartment is for saleDavtashen, 2nd district• 97 square meters area• 3 rooms•10/2nd/Floor/Panel_• capital repair•Heating System• Euro windows/doors• the bathroom is tiled• Built-in wardrobes• open and closed balconies•storage room• to the sunCode AN381Translated from Armenian",Nov-25-2022_14-10,,,,https://list.am/en/item/18006657
Stone,Yes,Not available,3,55 sq.m.,3,2,from 2.5 m,3,Open balcony,Not available,Partial Renovation,Aragatsotn › Ashtarak,$600,USD,"Do you want to buy an apartment away from the noise of the city, but close to the city?Do you want to be surrounded by greenery, have a wonderful view and all that is affordable?Our offer is just for youBuy apartments: 1 sq. M. Starting from $600, just 15 km from Yerevan, in a newly built neighborhood near the Yerevan-Ashtarak highway.You have a down payment, but you don't have a credit history and you are confident in your abilities, we have an offer for you as well, with installment terms, without a bank, because we will do everything in our power to get you the apartment of your dreams.Completion of the full construction of the district in December 2022.Green areaSecuritySolar systemA wonderful sightClean AirParking lotPlaygroundSwimming-poolTranslated from Armenian",Nov-25-2022_14-10,,,,https://list.am/en/item/16454165
Stone,No,Not available,4,120 sq.m.,4,1,from 2.8 m,4,Open balcony,By agreement,Old Renovation,"Քոթանյան փողոց 10, Թալին քաղաք","15,500,000 ֏",AMD,"Apartment for sale in Talin M. On the 4th floor of a stone building on Kotanyan Street. The building was built in 1994 and is a very strong, earthquake-resistant building (located in front of Talin Hospital) The apartment is gasified, all the wires (multi-core) are made of copper, the parquet is made of oak-beech wood, the roof is completely changed (from the floor), all the windows are forged (very strong) bars, it has an open balcony of 10 sq. M. For sale with property (refrigerator, TV, kitchen, bedroom, living room furniture, food production conditioner) + 6 sq. M. Storage room with 7 25 sq. M. Garage. This building is the strongest residential building built in Talin. Price is not negotiable.Code 01-007Translated from Armenian",Nov-25-2022_14-10,,,,https://list.am/en/item/17643660
Stone,Yes,Not available,2,150 sq.m.,6,2,from 2.7 m,1,Open balcony,Available,No Renovation,"1-ին փողոցի 1-ին նրբանցք 1, Բյուրական","$45,000",USD,"The apartment is newly built and has six rooms. Large outdoor balcony. The roof is new. She is a very beautiful dacha. Has a large orchard. Gas, water, light. The house is fenced. The street is bright and asphalted. Price is negotiable. It is located in Agarak village. It is close to the North-South road.Hoxi chap @ 1040 qarakusi.Translated from Armenian",Nov-25-2022_14-10,,,,https://list.am/en/item/16286458
Stone,No,Not available,5,46 sq.m.,1,1,from 2.7 m,4,Closed balcony,Not available,Old Renovation,Aragatsotn › Tsaghkahovit,"$8,200",USD,"It has gas and water in the permanent area, there is a school, a kindergarten and banks, the village is not like a village, the place is beautiful. Also exchange for a carattention irrelevant place asking price asking eli those who want pictures don't call you make me nervous with your ignorance and make me cryTranslated from Armenian",Nov-25-2022_14-10,,,,https://list.am/en/item/16335173
Stone,No,Not available,4,54 sq.m.,2,1,from 3 m,4,Closed balcony,Not available,Partial Renovation,Aragatsotn › Aparan,"$27,000",USD,"2 bedroom apartment for sale in Aparan city, on the 4/4 floor of a stone building, the area is 54 square meters, the roof is new. Closed balcony connected to the kitchen.Translated from Armenian",Nov-25-2022_14-10,,,,https://list.am/en/item/16305792
Stone,No,Not available,4,57 sq.m.,3,1,from 2.7 m,4,Closed balcony,,Partial Renovation,Aragatsotn › Talin,"7,000,000 ֏",AMD,"Emails have been changed. Wires, water supply and drainage pipes, it is sunny, it has a large closed vault, the roof has been changed.For rent"" 60,000 dramsTranslated from Armenian",Nov-25-2022_14-10,,,,https://list.am/en/item/9641823
Panels,No,Not available,5,76 sq.m.,3,1,from 3 m,2,Closed balcony,,Cosmetic Renovation,"ՌՖԷԻ Գիտավան թաղամաս 6, Աշտարակ","14,000,000 ֏",AMD,"A 3-room apartment is for sale in the city of Ashtarak, in Gitavan district (Gitavan), on the 2nd floor of a 5-story building. For details, call the indicated phone number. Urgent.Translated from Armenian",Nov-25-2022_14-10,,,,https://list.am/en/item/18120171
Stone,No,Not available,2,250 sq.m.,5,1,from 2.8 m,2,Open balcony,,Old Renovation,Aragatsotn › Byurakan,"$50,000",USD,"Urgent two-storey apartment for sale in Byurakan. The apartment is provided with constant gas, water and electricity. It has a very convenient location in the center of the village on the main roadTranslated from Armenian",Nov-25-2022_14-10,,,,https://list.am/en/item/16730502
Stone,No,Not available,3,47 sq.m.,2,1,from 2.8 m,3,Open balcony,,Euro Renovation,Aragatsotn › Ashtarak,"$63,000",USD,"Квартира не сдаётся, Евро ремонт, есть газ, вода, и бакси, продаётся с мебелью, звонить реальным пакупателям. Квартира в аренду не сдаётся, только продаю.",Nov-25-2022_14-10,,,,https://list.am/en/item/15186827
Stone,Yes,Not available,2,47 sq.m.,1,1,from 2.7 m,2,Closed balcony,Not available,Euro Renovation,Aragatsotn › Ashtarak,"$42,000",USD,"1-room apartment for sale in Ashtarak city, ready for occupancy, negotiable, possible exchange with 1-room apartment in 15 quarter, call for details.Translated from Armenian",Nov-25-2022_14-10,,,,https://list.am/en/item/16618991
Stone,No,Not available,5,48 sq.m.,1,2,from 2.8 m,2,Closed balcony,Available,Old Renovation,Aragatsotn › Talin,"$17,000",USD,A warm pasture near Talin CalcioAlong with the propertySuitable for living a lotMarket household building material right in front of the buildingCall the number for detailsTranslated from Armenian,Nov-25-2022_14-10,,,,https://list.am/en/item/17936434
Stone,No,Not available,2,818 sq.m.,5,1,from 3.5 m,2,Open balcony,Available,Euro Renovation,"Մեսրոպ Մաշտոցի փողոց 7, Աշտարակ","$330,000",USD,"For sale: A two-story private house in the city of Ashtarak, at the beginning of Mashtots street, in the center. The house is renovated, in good condition, has a garage, a plot of 600 square meters. Opposite the house there is a shop of 11 square meters, it is possible to increase it by making it 80 square meters. The house has Italian high qualityBaxi system. The house is also convenient to the business centerCall me and I will answer the rest.NEGOTIABLEHouse_269.2 sq. M. M:Shop_25 sq. M. M:Land_536.36 sq. M. M:Enclosure 1.74 sq. M. M:1 q. The price is $400The price of the house is 330,000 dollarsTranslated from Armenian",Nov-25-2022_14-10,OUtdoor parking,"FRidge, stove, washing machine","YArd view, street view, park view",https://list.am/en/item/13323781
Stone,No,Not available,4,56 sq.m.,3,1,from 2.8 m,3,Closed balcony,By agreement,Partial Renovation,"Խանջյան փողոց 12, Թալին քաղաք","$18,000",USD,"The apartment is located at Khanjyan 15/10. It is gasified, the heating is local, the windows are metal-plastic, the entrance door is iron. The apartment is sold together with the property. Negotiable.Translated from Armenian",Nov-25-2022_14-10,,,,https://list.am/en/item/7990441
Stone,No,Not available,4,60 sq.m.,1,1,from 2.8 m,1,Multiple balconies,Available,Partial Renovation,"Khanjyan St, Talin","$12,000",USD,"Also available, call for detailsTranslated from Armenian",Nov-25-2022_14-10,,,,https://list.am/en/item/17494440
Stone,No,Not available,4,50 sq.m.,1,1,from 2.8 m,1,Open balcony,Not available,Partial Renovation,"Աղասի Խանջյանի փողոց 27, Թալին քաղաք","4,300,000 ֏",AMD,"1 room, large balcony which serves as a room, euro windows, gas light water, URGENTTranslated from Armenian",Nov-25-2022_14-10,,,,https://list.am/en/item/17782678
Stone,No,Not available,5,50 sq.m.,1,1,from 2.8 m,2,Open balcony,,Partial Renovation,Aragatsotn › Tsaghkahovit,"$7,000",USD,"One room, located in Tsaghkahovit, with new euro windows, needs renovation, I will exchange it with an equivalent car, call for other questions.Translated from Armenian",Nov-25-2022_14-10,,,,https://list.am/en/item/17905728
Stone,No,Not available,4,75 sq.m.,3,1,from 2.75 m,3,Multiple balconies,,Designer Renovation,Aragatsotn › Aparan,"$14,000",USD,"Located in YernjatapSpacious, pleasant apartment with open and closed balconies. It has constant hot and cold water, electricity, gas. The bathroom and the kitchen are tiled (with expensive Spanish modern tiles, number 2021)It is a nice, comfortable apartment. Bell also with nine. I sell with love, I wish the buyer new success and good enjoymentTranslated from Armenian",Nov-25-2022_14-10,,,,https://list.am/en/item/16701288
Stone,No,Not available,5,70 sq.m.,2,1,from 2.7 m,4,Closed balcony,,Old Renovation,Aragatsotn › Talin,"$18,000",USD,"The apartment is a 2-room apartment with a niche, it is sunny. The apartment has Euro windows.Translated from Armenian",Nov-25-2022_14-10,,,,https://list.am/en/item/18203748
Stone,No,Not available,1,120 sq.m.,3,1,from 2.5 m,1,Not available,,Old Renovation,Aragatsotn › Ujan,"$90,000",USD,"The apartment is located in Ujan, there is a plot of land in the back of the apartment with fruit trees of various types, it is residential and it is located in a residential area. The apartment is sold together with the land. With an area of 30,000 square meters and an area of 2,200 square meters. To get detailed information, call the specified numberTranslated from Armenian",Nov-25-2022_14-10,,,,https://list.am/en/item/18276996
Stone,No,Not available,1,3000 sq.m.,4,1,from 2.75 m,1,Multiple balconies,,Old Renovation,"1-ին խճուղի 21, Քուչակ","$30,000",USD,"The apartment is located next to the highway, it has more than 40 fruit trees, for other details, call the indicated number.Translated from Armenian",Nov-25-2022_14-10,,,,https://list.am/en/item/18194762
Stone,No,Not available,3,36 sq.m.,1,1,from 2.6 m,3,Not available,Available,Cosmetic Renovation,"Улица Тиграна Меца 22А, Аштарак","$27,000",USD,"Продеться однокомнатная квартира в Аштараке, 36.3 квадратных метра, сделан косметический ремонт, здание каменное, цена договорная.",Nov-25-2022_14-10,,,,https://list.am/en/item/17943723
Stone,No,Not available,5,48 sq.m.,1,1,from 3 m,2,Not available,Available,Old Renovation,Aragatsotn › Talin,"$19,000",USD,"Տրվում է նաև վարձով՝թե օրավարձով, թե ամսեկան 50 000դրամ։Սառնհանգույցը նորացված, արևկող, 2 սենյակի հնարավորություն, Երևան հասնելու համար հարմար է Գյումրի_Երևան գնացքը, ամենահամեղ մրգերի տարածք. Ծիրան, դեղձ, խաղող, խնձոր։Կտրվի նաև վարձով։",Nov-25-2022_14-10,,,,https://list.am/en/item/13432713
Stone,No,Not available,1,2000 sq.m.,4,2,from 3 m,1,Closed balcony,Available,Old Renovation,Aragatsotn › Talin,"$25,000",USD,"Arandznstun has 350 carats, newly built barn, drinking water, gas, electricity and a garage.Translated from Armenian",Nov-25-2022_14-10,,,,https://list.am/en/item/15553847
Stone,Yes,Not available,1,700 sq.m.,6,2,from 3 m,1,Closed balcony,Available,Old Renovation,Aragatsotn › Talin,"$30,000",USD,"Arandznatun In Hatsashen village of Aragatsotn region, the 700-square-meter barn is fenced, has gas, light, permanent drinking water.Translated from Armenian",Nov-25-2022_14-10,,,,https://list.am/en/item/15553762
Stone,No,Not available,4,52 sq.m.,2,1,from 2.8 m,3,Closed balcony,By agreement,Partial Renovation,"Nerses Ashtaraketsu square, Ashtarak","$52,000",USD,The apartment is located near the square. 2 rooms converted to 3Translated from Armenian,Nov-25-2022_14-10,,,,https://list.am/en/item/16063307
Stone,No,Not available,3,67 sq.m.,3,1,from 2.8 m,2,Not available,Available,Major Renovation,Aragatsotn › Talin,"$30,000",USD,"Apartment for sale in Tallinn city, on the central street, stone building, 2nd floor, fully renovatedTranslated from Armenian",Nov-25-2022_14-10,,,,https://list.am/en/item/18258188
Stone,No,Not available,5,62 sq.m.,3,1,from 2.8 m,3,Open balcony,,Old Renovation,"Պռոշյան փողոց, Աշտարակ","$50,000",USD,"The apartment is located near Ashtarak Square, the rooms are bright, the ceilings are high, the renovation is old, the buyer can renovate according to his taste. Nearby there are schools, kindergartens, banks, all the necessary infrastructure.Translated from Armenian",Nov-25-2022_14-10,,,,https://list.am/en/item/17920926
Stone,No,Not available,5,76 sq.m.,3,1,from 2.8 m,5,Open balcony,Available,Euro Renovation,"Aram Manukyan street, Ashtarak","$60,000",USD,"Spacious living room հան kitchen, balcony overlooking the bedrooms with a wonderful view.There is permanent water, light, gas supply. The bathroom and the toilet are connected, tiled.Translated from Armenian",Nov-25-2022_14-10,,,,https://list.am/en/item/17357321
Stone,No,Not available,2,70 sq.m.,3,1,from 2.8 m,2,Closed balcony,,Old Renovation,"Hovhannes Shiraz street, Yerevan","$30,000",USD,"The apartment is for sale urgently in Oshakan village, at 16/5 Dprotsakanner Street (in the center of the village)The floor is carpet parquet.Details by callCode 071071ooTranslated from Armenian",Nov-25-2022_14-10,,,,https://list.am/en/item/13415095
Stone,No,Not available,5,53 sq.m.,2,1,from 2.8 m,2,Open balcony,,Partial Renovation,Aragatsotn › Ashtarak,"$40,500",USD,A two room apartment is for sale at an affordable price.Details by call.Code HQ999900Translated from Armenian,Nov-25-2022_14-10,,,,https://list.am/en/item/16784982
Stone,No,Not available,4,60 sq.m.,3,1,from 2.8 m,3,Open balcony,,Old Renovation,Aragatsotn › Aparan,"$16,000",USD,"It is located in Yernjatap. It has a plot of 22 sot next to the house. It has an open and closed balcony, old renovation 2 turned into 3. It is located near the forest, fresh air, very suitable for vacationing as a dacha. The building is located near the highway. The air is very clean and always breezy. Together with Vesher.Translated from Armenian",Nov-25-2022_14-10,,,,https://list.am/en/item/18047953
Stone,No,Not available,5,45 sq.m.,2,1,from 2.7 m,1,Not available,,Cosmetic Renovation,Aragatsotn › Aparan,"18,000,000 ֏",AMD,"A wonderful apartment is for sale in Aparan, the center of the world. It was a 1-room apartment in the previous life, but now we have converted it into 2 rooms. The house has 2 basements, heating is provided by an Electrolux boiler (born in 2021) The entire property is sold with the house. I do not mention the floor, walls, bathroom, etc. , they are well visible in the pictures. Iron front door, Euro windows, sunny side. I consider it necessary to mention the GOOD neighbors, our wonderful people. Price negotiableTranslated from Armenian",Nov-25-2022_14-10,,,,https://list.am/en/item/18034492
Stone,No,Not available,5,48 sq.m.,2,2,from 2.7 m,3,Closed balcony,,Old Renovation,Aragatsotn › Ashtarak,"$38,000",USD,"A 2-room apartment is for sale in Ashtarak, on the 5th/3rd floor of a stone building next to the square. The entrance door is iron, parquet, closed utility balcony, separate bathroom, constant hot and cold water, gas. The sunny side is bright. For other details, please call.Translated from Armenian",Nov-25-2022_14-10,,,,https://list.am/en/item/18194052
Stone,Yes,Not available,5,106 sq.m.,4,1,from 2.7 m,1,Closed balcony,,Cosmetic Renovation,Aragatsotn › Ashtarak,"$59,000",USD,"A 4-room apartment is for sale in Ashtarak, near the supermarket.The apartment is equipped with all amenities, constant drinking water, gas, electricity, cosmetically renovated, windows are euro, bright, sunny, has a basement with two entrances from outside and inside the house.There is a garage, a garden of 90 square meters next to the apartment. Greenery, with fruit trees.Code 0555Translated from Armenian",Nov-25-2022_14-10,,,,https://list.am/en/item/18155832
Stone,No,Not available,1,110 sq.m.,4,1,from 3 m,1,Open balcony,,Major Renovation,Aragatsotn › Aparan,"$65,000",USD,Residential house 110 sq. M.800 sq. M. Fruit servants 30 views Mount AragatsTranslated from Armenian,Nov-25-2022_14-10,,,,https://list.am/en/item/15702345
Panels,No,Not available,5,77 sq.m.,3,2,from 2.7 m,5,Open balcony,,Designer Renovation,Aragatsotn › Ashtarak,"$80,000",USD,"The house is completely renovated, with all facilities, it is sold together with furniture and appliances.Translated from Armenian",Nov-25-2022_14-10,,,,https://list.am/en/item/18004246
Stone,No,Not available,5,64 sq.m.,2,1,from 2.75 m,2,Open balcony,Not available,Partial Renovation,"Տիգրան Մեծի փողոց 19, Աշտարակ","$47,000",USD,"Old renovation, gas, permanent water, changed electric wires, balcony hanging by the signnot for rentCall for other questionsI do not find the pictures meaningfulTranslated from Armenian",Nov-25-2022_14-10,,,,https://list.am/en/item/17279995
Stone,No,Not available,5,74 sq.m.,3,2,from 2.6 m,3,Open balcony,,Old Renovation,"Tigran Mets Street, Ashtarak","$45,000",USD,For more information call! HURRY!Translated from Armenian,Nov-25-2022_14-10,,,,https://list.am/en/item/18216917
Stone,No,Not available,4,56 sq.m.,3,1,from 2.8 m,3,Closed balcony,,Partial Renovation,"Խանջյան փողոց 12, Թալին քաղաք","$17,500",USD,"The apartment is equipped with gas, the heating is local, the windows are metal-plastic, the entrance door is iron. For detailed information, call or write to the given number Viber, Whatsapp.Translated from Armenian",Nov-25-2022_14-10,,,,https://list.am/en/item/18212630
Stone,No,Not available,3,239 sq.m.,5,2,from 3 m,3,Open balcony,,Partial Renovation,Aragatsotn › Karbi,"$53,000",USD,"ARAGATSOTN REGION; COMMUNITY OF KARBI. HOUSE IN KARBI DZOR A private house is for sale in Karbi gorge with an area of 239 sq. M. The house has two bathrooms, a balcony with two magnificent views. The house is built of capital, of good quality, from tuff. The walls are smoothly plastered, the electric wires are of high quality, there is electricity all year round. The house needs cosmetic repairs. Drinking water is held throughout the house. There is a tank with a capacity of 400 liters on the roof. There is a garage from the entrance to the yard. The house and the two plots belong to one owner. CALL WhatsApp. ArmineTranslated from Armenian",Nov-25-2022_14-10,,,,https://list.am/en/item/17945372
