Construction Type,New Construction,Elevator,Floor,Number of Rooms,Number of Bathrooms,Floor Area,Ceiling Height,Balcony,Renovation,Address,Price,Currency,Description,Links
Stone,No,Not available,3 / 3,3,1,78 sq.m.,from 2.6 m,Closed balcony,Partial Renovation,Gegharkunik › Sevan,"$35,000",USD,"The roof has been changed. Euro windows are installed. Water, Sewer and Electricity wires have been changed. Bathroom, Kitchen and Corridor are renovated. Ariston Heating system is installed.I also exchange with my own house in Sevan, Gomadzor, Lchashen, Tsamakaberd.The apartment is located in Kayaran district, Vahagi store building.Translated from Armenian",https://list.am/en/item/18343749
Stone,Yes,Not available,2 / 5,3,1,81 sq.m.,from 2.8 m,Closed balcony,Old Renovation,"Sevan-Martuni Highway 1st lane, Dzoragyugh","$47,000",USD,"3-room apartment is for sale in Gagarin town, located on Xi'an highway, where large development programs are being implemented by international organizations, it will become an eco-tourism zone.The apartment is a Czech project, it has an open and closed balcony.Translated from Armenian",https://list.am/en/item/17912391
Stone,No,Not available,4 / 4,2,1,52 sq.m.,from 2.5 m,Closed balcony,Partial Renovation,Gegharkunik › Martuni,"$23,000",USD,Վաճառվում է 2 սենյականոց բնակարան բարցրահարկ շենքի 4րդ հարկում կան բոլոր բարենպաստ պայմանները մնացաց մանրամասների համար զանգահարել նշված հերախոսահամարով,https://list.am/en/item/18307661
Stone,No,Not available,4 / 5,6,2,124 sq.m.,from 2.8 m,Multiple balconies,No Renovation,"Խաչատուր Աբովյանի փողոց 3, Սևան","$52,000",USD,"Apartment for sale c. In Sevan, on Abovyan street, in the Finnish building, next to the court, close to the 3rd and high schools, there is a kindergarten next to it. The apartment is two-story and is located on the 4th and 5th floors of the building, it is also possible to use the roof (build another floor) It is on the sunny side. It has 2 open balconies, 2 bathrooms, 5 bedrooms, a spacious living room, kitchen, 2 corridors and 2 storage rooms are also available next to the apartment, one of which is located between the 3rd and 4th floors and can be used as a room.The price is negotiable.Translated from Armenian",https://list.am/en/item/18298905
Stone,No,Not available,3 / 3,3,1,70 sq.m.,from 2.7 m,Closed balcony,Old Renovation,Gegharkunik › Chambarak,"$15,000",USD,"Tigran Metsi street, old renovation, the bathroom and the bathroom are tiled, parquet, sunny, gasified, for sale together with the propertyPrice: $15,000Translated from Armenian",https://list.am/en/item/15681622
Stone,No,Not available,1 / 5,4,1,99 sq.m.,from 2.7 m,Closed balcony,Major Renovation,"Ազատության փողոցի 4-րդ փակուղի 1, Գավառ","$26,000",USD,"Quotes.A four-room apartment is for sale in Gavar, near the school. It is in a capitally renovated state, has all the amenities, permanent water, gas, heating as well as a floor-standing oven, a garage and a chat room.Translated from Armenian",https://list.am/en/item/16677844
Stone,No,Available,5 / 5,2,1,63 sq.m.,from 2.8 m,Closed balcony,Cosmetic Renovation,"Պռոշյան փողոց, Մարտունի","$22,000",USD,"A good apartment is for sale urgently. If you have any questions, write to me. The number is not workingTranslated from Armenian",https://list.am/en/item/18339877
Stone,No,Not available,1 / 2,1,1,24 sq.m.,from 3 m,Open balcony,Cosmetic Renovation,"Սայաթ-Նովա փողոց, Սևան","3,900,000 ֏",AMD,It has private and hot and cold water. Call for details.Translated from Armenian,https://list.am/en/item/17419542
Stone,No,Not available,2 / 4,4,1,78 sq.m.,from 2.6 m,Open balcony,Major Renovation,"Erevanyan street, Martuni","$40,000",USD,"The house is in perfect condition, the property and the basement specially prepared for that house also remain with the house. Address Yerevanyan Proshyan 4/3 near Armenian Business Bank, price negotiable.Translated from Armenian",https://list.am/en/item/17121750
Stone,No,Not available,3 / 5,3,1,89 sq.m.,from 2.75 m,Open balcony,Partial Renovation,Gegharkunik › Sevan,"$33,000",USD,"The apartment is in good condition, 3 rooms, high ceiling, balcony on 2 sides, SUNNY, always a bright and very bright apartment, euro windows, wooden doors, for sale together with partial property.Translated from Armenian",https://list.am/en/item/17827367
Stone,No,Not available,3 / 5,3,1,75 sq.m.,from 2.8 m,Open balcony,Old Renovation,Gegharkunik › Gavar,"$19,000",USD,"The apartment is located in Azatutyun 49 (electronics) building, it has a 12-meter garage, it can be sold together with the property, negotiable. For questions, call WhatsApp or ViberTranslated from Armenian",https://list.am/en/item/18233040
Stone,No,Not available,1 / 5,4,2,116 sq.m.,from 2.7 m,Not available,No Renovation,Gegharkunik › Sevan,"$8,000",USD,"The apartment is not renovated.Can be used as a warehouse for other purposes.The total area is 116.77 square meters. The initial number of rooms is 7, just 4 rooms are connected to each other, which you will see in the drawing.The first floor is suitable for various tasks.PRICE NEGOTIABLE Ա AGREEMENT. Carpet:Translated from Armenian",https://list.am/en/item/17200128
Stone,No,Not available,4 / 5,3,1,80 sq.m.,from 2.75 m,Multiple balconies,No Renovation,Gegharkunik › Sevan,,unknown,"European windows, iron doorGas:Light:Water. Hot and coldCity of SEVAN BUILDERS2/17:Negotiable Negotiable NegotiableTranslated from Armenian",https://list.am/en/item/17452984
Stone,No,Not available,5 / 5,4,1,93 sq.m.,from 2.8 m,Closed balcony,Major Renovation,"Улица Саркиса Севанеци 7, Севан","$55,000",USD,"A 4-room apartment is for sale in Xi'an, in 3 micro-districts. It was overhauled 10 years ago with a comfortable shift and interesting solutions. It has not been inhabited for the last 6 years, it is in perfect condition. It is a bright, shiny apartment. It has a separate closet on the roof. Lake Sanaa overlooks the balcony, a 5-10 minute walk to the city beach. The apartment is for sale together with the furniture $ 55,000, without the furniture $ 50,000. For additional questions, call the Russian number (Viber, Whatsapp) or write a message. Do not call the Armenian number, he is not the owner of the house.Price is negotiable.Translated from Armenian",https://list.am/en/item/16938251
Panels,Yes,Available,9 / 9,3,1,78 sq.m.,from 2.75 m,Closed balcony,Cosmetic Renovation,"Sayat Nova street, Sevan town","$40,000",USD,"A 3-room apartment in the city of Sevan is for immediate sale.With utilities (gas, electricity, hot-cold water), euro windows, iron door, Squirrel heating system.The walls are thickenedReady for occupancy.SUN SIDEThe price is negotiableDear people, dear compatriots, proud citizens of Armenia and Artsakh, the apartment is not for rentTranslated from Armenian",https://list.am/en/item/10041738
Stone,No,Not available,2 / 4,2,1,59 sq.m.,from 2.8 m,Closed balcony,Partial Renovation,Gegharkunik › Vardenis,"$15,000",USD,"2 + 1 Room.The apartment is located in the center of Vardenis. A school, a kindergarten, a garden and shops are nearby.The apartment is provided with all the communal amenities. It has a closed balcony that can be used as a room. The bathroom and toilet are fully renovatedTranslated from Armenian",https://list.am/en/item/16927480
Stone,No,Not available,2 / 4,2,1,46 sq.m.,from 2.6 m,Closed balcony,Cosmetic Renovation,Gegharkunik › Chambarak,"$9,000",USD,"The apartment has permanent water and gas, it faces the sun, it has its own basement. It is 15 km away from Lake Sevan, and there are shops, a school, and a hospital next to the apartment. For sale with partial ownership. In case of questions, call the indicated phone number.Translated from Armenian",https://list.am/en/item/18015742
Panels,No,Not available,8 / 9,3,1,80 sq.m.,from 2.8 m,Closed balcony,Old Renovation,Gegharkunik › Sevan,"$36,000",USD,"Բնակարանը գտնվում է բարվոք վիճակում, մանրահատակը խալի պարկետ, սանհանգույցը ունի վերանորոգման կարիք, ունի ավտոտնակ՝ կիսակառույց_ (4×13) չափերով։Գինը սակարկելիԶանգահարել)",https://list.am/en/item/13357332
Stone,No,Not available,1 / 5,3,1,162 sq.m.,from 3.5 m,Not available,Major Renovation,Gegharkunik › Sevan,,unknown,"The guest house includes 2 bedrooms, a kitchen, a bathroom with constant hot and cold water, a living room, a garage for 2 cars. In the bedrooms there is a smart TV, refrigerator, cupboard. An extra bed will be provided if desired. The guest house also has free wifi. Breakfast will be provided if desired. ️ The guest house can accommodate 2 families at the same time. The guest house is about 300 meters away from Lake Sanaa. The guest house is disinfected in accordance with the established procedure. The guest house is located at 22/42 Sargis Sanetsi Street, San.Translated from Armenian",https://list.am/en/item/14463023
Stone,No,Not available,4 / 4,3,1,58 sq.m.,from 2.8 m,Open balcony,Old Renovation,"Hambardzumyan Str, Vardenis","$15,000",USD,"The apartment is bright, on both sides. It is provided with constant hot and cold water. It is in a state condition. (near the college)Translated from Armenian",https://list.am/en/item/17627480
Panels,No,Not available,2 / 5,2,1,47 sq.m.,from 2.7 m,Closed balcony,Euro Renovation,Gegharkunik › Chambarak,"$9,500",USD,"One room + one bedroom apartment for sale. Fully renovated, entrance door of high quality iron, European kitchen furniture, doors. Windows of European production. The bathroom is fully renovated. Has a basement (podval) for questions call the mentioned phone number.Translated from Armenian",https://list.am/en/item/16267293
Stone,No,Not available,1 / 1,3,3+,100 sq.m.,from 2.7 m,Open balcony,Euro Renovation,"Zor. Andranik Str, Gavar","$20,000",USD,Кабелагорцнер 3 сеняаканоц бнакаран 100 каракуси уни100 каракуси патвал тан пес вешера меча ремонта нор,https://list.am/en/item/15707544
Panels,No,Available,4 / 9,4,1,60 sq.m.,from 3 m,Not available,Major Renovation,Gegharkunik › Sevan,"$30,000",USD,"2 bedroom converted to 4 bedroom, very sunny house, exchange with my own house with my additional fee or kindly call for details.Translated from Armenian",https://list.am/en/item/18297728
Stone,No,Not available,1 / 1,4,1,200 sq.m.,from 2.8 m,Not available,Cosmetic Renovation,Gegharkunik › Tsovak,"$27,000",USD,Own house in Tsovak for sale or rentAlong with the propertyIt has a large yardGarageA gardenThe windows are newTranslated from Armenian,https://list.am/en/item/17954842
Panels,Yes,Not available,1 / 4,2,1,65 sq.m.,from 3 m,Open balcony,Euro Renovation,"Main Square, Gavar boundary","8,500,000 ֏",AMD,"An apartment is for sale or rent in Gavar, on the 1st floor of a 4-story building. The apartment has constant water, gas, individual heating. The kitchen and bathroom are tiled, the living room and bedroom are laminate. It has an open balcony, a basement. If you have any questions, callTranslated from Armenian",https://list.am/en/item/18311865
Stone,Yes,Not available,3 / 5,3,1,68 sq.m.,from 2.8 m,Closed balcony,Euro Renovation,"Ազատության փողոցի 4-րդ փակուղի, Գավառ",,unknown,The price is negotiableTranslated from Armenian,https://list.am/en/item/18323251
Panels,No,Available,7 / 9,3,1,81 sq.m.,from 2.7 m,Closed balcony,Old Renovation,"Griboyedov street, Sevan town","$31,000",USD,"City in Sevan, EDSK, old renovation, carpet flooring, euro windows, built-in wardrobes, heating system, permanent water, the apartment is empty, Beautiful view of Sevan, entrance, storage room, cost $ 31,000Translated from Armenian",https://list.am/en/item/17713768
Stone,No,Not available,4 / 4,1,1,36 sq.m.,from 3 m,Open balcony,Partial Renovation,Gegharkunik › Sevan,,unknown,"One room apartment in normal condition, the roof has been changed, the water line, the sewer line has been changed new, it is for sale with property (refrigerator Samsung, gas stove I endezit, water heater Mars, etc.Translated from Armenian",https://list.am/en/item/16778400
Stone,Yes,Not available,3 / 4,3,1,100 sq.m.,from 3.5 m,Multiple balconies,Euro Renovation,Gegharkunik › Sevan,,unknown,"A 3-room apartment is for sale in the city of Sevan in Sayat Nova 18/46 building, on the 3rd floor of a four-story building. Finnish project, has 100 square meters of area, 50 square meters of basement, 10 square meters of separate utility room. Two-sided sunny side, has an individual heating system. The windows are euro, the door is iron. It is also possible to exchange with a 1-room niche or a 2-room niche for an additional fee.Translated from Armenian",https://list.am/en/item/18275183
Stone,No,Not available,5 / 5,1,1,35 sq.m.,from 2.8 m,Closed balcony,Cosmetic Renovation,Gegharkunik › Sevan,,unknown,"One-room apartment is for sale in Shan city. It has a big balcony, which currently serves as a bedroom, it is possible to add it. The apartment is located at 170 Nairyan, in ""Art Dessert Building"". Is ready for accommodation. The price is negotiable.Translated from Armenian",https://list.am/en/item/16465589
Gegharkunik › Sevan,,unknown,"Փնտրվում են բնակարան Սևան քաղաքում, 3,4 կամ 2 սենյակ նիշայով։",,,,,,,,,,,https://list.am/en/item/17423454
Stone,No,Not available,2 / 2,4,1,90 sq.m.,from 2.6 m,Not available,Cosmetic Renovation,Gegharkunik › Vardenis,"$16,000",USD,"The house is located in Shatjrek village. Has all the utilities. For 4 room + kitchen questions, call the mentioned numberTranslated from Armenian",https://list.am/en/item/17949287
Stone,No,Not available,4 / 4,2,1,47 sq.m.,from 2.75 m,Closed balcony,Major Renovation,Gegharkunik › Sevan,"$23,000",USD,"The apartment is in good condition, 2 rooms turned into 3Kitchen furniture is on sale.If you have any questions, call the number mentioned.Translated from Armenian",https://list.am/en/item/17136451
Stone,No,Not available,1 / 5,3,1,68 sq.m.,from 2.7 m,Open balcony,Old Renovation,Gegharkunik › Martuni,"9,710,280 ֏",AMD,"The property is the Bank's collateral, which is in the BANKRUPTCY auction.The real estate at 42 Andranik street, building 7, Martuni city, Gegharkunik region, which has the following description: The walls of the building are tuff stone, the mezzanine roof is o / b slabs, the mezzanine height is 2.7 m, the floor of the apartment is 1st, the area of the apartment is 68, 4 square meters. Renovated, there are communal facilities.You can also purchase the presented property through crediting by the Bank with current credit terms and tariffs.! Attention!The property is encumbered with actual users, whose eviction բոլոր all necessary costs arising from the contract and actions will be performed by the successful bidder.Translated from Armenian",https://list.am/en/item/17914014
Stone,No,Not available,2 / 4,1,1,46 sq.m.,from 2.7 m,Closed balcony,Old Renovation,"Ազատության փողոց, Գավառ",,unknown,One-room apartment with a sign is for sale or exchange.Translated from Armenian,https://list.am/en/item/17543566
Stone,No,Not available,2 / 5,3,1,75 sq.m.,from 2.8 m,Open balcony,Partial Renovation,Gegharkunik › Martuni,"$45,000",USD,"An apartment is for sale in the city of Martuni, constant hot and cold water, heating system, euro windows, it is sold together with furniture and appliances.Translated from Armenian",https://list.am/en/item/18010339
Panels,No,Not available,4 / 4,3,1,70 sq.m.,from 2.7 m,Closed balcony,Cosmetic Renovation,Gegharkunik › Chambarak,"18,000 ֏",AMD,"It is in excellent condition. Call for questions, has all the utilitiesTranslated from Armenian",https://list.am/en/item/17932494
Stone,No,Not available,5 / 5,3,1,71 sq.m.,from 2.8 m,Not available,Old Renovation,Gegharkunik › Gavar,,unknown,"For more information, call the mentioned phone number.Translated from Armenian",https://list.am/en/item/17983986
Stone,No,Not available,3 / 5,3,1,75 sq.m.,from 3 m,Closed balcony,Old Renovation,"Nalbandyan street, Sevan town","$29,000",USD,"Very urgent apartment for sale in K. Sevan Nalbandian 44 apartment is in normal condition, has 2 balconies (closed) on the sunny side, the area is 75 square meters.For more information call. (negotiable)Translated from Armenian",https://list.am/en/item/18246959
Stone,No,Not available,5 / 5,2,1,54 sq.m.,from 2.7 m,Closed balcony,Cosmetic Renovation,"Nairyan Str., Sevan","$35,000",USD,"Stone building, roof repaired, sunny side, closed balcony, 2-3 rooms, has a water yard, gas, water heater, has necessary furniture, sold with all items, has a stone garage, on 7-6, is owned, for sale is with the house. There is a phone number with the same viber number. UrgentTranslated from Armenian",https://list.am/en/item/17265151
Stone,No,Not available,5 / 5,3,1,72 sq.m.,from 2.8 m,Multiple balconies,Old Renovation,Gegharkunik › Vardenis,"$13,000",USD,Call for detailsTranslated from Armenian,https://list.am/en/item/18170432
Stone,Yes,Not available,4 / 4,6,2,137 sq.m.,from 2.8 m,Multiple balconies,Cosmetic Renovation,"Խաչատուր Աբովյանի փողոց 3, Սևան","$55,000",USD,"Apartment for sale in In Syan, on Abovyan Street, in a Finnish building, next to the court, near the 3rd school, there is a kindergarten.The apartment is two-storey and is located on the 4th / 5th floors. It is on the side, has two open balconies, two bathrooms, 4 bedrooms, a spacious living room, a kitchen-corridor, two closets, the possibility of adding one more room, the door is iron. The apartment is for sale with partial property.Q. San, Abovyan 1/15.Translated from Armenian",https://list.am/en/item/17798926
Stone,No,Not available,5 / 5,3,1,76 sq.m.,from 2.8 m,Open balcony,Old Renovation,"Ազատության փողոցի 4-րդ փակուղի 1, Գավառ","$15,000",USD,"The roof is repaired, tiled. The apartment needs renovation. Azatutyan street 54 building 24 aptTranslated from Armenian",https://list.am/en/item/17758770
Stone,No,Not available,4 / 5,3,1,72 sq.m.,from 2.7 m,Closed balcony,Partial Renovation,"Улица Азатутян 46, Гавар","$15,000",USD,"Вачарвуме 3 сеняканоц бнакаран Гавар кахаки Азатуцян похоц 50 шенк 4 арг. Бнакаране аревкохме, така, аранц ремонти. Гуйки ет миасин. Бнакаранум март чи бнаквум. Уни нкух ев кисакаруц автотнак. Гине кам 1500 доллар, кам 800000 рубли.",https://list.am/en/item/15848553
Stone,No,Not available,2 / 4,1,1,48 sq.m.,from 2.7 m,Closed balcony,Old Renovation,Gegharkunik › Gavar,,unknown,"VERY URGENTLY. Sale or exchange with a car. There is light, gas, water. One room with a sign.Translated from Armenian",https://list.am/en/item/16589317
Stone,No,Not available,3 / 3,3,1,65 sq.m.,from 3 m,Closed balcony,Partial Renovation,"Գարեգին Նժդեհի փողոց, Ճամբարակ","$8,000",USD,"The apartment has gas, only the living room is repaired, the roof was damaged due to not living for a long time, the apartment is in the old building under Chambarak hospital, I will adjust the price to the real buyer, I am selling without property, call for questionsTranslated from Armenian",https://list.am/en/item/17505778
Panels,No,Available,2 / 9,3,1,81 sq.m.,from 2.8 m,Closed balcony,Old Renovation,"Գրիբոեդով փողոց, Սևան","14,000,000 ֏",AMD,"The apartment is located on the second floor of a nine-story building, the renovation is old, but it is possible to live in it. The apartment is sunny, there is also property.Translated from Armenian",https://list.am/en/item/17551740
Stone,No,Not available,1 / 5,2,1,45 sq.m.,from 3 m,Not available,Euro Renovation,Gegharkunik › Sevan,"$20,000",USD,"The apartment is located next to the church, it has been renovated, it has a baxi heating system, it is ready to get acquainted with the other advantages of accommodation, you can call the price is negotiableTranslated from Armenian",https://list.am/en/item/16967173
Stone,No,Not available,5 / 5,3,1,77 sq.m.,from 2.8 m,Closed balcony,Old Renovation,"Սայաթ-Նովա փողոց, Սևան","$26,000",USD,"The house is located in the center of Sean, a very beautiful view opens to Lake Sean. The windows of the bedrooms will be replaced with European windows. The apartment is on the other side. Price is negotiable.Translated from Armenian",https://list.am/en/item/17528663
Panels,No,Available,8 / 9,2,1,65 sq.m.,from 2.8 m,Closed balcony,No Renovation,"Nairyan Street, Sevan town","$21,000",USD,"An apartment is for sale in the central part of Sevan, in front of the market. There is gas, permanent water and an intercom. State condition. I am the owner, only real buyers can call.Translated from Armenian",https://list.am/en/item/18282515
Panels,No,Not available,3 / 3,3,1,42 sq.m.,from 2.7 m,Closed balcony,Designer Renovation,"Միքայել Նալբանդյանի փողոց 35, Սևան","$30,000",USD,"The apartment has been renovated, 2 rooms have been changed, 3 rooms have been left, the roof has also been repaired, if you have any questions, please callTranslated from Armenian",https://list.am/en/item/18238192
Stone,No,Not available,2 / 5,2,1,63 sq.m.,from 3 m,Closed balcony,Cosmetic Renovation,Gegharkunik › Chambarak,"$10,000",USD,"The apartment is in good condition, on the 2nd floor, it also has an open balcony, it is provided with all the communal amenities, it is for sale with the existing property, the price is negotiable.Translated from Armenian",https://list.am/en/item/17547910
Stone,No,Not available,1 / 3,2,1,42 sq.m.,from 2.6 m,Not available,Partial Renovation,Gegharkunik › Sevan,"$19,000",USD,Apartment for sale in Shan city. Call the price for negotiable detailsTranslated from Armenian,https://list.am/en/item/17895255
Stone,No,Not available,3 / 4,2,1,50 sq.m.,from 2.75 m,Open balcony,Old Renovation,Gegharkunik › Martuni,"12,490,000 ֏",AMD,"The apartment is located on Myasnikyan street, next to the municipality. For sale together with the furniture. The apartment is in good condition.Translated from Armenian",https://list.am/en/item/16902442
Stone,No,Not available,1 / 3,2,1,48 sq.m.,from 2.7 m,Not available,Partial Renovation,Gegharkunik › Sevan,"$20,000",USD,For sale in Nalbandyan 30 building. Call for questionsTranslated from Armenian,https://list.am/en/item/17897255
Panels,No,Available,1 / 9,4,1,84 sq.m.,from 2.8 m,Closed balcony,Old Renovation,Gegharkunik › Sevan,"$35,000",USD,The apartment is in state condition-gas-waterThere is a basement of 50 square meters-Plot 300-400 sq. M.NEGOTIABLEIt is possible to exchange an apartment with me in Yerevan for an additional feeTranslated from Armenian,https://list.am/en/item/16967571
Stone,Yes,Not available,1 / 5,2,1,47 sq.m.,from 2.8 m,Not available,Designer Renovation,Gegharkunik › Sevan,"$35,000",USD,"One or two room apartment is for sale, it has all the communal facilities,Has a dry basement,For sale together with the kitchen and bedroom furniture, it has an iron doorIt is located 15 minutes by foot near Lake Sanaa. It is a roadTranslated from Armenian",https://list.am/en/item/17325665
Panels,No,Not available,4 / 5,3,1,74 sq.m.,from 2.8 m,Closed balcony,Old Renovation,Gegharkunik › Sevan,"$33,000",USD,"The apartment is located in the 5th micro-district, on the 4th floor of a 5-story building. The apartment faces the sun. The price is negotiable.Translated from Armenian",https://list.am/en/item/18184361
Stone,Yes,Not available,2 / 2,7,2,350 sq.m.,from 3 m,Multiple balconies,Partial Renovation,"Երևանյան փողոց 1, Վարդենիս",,unknown,"Total land 700 sq. M., residential 350 sq. M. Two-storey private house, located on the main street.Translated from Armenian",https://list.am/en/item/17385592
Stone,No,Not available,5 / 5,1,1,47 sq.m.,from 2.75 m,Closed balcony,Old Renovation,"Nairyan Street, Sevan town",,unknown,"A very bright one-room apartment of 47 square meters is for sale on Nairyan Street in Sevan (Czech project) The apartment is located on the 5th/5th floor, has a niche, a closed economic balcony, which can also be easily converted into a bedroom. Old repair. Lake Sevan can be seen from the window. The apartment has a garage in front of the building. The apartment is sold together with the garage. We do not sell separately.The price is negotiableIt is also possible to exchange the apartment with another one-room apartment on the first to third floor. Terms will be discussed on offer.Viber 031685766005Translated from Armenian",https://list.am/en/item/17884883
Panels,No,Available,8 / 9,3,1,83 sq.m.,from 2.75 m,Closed balcony,Old Renovation,Gegharkunik › Sevan,"$35,000",USD,View from the window to the lake. 15 minute leisurely walk to the coast. Price: Negotiable. Call the second number.Translated from Armenian,https://list.am/en/item/18034499
Stone,No,Not available,3 / 5,1,1,46 sq.m.,from 2.8 m,Not available,Cosmetic Renovation,"Նաիրյան փողոց 3, Սևան",,unknown,"One room apartment is for sale, converted into three. The apartment is renovated, the bathroom and the kitchen is tiled, the pipes are completely renovated. It has a heating system. The price is negotiable.Translated from Armenian",https://list.am/en/item/16873001
Stone,No,Not available,4 / 4,2,1,25 sq.m.,from 2.8 m,Not available,Old Renovation,Gegharkunik › Sevan,"$4,000",USD,The apartment is located in the dormitory building.There is no bathroom in the apartment.Translated from Armenian,https://list.am/en/item/17836197
