Construction Type,New Construction,Elevator,Floor,Number of Rooms,Number of Bathrooms,Floor Area,Ceiling Height,Balcony,Renovation,Address,Price,Currency,Description,Links
Stone,Yes,Not available,1 / 5,4,2,109 sq.m.,from 2.75 m,Open balcony,Major Renovation,"Երիտասարդության փողոց, Վարդենիս","$35,000",USD,"A 4-room apartment for sale, on the 1st and 2nd floor of a 5-story stone building/duplex/. The apartmentit is gasified, an individual heating system has been installed for the entire 109.9 square meter two-story area, all the hot and cold water lines have been changed, the bathroom is separated from the bathroom of the residential building. The bathrooms are tiled with Spanish tiles, the interior doors are wooden, the exterior is iron-clad, the windows are Euro, the floor is laminated and tiled. The apartment has 3 bedrooms, 1 dining room connected to the kitchen, 2 bathrooms, 1 of which has a bathtub. The stairs from inside to the 2nd floor are handmade, made of beech and walnut wood. The area of the 1st floor is 36.6 square meters, the 2nd floor is 72 square meters. Entrance door from the 1st floor. You can pay 50% of the amount in advance, the remaining 50% in installments without a bank. For sale without property and equipment. The price is negotiable.Translated from Armenian",https://list.am/en/item/16907726
Stone,No,Not available,2 / 2,2,1,57 sq.m.,from 2.6 m,Closed balcony,Major Renovation,Gegharkunik › Sevan,"$30,000",USD,"An apartment for sale in the city of Sevan, very urgently, newly renovated and uninhabited near the hospital, it has a basement in front of the building, the two windows face the street, the first lineTranslated from Armenian",https://list.am/en/item/18175309
Panels,No,Available,3 / 9,1,1,54 sq.m.,from 2.5 m,Not available,Partial Renovation,"Khachatur Abovyan Street 7, Sevan","$18,000",USD,"A spacious 1-room apartment converted into 2 is for sale. It is sunny, has all utilities, windows and doors are Euro, a water tank with a capacity of 500 liters is installed. In addition to the storage room inside, it also has a large storage room outside. The apartment is close to the kindergarten and the school, ready for occupancy, not for rent.There will also be an exchange with an own house ready for occupancy (in the city of Sevan) with an additional fee from us.Translated from Armenian",https://list.am/en/item/18033928
Stone,Yes,Not available,5 / 5,1,1,47 sq.m.,from 2.7 m,Closed balcony,Euro Renovation,"Nairyan Street, Sevan town","$25,000",USD,"1-room apartment for sale with all amenities renovated in Sjan, on the 5th floor of a 5-storey building, for all questionsThe apartment is for sale together with the propertyTranslated from Armenian",https://list.am/en/item/17279574
Stone,Yes,Not available,4 / 4,3,1,50 sq.m.,from 2.6 m,Multiple balconies,Cosmetic Renovation,"Nalbandyan street, Sevan town","$15,000",USD,"3-room apartment for sale in Sjan (former dormitory) with all amenities (gas, water, light), external door, iron interior doors, wooden windows, for all questions of European production, call the mentioned phone numberTranslated from Armenian",https://list.am/en/item/17320822
Bricks,No,Not available,3 / 5,2,1,65 sq.m.,from 2.7 m,Closed balcony,Old Renovation,"Azatutyan Street 4th Deadlock, Gavar","5,000,000 ֏",AMD,Needs repairFor more information callTranslated from Armenian,https://list.am/en/item/18220226
Stone,No,Not available,1 / 5,2,1,53 sq.m.,from 2.75 m,Closed balcony,Designer Renovation,Gegharkunik › Sevan,"$22,500",USD,"The entrance door is iron, there is a basement from the middle of the house, the windows are euro, the house faces the sun. The building is located 1.5 km from Lake Sevan. For sale very urgently, without an intermediary... Address Griboedov 9 building Sevan...Translated from Armenian",https://list.am/en/item/17255178
Stone,No,Not available,3 / 5,1,1,48 sq.m.,from 2.8 m,Closed balcony,Partial Renovation,Gegharkunik › Chambarak,"$13,000",USD,"The apartment is provided with natural gas, permanent water, is for sale together with the property. Price is negotiable. Call the number marked in the picture.Translated from Armenian",https://list.am/en/item/17539567
Stone,No,Not available,5 / 5,2,2,67 sq.m.,from 3 m,Open balcony,Cosmetic Renovation,"Խ․ Ստեփանյան փողոց, Վարդենիս","$12,000",USD,"Kh, Stepanyan street 19, building 49 apartments, cosmetically renovated, gasified, for sale or rent, for details callTranslated from Armenian",https://list.am/en/item/18075426
Stone,Yes,Not available,4 / 5,2,2,66 sq.m.,from 3 m,Closed balcony,Old Renovation,"Erevanyan street, Martuni","$30,000",USD,"It is gasified, has an open and closed balcony.Translated from Armenian",https://list.am/en/item/17753413
Stone,No,Not available,5 / 5,3,2,71 sq.m.,from 2.7 m,Closed balcony,Cosmetic Renovation,Gegharkunik › Gavar,,unknown,Продается 3 комнатная квартира. Для дополнительной информации звоните по указанному номеру телефона,https://list.am/en/item/17619293
Panels,No,Available,8 / 9,2,1,62 sq.m.,from 2.7 m,Closed balcony,Old Renovation,"Улица Саркиса Севанеци, Севан",,unknown,"Квартира просторная, светлая, есть горячая/холодная вода + бак для воды (1000л) Продается с кухонной мебелью. Адрес: 4 микрорайон, ул. С. Севанеци18/32.P. S. Квартира находиться в 15 мин. От городского пляжа.Բնակարանը վաճառվում է խոհանոցի կահույքով, ունի տաք/սառը ջուր. Մետաղյա մուտքի դուռ ։Հասցե' 4-րդ միկրո, Ս. Սևանեցի 18/32",https://list.am/en/item/17305091
Panels,No,Not available,4 / 5,3,1,74 sq.m.,from 2.75 m,Closed balcony,Old Renovation,Gegharkunik › Sevan,"$33,000",USD,"The house is sunny. It is located in the 5th micro, on the 4th floor of a 5-story building. The price is negotiable.Translated from Armenian",https://list.am/en/item/18184209
Panels,No,Not available,1 / 4,3,1,64 sq.m.,from 2.5 m,Open balcony,Euro Renovation,"Roman street, Vardenis","$20,000",USD,"Продаётся квартира в очень хорошем состояние. Имеется подвал, балкон. Постоянный газ, вода. Все остальные вопросы по телефону.",https://list.am/en/item/18181929
Stone,No,Not available,1 / 5,3,1,48 sq.m.,from 2.75 m,Closed balcony,Cosmetic Renovation,"Սարգիս Սևանեցու փողոց 7, Սևան","$20,000",USD,It is in very good condition. Uninhabited. 1 room turned into 3 rooms.Translated from Armenian,https://list.am/en/item/16898388
Stone,No,Not available,2 / 4,4,1,105 sq.m.,from 3 m,Open balcony,Cosmetic Renovation,"Abovyan street, Sevan town","$44,000",USD,"4-room apartment for sale in Sevan, 105 sq. M. On the 4 / 2nd floor of a residential stone building. The windows are euro, sewer and drinking water pipes are completely changed, heating system (Baxi), permanent water with 300 liter yard, chulan, open balcony, iron front door. #Sevan #qaxaqSevan:Translated from Armenian",https://list.am/en/item/16505258
Stone,No,Not available,4 / 5,3,1,77 sq.m.,from 2.7 m,Closed balcony,Major Renovation,"Nairyan Street, Sevan town","$41,000",USD,"In case of questions, call:Translated from Armenian",https://list.am/en/item/18111875
Stone,No,Not available,3 / 4,4,1,86 sq.m.,from 3 m,Multiple balconies,Partial Renovation,Gegharkunik › Martuni,"$50,000",USD,"An apartment is for sale. It faces the sun, there is a school, a kindergarten nearby. It has constant hot and cold water, there is also gas.Translated from Armenian",https://list.am/en/item/18019667
Stone,No,Not available,5 / 5,4,1,90 sq.m.,from 2.8 m,Multiple balconies,Old Renovation,"Չարենցի փողոց, Վարդենիս","$9,000",USD,"4-room apartment on the fifth floor of a five-story stone building of the Czech project. Not gasified, details by phone.Translated from Armenian",https://list.am/en/item/18161766
Stone,No,Not available,2 / 4,2,1,42 sq.m.,from 3 m,Not available,No Renovation,"Nalbandyan street, Yerevan","$10,000",USD,"2 rooms, clean condition, in the central part of Sevvan city, very close to school, kindergarten, big supermarket, near the bus stop. Write to WhatsApp of the specified numberTranslated from Armenian",https://list.am/en/item/18159489
Stone,No,Not available,2 / 2,2,1,406 sq.m.,from 2.5 m,Not available,No Renovation,"Գ.Միքայելյան 6-րդ նրբանցք 10, Գավառ","8,000,000 ֏",AMD,"Q ․ Gavar, Artsvakar district Ս, Saza փ ․, 3rd lane ․, 3 years ․Two-storey house ․2nd floor room 1 - 42.4 sq. M.2nd floor room 2 - 35.2 sq. M.Basement - 18.8 square metersbarn - 24.6 square metersboiler - 7.52 square metersGreenhouse - 278 sq. M.It is gasified, provided with electricity, has a sewerage line, a well.The price is final!Translated from Armenian",https://list.am/en/item/17927844
Stone,No,Not available,3 / 3,2,1,36 sq.m.,from 2.8 m,Not available,Euro Renovation,"Mamikonyan street 4, Martuni","$20,000",USD,"Վերանորոգված, չբնակեցված",https://list.am/en/item/12361407
Stone,No,Not available,5 / 5,3,1,76 sq.m.,from 3 m,Open balcony,Cosmetic Renovation,"Lernagorts Street, Vardenis","5,200,000 ֏",AMD,"Vardenis ДОМ КВАРТИРА Վաճառվում է բնակարան շատ չոր ու հարմար քաղաք Վարդենիսում պատուհանները եվրո, բաղնիք-զուգարան կապիտալ վերանորոգած, մաքուր ապրելու տունա։ Գտնվումա 5-րդ հարկում արևկող, չի կաթում կրիշը նոր ենք սարգել։ ՌԵԱԼ ԳՆՈՐԴԻՆ ՍԱԿԱՐԿԵԼՒ tnerПродается квартира в очень сухом и благоустроенном городе Варденис, окна евро, ванная-туалет капитально отремонтирована, чистый жилой дом. Находится на 5 этаже крыша отремонтирована. РЕАЛЬНОМУ ПОКУПАТЕЛЮ",https://list.am/en/item/17155412
Stone,No,Not available,2 / 5,2,1,66 sq.m.,from 2.8 m,Multiple balconies,Old Renovation,Gegharkunik › Sevan,"$32,000",USD,The apartment is located in a normal neighborhood... I will negotiate with an urgent realist.Translated from Armenian,https://list.am/en/item/18110326
Panels,Yes,Not available,1 / 4,2,1,65 sq.m.,from 3 m,Open balcony,Euro Renovation,Gegharkunik › Gavar,"8,000,000 ֏",AMD,"An apartment for sale in Gavar city, renovated, uninhabited, equipped with water and gas, has an individual heating system, is in perfect condition. It also has a basement. The floor is laminate, the kitchen and bathroom are tiled. It is also available for rent.Translated from Armenian",https://list.am/en/item/14150010
