Construction Type,New Construction,Elevator,Floor,Number of Rooms,Number of Bathrooms,Floor Area,Ceiling Height,Balcony,Renovation,Address,Price,Currency,Description,Links
Stone,No,Not available,1 / 5,4,1,82 sq.m.,from 2.75 m,Open balcony,Major Renovation,Gegharkunik › Vardenis,"$14,500",USD,A part of the apartment can be used for a small business if you wish.The apartment is located at 29/17 Khachik Stepanyan street in Banavan (pasyolok)NEGOTIABLE.Translated from Armenian,https://list.am/en/item/16701442
Stone,No,Not available,1 / 5,3,1,70 sq.m.,from 3 m,Not available,No Renovation,Gegharkunik › Sevan,"5,500,000 ֏",AMD,"It can serve as both an apartment and a public space, it has 2 entrances from the yard and the road. You can add a balcony. Nalbandian 26/33, Exchange for a car or your own house, land with an additional fee from me or you. Very urgent. Not negotiable.Translated from Armenian",https://list.am/en/item/16012477
Stone,Yes,Not available,5 / 5,2,1,1000 sq.m.,from 3 m,Not available,No Renovation,Gegharkunik › Sevan,"$1,000",USD,I will buy 2 rooms and more apartments in SevanTranslated from Armenian,https://list.am/en/item/17970334
Stone,No,Not available,5 / 5,3,1,72 sq.m.,from 3 m,Open balcony,No Renovation,Gegharkunik › Gavar,,unknown,Մաշտորգի բնակելի։Դռները փայտյա։հարցեր դեպքում զանգեք viber-իս։,https://list.am/en/item/12661736
Stone,No,Not available,4 / 4,4,1,75 sq.m.,from 3 m,Open balcony,Cosmetic Renovation,Gegharkunik › Sevan,"$45,000",USD,"Q. Սևան, փ. Nairyan 153 building 4 floors, 2 open balconies, heating system also exchange with car with G classTranslated from Armenian",https://list.am/en/item/16953198
Stone,Yes,Not available,1 / 5,1,1,47 sq.m.,from 2.8 m,Closed balcony,Euro Renovation,Gegharkunik › Sevan,"$22,000",USD,"1-room apartment for sale, converted into 3-room, Czech project.Renovated, high 1st floor. Located on the 2nd micro, has a large basement, box, 10 minutes away from the lake.Real buyers will call.Translated from Armenian",https://list.am/en/item/17871827
Stone,No,Not available,4 / 5,4,1,91 sq.m.,from 2.8 m,Multiple balconies,Partial Renovation,"Улица Егише Чаренца 48, Варденис","$13,500",USD,"The apartment is located on the 4th floor of a 5-storey building in Vardenis. It is partially renovated, 91 sq. M. There is hot-cold water (with separate water line), gas water heater, kitchen and bathroom tiled, rooms are parquet, 2 balconies, the price includes a mobile garage. For more information callTranslated from Armenian",https://list.am/en/item/16797082
Stone,No,Not available,3 / 3,4,1,100 sq.m.,from 2.8 m,Multiple balconies,Cosmetic Renovation,"Ազատության փողոցի 4-րդ փակուղի 1, Գավառ","8,500,000 ֏",AMD,Iron entrance door. Renovated uninhabited. There is a basement. A partial payment option is possible in two parts.Translated from Armenian,https://list.am/en/item/14726415
Stone,No,Not available,2 / 3,2,1,40 sq.m.,from 2.8 m,Closed balcony,Partial Renovation,"Sayat Nova street, Sevan town","$30,000",USD,"Продаётся квартира в центре г. Севан, дом 3-х этажный каменный, кв. На 2 этаже, 2 комнатная, недавно сделан качественный и красивый ремонт, электрика и все трубы менялись на новые, имеется стиральная машина, газ, холодильник, и вся необходимая мебель для проживания, один взрослый собственник, по всем вопросам звоните, можно оформить ипотекуՎաճառվում է 2 սենյականոց բնակարան, հնարավոր է նաև ձևակերպել հիփոթեքով, արևվկողմ, տաք և հարմարավետ բնակարան, վաճառվում է գույքով, մուտքի դուռն նոր, պատշգամբն մեծացրած, հավելյալ հարցերի դեպքում կարող եք զանգել նշված համարներով",https://list.am/en/item/18334182
Stone,No,Not available,2 / 2,8+,3+,365 sq.m.,from 3.5 m,Not available,Partial Renovation,Gegharkunik › Gegharkunik,$500,USD,"Продаётся участок в районе Варденик. Крыша отремонтирована, окна в европеийском стиле, не имеет внутреннего ремонта. Имеет большой подвал. Вам нужно будет отремонтировать внутри участня: Даже есть возможность создать жительское здание. В случая покупки можете деньги отдавать по частям. По другим вопросам свяжитесь с номер.Просим звонить только реальным покупателям",https://list.am/en/item/17538221
Stone,No,Available,9 / 9,2,1,88 sq.m.,from 2.5 m,Open balcony,Major Renovation,"Sevan street, Yerevan","$26,000",USD,"2 Room Flat near stadium, in Sevan for sale. 1of 9 floorsMajor renovation done. Stone building",https://list.am/en/item/18362565
Panels,No,Not available,2 / 5,1,1,48 sq.m.,from 2.7 m,Closed balcony,Partial Renovation,Gegharkunik › Sevan,"7,500,000 ֏",AMD,"1 room is marked with a sign. Call at Shahumyan 6 for questions, I will call for details, negotiableTranslated from Armenian",https://list.am/en/item/17379413
Panels,No,Available,4 / 9,5,1,82 sq.m.,from 3 m,Open balcony,Partial Renovation,Gegharkunik › Sevan,"$15,000",USD,"The apartment is located on Nalbandyan street, has all the communal facilities, needs renovation. Do not call for an exchange.Translated from Armenian",https://list.am/en/item/17406370
Panels,No,Available,9 / 9,2,1,36 sq.m.,from 2.7 m,Not available,Partial Renovation,"Nalbandyan street, Sevan town","$10,000",USD,"A two room apartment is for sale in Shan city, at 42 Nalbandyan street, the apartment is gasified, has permanent water, the windows are European, the inside door is changed, the outside door is iron, the geyser is renovated, there is a 300 liter water bug, the house has a big kettle.For details, call the mentioned phone number.Translated from Armenian",https://list.am/en/item/17345257
Stone,No,Not available,1 / 2,2,1,60 sq.m.,from 2.8 m,Open balcony,Euro Renovation,Gegharkunik › Sevan,"$20,000",USD,"2-room apartment is for sale in Chkalovka village, Sean city, 1 street, 5 building, 3b. It has all the communal facilities, Euro windows, it is on the side, it has a bathroom, a shower room. The apartment is for sale at a distance of about 200 meters from the lake. It is a comfortable warm apartment ready for accommodation.Translated from Armenian",https://list.am/en/item/17665167
Stone,Yes,Not available,1 / 5,4,1,120 sq.m.,from 2.8 m,Not available,No Renovation,"Սարգիս Սևանեցու փողոց, Սևան","$38,000",USD,"With all communications, BAXI system, Euro windows,School, kindergarten, negotiable, I will also listen to your options.Translated from Armenian",https://list.am/en/item/17218616
Stone,No,Not available,1 / 5,3,1,80 sq.m.,from 3 m,Not available,No Renovation,"Nalbandyan street, Sevan town","$18,000",USD,Հարմար է առևտրի կետ կամ արտադրամաս կազմակերպելու համար,https://list.am/en/item/8588240
Stone,No,Not available,2 / 2,3,1,87 sq.m.,from 2.8 m,Open balcony,Old Renovation,"Sayat Nova street, Martuni","$43,000",USD,"A 3-room apartment for sale in Martuni city /back building of IDEAL/, in front of the apartment there is a private space for a garage, the apartment is not renovated, it has constant gas, electricity, water, the rooms are sunny, there are shops near the area, 2nd floor of a 5-story stone building, details call forTranslated from Armenian",https://list.am/en/item/17450834
Panels,No,Available,4 / 9,4,1,92 sq.m.,from 2.7 m,Closed balcony,Old Renovation,"Khaghagutyan street, Sevan town","$38,000",USD,"A 4-room apartment is for sale in the city of Sevan.The apartment is located close to the lake. It only takes 10-15 minutes to walk to the lakeside. The apartment needs renovation. Grocery and other stores are nearby. For real buyer, price is negotiable.Translated from Armenian",https://list.am/en/item/18227753
Panels,No,Available,1 / 9,2,1,65 sq.m.,from 2.7 m,Closed balcony,Major Renovation,Gegharkunik › Sevan,"$28,000",USD,"2-room, renovated apartment in the city of Sevan, 1st floor, has a basement, the entrance of which is from the balcony of the houseAt the beginning of the city, the building is on the streetthe price is 28,000 dollarsIt is also available on a daily basisTranslated from Armenian",https://list.am/en/item/13650222
Panels,No,Available,8 / 9,3,2,80 sq.m.,from 2.75 m,Closed balcony,Partial Renovation,Gegharkunik › Sevan,"$42,500",USD,"Վաճառվում է բնակարան 3ս. , պատրաստ է բնակեցման, ունի անհատական ջեռուցման համակարգ, պատուհաննեն եվրոպական արտադրության, արևկողմ, լուսավոր ու տաք բնակարան է, վաճառվում է կահույքով (խոհանոց ամբողջ. , ննջասենյակներ ամբողջ. , հյուրասենյակ մասնակի) բնակարանի հետ վաճառվում է նաև խորդանոց վերելակի կողքին։ Պատուհանից բացվում է գեղեցիկ տեսարան դեպի Սևանա լիճը. Մոտակայքում է կա 2 դպրոց և մանկապարտեզ։ Գինը սակարկելի։Продаётся трёх комнатная квартира, готова к проживанию полностью установленное утопление, высокого качества установлены евро окна-стеклопакеты, квартира очень солнечная, светлая и тёплая. Квартира продаётся с мебелью так же с квартирой продаётся отдельная кладовка находящаяся на этаже у лифта. Вид из окна превосходный на озеро Севан, дом находится на расстоянии 1км до берега озёра Севана.",https://list.am/en/item/17375722
Stone,No,Not available,4 / 5,4,1,100 sq.m.,from 3 m,Open balcony,Major Renovation,Gegharkunik › Sevan,"$49,000",USD,"The apartment is located in the central part of Sean city, in front of the market, it is a 5-storey stone building with high ceilings. Address Nairyan 139. The apartment is fully repaired, heating system is installed, all the windows are of European production, Jacuzzi is installed, all the interior doors are made of pure wood. There is a large storage room. Separate water tanks are installed. In a word, all the amenities are available. It is sunny and very bright. The price includes the property partially. URGENTTranslated from Armenian",https://list.am/en/item/17218302
Stone,No,Not available,1 / 2,3,1,70 sq.m.,from 3.5 m,Closed balcony,Euro Renovation,"Nairyan St, Sevan","$30,000",USD,"Վաճառվում է 4 սենյականոց բնակարան Սևան քաղաքում Նաիրյան փ, 181 բն 5, բնակարանը վերանորոգված է, սանհանգույցը և խոհանոցը սալիկապատ, առաստաղի բարձրությունը 3.2 մ, ներկառուցված պահարան, ունի նկուղ ամբողջ բնակարանի տարածքով, գազաֆիկացված է ունի տաք և սառը ջուր բակում քարից ավտոտնակ, ավտոտնակը սեփակաշնորված է, այգի ծառերով, վաճառվում է նաեւ գույքով",https://list.am/en/item/16001488
Stone,No,Not available,3 / 3,1,1,34 sq.m.,from 2.75 m,Open balcony,Old Renovation,Gegharkunik › Chambarak,"2,400,000 ֏",AMD,"The apartment is located at 10/22 of Tigran Mets, it is a sunny, bright and warm house, it has gas, electricity, constant water, Euro doors and windows, it needs repair.Translated from Armenian",https://list.am/en/item/17907665
Panels,Yes,Not available,2 / 4,2,1,65 sq.m.,from 2.8 m,Open balcony,Euro Renovation,Gegharkunik › Gavar,"7,000,000 ֏",AMD,"An apartment is for sale along with the existing property in Gavar city (cable century white 4-storey building), 2-room with a balcony (balcony closed with euro windows), which can be used as a room, euro-renovated, uninhabited, provided with water, gas, electricity, has heating. ""Mercury"" individual system, is in perfect condition. It also has a basement (in the basement part of the building) The floor is laminate, the kitchen and bathroom are tiled. Price without property is different. I will bid for a real buyer. I will exchange 2016-2021. T. (RAV4, Hyundai sonata, KIA) with the car. I will also listen to your suggestions.Translated from Armenian",https://list.am/en/item/16287824
Stone,No,Not available,2 / 5,3,1,75 sq.m.,from 2.8 m,Open balcony,Old Renovation,"Ազատության փողոց 30, Գավառ",,unknown,"Address Azatutyun 35, apt. 29:00The apartment is in good condition, the water lines have been changed, floral parquet, permanent water supply, gasification, it is sold with furniture, it has a stone garage, a porch basement and a workshop (3x8), there is permanent water in the workshop. The price is negotiable.Translated from Armenian",https://list.am/en/item/18127158
Panels,No,Available,9 / 9,2,1,45 sq.m.,from 2.8 m,Closed balcony,Cosmetic Renovation,Gegharkunik › Sevan,"$18,500",USD,"2-room apartment for sale in Xi'an, negotiableTranslated from Armenian",https://list.am/en/item/16955424
Stone,No,Not available,3 / 4,4,1,86 sq.m.,from 2.8 m,Multiple balconies,Partial Renovation,Gegharkunik › Martuni,"$55,000",USD,"A 4-room apartment is for sale, it has constant hot and cold water, gas, a gas boiler, the windows have been changed to Euro, it is very sunny. You can call for details.Translated from Armenian",https://list.am/en/item/18248173
Stone,Yes,Not available,3 / 3,2,1,52 sq.m.,from 2.7 m,Open balcony,Old Renovation,"Lernagorts Street 1, Vardenis","4,200,000 ֏",AMD,"Վաճառվում է 2 սենյականոց բնակարան, քաղաք Վարդենիսում, Լեռնագործների փողոց քարե շենքի 3/3 հարկում, ունի բաց պատշգամբ, մոտակայքում կան խանութներ, մոտ է նաև դպրոցին։ Տանիքը վերանորոգված է։ Կա նաև նկուղ։ Վաճառվում է գույքով և տեխնիկայով։",https://list.am/en/item/13823934
Stone,No,Not available,3 / 5,2,1,47 sq.m.,from 2.8 m,Closed balcony,Euro Renovation,Gegharkunik › Sevan,"$22,000",USD,"A 1-room apartment converted into a 2-room apartment is for sale at 3 Sevan Energetiki street, on the 3rd floor of a 5-story stone building. The apartment is on the sunny side, it is renovated, the bathroom is tiled, it has an individual heating system (Baxi) The price is negotiable. It is also possible to exchange with a 2- or 3-room apartment for an additional fee.Translated from Armenian",https://list.am/en/item/18261498
Panels,No,Available,3 / 9,3,1,81 sq.m.,from 2.8 m,Closed balcony,Old Renovation,"Улица Степана Шаумяна 22, Севан","$35,000",USD,"Продажа 3х комнатной квартиры, хорошое расположение, квартира просторная, есть газ, вода. Для подробной информации звонитеՎաճառվում է 3 սենյականոց բնակարան, բնակարանը ընդարձակ է, կա գազ, ջուր։ Մանրամասն տեղեկությունների համար զանգահարել",https://list.am/en/item/18182909
Stone,No,Not available,1 / 5,3,1,77 sq.m.,from 2.7 m,Multiple balconies,Cosmetic Renovation,"Khaghagutyan street, Sevan town","$35,000",USD,"They live in the apartment, it is not for rent.15 minutes by foot to the lake2nd micro, 6 Peace, sunny apartment, iron entrance door, 2 entrances, one from the yard, one from the back of the building, 2 balconies on both sides of the house, electricity, gas, constant hot and cold water, heated with a gas stove. It has a basement. There is a non-owned garden to the rear which passes with the house to the owner as usufructuary.Translated from Armenian",https://list.am/en/item/15665796
Stone,No,Not available,1 / 3,1,1,38 sq.m.,from 2.8 m,Not available,Old Renovation,"Nalbandyan street, Sevan town","15,000,000 ֏",AMD,"The apartment is suitable for office, shop or other place.Translated from Armenian",https://list.am/en/item/18308302
Stone,No,Not available,1 / 5,3,1,42 sq.m.,from 3 m,Not available,Old Renovation,Gegharkunik › Martuni,"$40,000",USD,Bargain urgently in the city of Martuni. Privatized. Գ. Ziroyan 29 building 44 apartment. Has the opportunity to move forward.Translated from Armenian,https://list.am/en/item/16691996
Panels,No,Available,1 / 9,3,1,80 sq.m.,from 2.8 m,Closed balcony,Cosmetic Renovation,"Գրիբոեդով փողոց 8, Սևան","$35,000",USD,Севанум васнарвум н 3 сениак бнакаран.,https://list.am/en/item/13988455
Panels,No,Available,7 / 9,3,1,80 sq.m.,from 2.7 m,Closed balcony,Old Renovation,Gegharkunik › Sevan,,unknown,"3-room (converted into 4) apartment on Grboyedov street, 7/9 floor, without intermediary. All rooms are parquet. Arrow. View from the bedroom and from the dining room to the lake. 5-10 minutes walk from the apartment to the city beach. Side! The price is negotiable.Translated from Armenian",https://list.am/en/item/17602725
Stone,No,Not available,2 / 2,2,1,57 sq.m.,from 2.6 m,Closed balcony,Major Renovation,Gegharkunik › Sevan,"$28,000",USD,"Продается квартира в Севане, возле зима, новый ремонт",https://list.am/en/item/18174846
Panels,No,Available,7 / 9,2,1,65 sq.m.,from 2.5 m,Closed balcony,Partial Renovation,"Khachatur Abovyan Street, Sevan","$28,000",USD,The apartment has been renovated into 2 and 3 rooms. I exchange with my own house. There is also a garage directly in front of the building.Translated from Armenian,https://list.am/en/item/18011799
Stone,No,Not available,2 / 3,1,1,38 sq.m.,from 2.7 m,Open balcony,Major Renovation,"Nairyan Str., Sevan","$20,000",USD,"It is a sunny, warm apartment, with all utilities (hot water) European renovated, ready to move in. It is sold together with the whole property.Translated from Armenian",https://list.am/en/item/18354204
Stone,No,Not available,2 / 5,2,1,45 sq.m.,from 2.7 m,Open balcony,Major Renovation,"Նաիրյանի 2-րդ նրբանցք, Սևան","100,000 ֏",AMD,"Բնակարանը գտնվում է Սևան քաղաքումԲնակարանը արևկողմ է:Ապահովված է կոմունալ բոլոր հարմարություններով՝բնական գազ,մշտական ջուր,հոսանք,ջեռուցման համակարգ։Բնակարանն տրվում է գույքով եվ ողջ տեխնիկայով:Կա ինտերնետ եվ հեռուստատեսություն:Մոտակայքում է գտնվում տարբեր խանութներ, բանկեր, հաստատություններ:Զանգահարել ռեալ ցանկացողերը կամ Квартира расположена в городе СеванКвартира выходит на солнце.Предоставляется со всеми коммуникациями:Природный газ,постоянная водаТекущий,Система отопления.Квартира обеспечена имуществом и всем оборудованием.Есть интернет и телевидение.Различные магазины, банки, учреждения находятся поблизости.Тем, кто хочет реал, звоните по телефону",https://list.am/en/item/18305800
Panels,No,Not available,5 / 5,3,1,100 sq.m.,from 2.8 m,Closed balcony,Old Renovation,Gegharkunik › Sevan,"$35,000",USD,"The apartment is in normal condition, there are all utilities, there is gas, electricity, water, heating system, call for details.Translated from Armenian",https://list.am/en/item/18249599
Stone,No,Not available,5 / 5,2,1,57 sq.m.,from 2.8 m,Open balcony,Major Renovation,"Nalbandyan street, Sevan town","2,000,000 руб.",RUB,"A 2-room apartment is for sale, on the 5th floor of a 5-story building, it is renovated. For other information, call the indicated phone number.Translated from Armenian",https://list.am/en/item/18119904
Stone,No,Not available,4 / 5,3,1,84 sq.m.,from 2.8 m,Multiple balconies,Cosmetic Renovation,"Երիտասարդության փողոց, Վարդենիս","$15,000",USD,Are you in a good mood? Call urgently for details. UrgentTranslated from Armenian,https://list.am/en/item/18123327
Stone,No,Not available,1 / 5,3,1,63 sq.m.,from 3 m,Open balcony,Partial Renovation,"Main Square, Gavar boundary","$14,000",USD,Վաճառվում է բնակարան կաբելագործների փող. 3-սեն. Գազ. Ջուր. Նորմալ վիճակ ու մեծ նկուղ. Շտապ. Գինը վերջնական... Չի,https://list.am/en/item/14276585
Stone,No,Not available,4 / 4,4,1,75 sq.m.,from 2.8 m,Multiple balconies,Cosmetic Renovation,Gegharkunik › Sevan,"$45,000",USD,"Two apartments (1 room, 34 sq. M. And 2 rooms, 41 sq. M.) Are connected to each other, it has two certificates.Translated from Armenian",https://list.am/en/item/16953523
Gegharkunik › Gavar,,unknown,"1 սենյականոց բնակարան առաջարկեք, ցանկալիա առանց ռեմոնտ, դատարկ, էժան...",,,,,,,,,,,https://list.am/en/item/18145958
Stone,No,Available,1 / 5,1,1,40 sq.m.,from 2.7 m,Closed balcony,Partial Renovation,"Բունիաթյան փողոց 16, Գավառ","$7,500",USD,"Partially renovated, euro windows, kitchen is tiled, gas-fired, kalonka installed, located behind the hospital, balcony serves as a bedroomTranslated from Armenian",https://list.am/en/item/17454831
Bricks,No,Not available,5 / 5,1,1,48 sq.m.,from 2.8 m,Closed balcony,Old Renovation,"Griboyedov street, Sevan town","$12,700",USD,"Расположен в живописном месте, через балкон видно озеро Севан, рядом садик школа, база отдыха. По всем вопросам пишите в сообщении.",https://list.am/en/item/18034467
Stone,No,Not available,4 / 5,1,1,42 sq.m.,from 2.8 m,Open balcony,Old Renovation,"Երիտասարդության փողոց 11, Վարդենիս","2,700,000 ֏",AMD,"A one-room apartment is for sale in Vardenis, near the municipality. On the 4th floor of a 5-story stone building, it has an open balcony. Water supply and electricity are available.Translated from Armenian",https://list.am/en/item/18062654
Stone,No,Not available,5 / 5,2,1,59 sq.m.,from 3 m,Open balcony,Old Renovation,"Բոշնաղյան փողոց 17, Գավառ","$20,000",USD,"The apartment is located in front of the market. Doors and windows of European production, has hot and cold water for details callTranslated from Armenian",https://list.am/en/item/16990792
Stone,No,Not available,5 / 5,4,2,100 sq.m.,from 3 m,Open balcony,Euro Renovation,Gegharkunik › Gavar,"$65,000",USD,An apartment is for sale in the 3rd part together with the property. It has been renovated and is in perfect condition. It is sunny. There is a taxi system. It is sold without property and with property and equipment. It also has a garage. Price: Negotiable.Translated from Armenian,https://list.am/en/item/18238134
Panels,No,Not available,2 / 5,4,1,96 sq.m.,from 2.75 m,Multiple balconies,Major Renovation,Gegharkunik › Vardenis,"$24,500",USD,"The apartment in Vardenis is in perfect condition, there are utilities, there is no work to be done on the house, it is fully equipped, the garage is included in the price.Call the indicated viber hotline numberTranslated from Armenian",https://list.am/en/item/15442138
Stone,No,Not available,5 / 5,1,1,48 sq.m.,from 2.8 m,Closed balcony,Partial Renovation,"Nairyan Street, Sevan town",,unknown,"The apartment has 1 room with niche, high ceiling.Translated from Armenian",https://list.am/en/item/18251015
Stone,No,Not available,3 / 5,1,1,41 sq.m.,from 3 m,Closed balcony,Cosmetic Renovation,"Nalbandyan street, Sevan town","$20,000",USD,"Nalbandyan 12 apartments, 34 boxes, stoneTranslated from Armenian",https://list.am/en/item/16454093
Stone,Yes,Not available,3 / 4,4,1,87 sq.m.,from 3 m,Multiple balconies,Cosmetic Renovation,"Եղիշե Չարենցի փողոց 2, Մարտունի","$42,000",USD,"Call for details, it is also available for rent.Translated from Armenian",https://list.am/en/item/18240435
Stone,No,Not available,1 / 1,3,1,1000 sq.m.,from 3 m,Not available,No Renovation,Gegharkunik › Sevan,"$12,000",USD,Վաճառվում է 3 սեն. Սեփական տուն ՝ավտոտնակի հետ միասին Ծովագյուղում։Ունի Հողատարածք և անասնագոմ: Գինը սակարկելի։ Զանգահարել նշված հեռախոսահամարով։,https://list.am/en/item/13160440
Monolith,No,Not available,1 / 5,4,1,90 sq.m.,from 2.8 m,Open balcony,Cosmetic Renovation,"Nalbandyan street 41, Yerevan","$22,000",USD,"The apartment is located in Shan city, Nalbandyan str. , Has a shop on both sides with its basement, is in a normal living condition Exchange it with an equivalent car;Translated from Armenian",https://list.am/en/item/14665168
